movie_title,movie_year,movie_rating,sex_nudity,violence_gore,language,movie_description
Battle: Los Angeles , 2011 , PG-13 ,2,7,5,"Upon submitting his formal request to retire, a Marine staff sergeant (Aaron Eckhart) is called back to active duty when what initially is thought to be meteors crashing into the oceans around the globe turns out to be extraterrestrial invaders. The battle to save the world begins. Also with Bridget Moynahan, Michelle Rodriguez, Michael Pena, Adetokumboh M. Cormack, Ramon Rodriguez, Taylor Handley, Cory C. Hardrict, Ne-Yo, Jadin Gould and Bryce Cass. Directed by Jonathan Liebesman. [1:56]"
The Battle of Shaker Heights , 2003 , PG-13 ,3,4,5,"Two 17-year-old young men from different social and economic spheres share a passion for re-enacting battle scenes from World War II. Through this connection they befriend each other and they mount their own commando raid against a bully. Meantime, one falls in love with the other's older sister. The film is the second winner of the Project Greenlight screenwriting contest. With Shia LaBeouf, Anson Mount, Shiri Appleby, Elden Henson and Kathleen Quinlan. Directed by Efram Potelle and Kyle Rankin. [1:20]"
Battle of the Sexes , 2017 , PG-13 ,6,2,4,"The real-life story of the 1973 tennis match between Billie Jean King (Emma Stone) and Bobby Riggs (Steve Carell), which was cast as a battle to prove that one gender is athletically superior to the another. Also with Andrea Riseborough, Natalie Morales, Sarah Silverman, Bill Pullman, Alan Cumming, Elisabeth Shue, Fred Armisen, Austin Stowell and Jessica McNamee. Directed by Jonathan Dayton & Valerie Faris. [2:01]"
Battle of the Year , 2013 , PG-13 ,3,3,5,"A man (Josh Holloway) struggling to piece together his life after the tragic death of his wife and son is recruited to coach a Bboy crew and help them qualify for the Battle of the Year, hoping to bring the title home to the USA. Also with Laz Alonso, Josh Peck, Caity Lotz, Chris Brown, Ivan 'Flipz' Velez, Jon 'Do Knock' Cruz, Anis Cheurfa, Jesse 'Casper' Brown, David Shreibman, Sawandi Wilson, Richard Maguire, Steve Terada, Luis Rosado and Joshua Lee Ayers. Directed by Benson Lee. [1:49]"
Battleship , 2012 , PG-13 ,3,6,5,"A multi-national naval exercise is interrupted by an alien invasion. A force field prevents nuclear weapons from attacking the aliens and the survival of the human race depends on figuring out how to battle at sea with conventional weaponry. Based on the Hasbro board game of the same name. With Alexander Skarsgård, Rihanna, Brooklyn Decker, Tadanobu Asano, Hamish Linklater, Liam Neeson, Peter MacNicol, John Tui, Jesse Plemons and Gregory D. Gadson. Directed by Peter Berg. [2:11]"
The Baxter , 2005 , PG-13 ,4,3,5,"Elliot (Michael Showalter) is a mild-mannered accountant and an overall nice guy, who is content to live quietly and alone. One day a woman enters his life, they court for an acceptable period of time, they become engaged, and everything looks hopeful, until he finds a photo in her family album of an ex-boyfriend that she never mentioned and he becomes obsessed with the idea that he will be left at the altar for the ex-boyfriend. Also with Michelle Williams, Elizabeth Banks, Justin Theroux and Peter Dinklage. Directed by Michael Showalter. [1:31]"
Baywatch , 2017 , R ,7,7,10,"The lieutenant of the bay watch patrol (Dwayne Johnson) is hindered by funding cuts, a brash recruit (Zac Efron), and city corruption as he and his team of lifeguards struggle to keep beach visitors safe from riptides, sharks, venomous sea creatures and illegal drugs. Also with Priyanka Chopra, Alexandra Daddario, Kelly Rohrbach, Ilfenesh Hadera and Jon Bash. Directed by Seth Gordon. A few lines of dialogue are in Spanish and beach slang with English subtitles. [1:59]"
The Beach , 2000 , R ,6,8,10,"Based on Alex Garland's novel, it tells the story of a young traveler in Bangkok (Leonardo DiCaprio) who is given a map leading to a mythical paradise island and journeys there with a French couple. Also with Tilda Swinton, Virginie Ledoyen, Guillaume Canet, Robert Carlyle, Staffan Kihlbom, Magnus Lindgren, Victoria Smurfit, Lars Arentz-Hansen, Daniel Caltagirone, Peter Gevisser, Jukka Hiltunen, Simone Huber, Paterson Joseph, Saskia Mulder, Jerry Swindall, Zelda Tinska, Peter Youngblood Hills and Lidia Zovkic. [1:58]"
Bean , 1997 , PG-13 ,3,2,2,Mr. Bean (Rowan Atkinson) travels with a painting to the U.S. and wreaks unintentional havoc.
Bears , 2014 , G ,1,2,0,Disney documentary that follows a family of Alaskan bears as two young cubs develop and learn to survive in the wilderness. Narrated by John C. Reilly. Directed by Alastair Fothergill & Keith Scholey. [1:17]
Beastly , 2011 , PG-13 ,3,5,4,"A contemporary take on the classic tale ""Beauty and the Beast"" set in New York City: A handsome but arrogant and rude teen (Alex Pettyfer) makes the mistake of disrespecting a modern Goth witch (Mary-Kate Olsen) and she casts a spell that deforms his face with tatoos and scars. His father (Peter Krause) sends him to Brooklyn with a blind tutor (Neil Patrick Harris) and while there he rescues a drug addict from death in exchange for the promise that the addict's daughter (Vanessa Hudgens) will live in his house. Also with Lisa Gay Hamilton, Dakota Johnson, Erik Knudsen and Roc LaFortune. Directed by Daniel Barnz. [1:35]"
Beasts of the Southern Wild , 2012 , PG-13 ,3,5,5,"A six-year-old (Quvenzhane Wallis) lives in the Louisiana Delta nicknamed ""The Bathtub"" with her father (Dwight Henry). After a natural disaster and the failing health of her father, the young girl is faced with the reality of creating her own magical life. Also with Levy Easterly, Lowell Landes and Gina Montana. Directed by Benh Zeitlin. [1:31]."
The Beautician and the Beast , 1997 , PG ,2,1,2,Fran Drescher is a beautician who begins tutoring the children of an Eastern European dictator (Timothy Dalton).
Beautiful Creatures , 2013 , PG-13 ,5,5,4,"A young woman (Alice Englert) is a caster of spells who falls in love with a human (Alden Ehrenreich). She must choose to join her family's witch coven or take a new path and that choice is complicated when the young man discovers that his own family harbors dark secrets. Based on the first book in Kami Garcia and Margaret Stohl's eponymous young-adult series. Also with Emma Thompson, Jeremy Irons, Viola Davis, Emmy Rossum and Thomas Mann. Directed by Richard LaGravenese. [2:04]"
Beautiful Girls , 1996 , R ,5,2,7,"A group of guys get together for their high school reunion amidst relationship successes and turmoil. With Timothy Hutton, Matt Dillon, Noah Emmerich, Annabeth Gish, Lauren Holly, Rosie O' Donnell, Mira Sorvino and Uma Thurman."
A Beautiful Mind , 2001 , PG-13 ,4,5,4,"Biopic of the meteoric rise, fall and rise of John Forbes Nash Jr., (Russell Crowe) a math prodigy able to solve problems that baffled brilliant mathematicians. Having made an astonishing discovery early in his career, the arrogant Nash was soon diagnosed with schizophrenia. However, finally, late in life, he received the Nobel Prize. Also with Ed Harris, Jennifer Connelly, Adam Goldberg and Paul Bettany. [2:12]"
Beauty and the Beast , 1991 , G ,2,4,1,"A young woman (voiced of Paige O'Hara), scorned by her neighbors for being intellectually inclined, finds herself imprisoned in a castle by a mysterious beast (voice of Robby Benson) when she tries to save her father. As the two spend more time together they both realize that the feelings they have for each other may uncover the beast's true nature and free him from a horrible curse. Also with the voices of Rex Everhart, Richard White, Jesse Corti, Angela Lansbury, Jerry Orbach and David Ogden Stiers. Directed by Kirk Wise & Gary Trousdale. [1:24]"
Beauty and the Beast , 2017 , PG ,2,4,1,"Live action remake of the 1991 Disney animated feature: A small French village is home to a bookish, kind and unusual girl (Emma Watson) and her inventor father (Kevin Kline), who encounters a nobleman (Dan Stevens) that has been cursed to spend his life looking gruesome unless someone falls in love with him. Also with Luke Evans, Josh Gad, Hattie Morahan, Ewan McGregor, Ian McKellen, Emma Thompson, Nathan Mack, Audra McDonald, Stanley Tucci and Gugu Mbatha-Raw. Directed by Bill Condon. [2:09]"
Beauty Shop , 2005 , PG-13 ,5,2,4,"Queen Latifah stars as a hairdresser who is tired of being pushed around by the owner (Kevin Bacon) of the prestigious, high-priced beauty salon where she works. When she can't take it anymore, she quits and decides to open her own shop. Since she has made a name for herself some of her wealthy clients follow her, but she still faces many obstacles. Alfre Woodard, Alicia Silverstone, Andie MacDowell, Della Reese, Mena Suvari and Djimon Hounsou. Directed by Bille Woodruff. [1:45]"
The Beaver , 2011 , PG-13 ,7,6,5,"A man (Mel Gibson) is depressed and failing as a husband, father and executive. After a brush with suicide, he begins to communicate solely through a beaver hand puppet. Also with Jodie Foster, Anton Yelchin, Cherry Jones and Jennifer Lawrence. Directed by Jodie Foster. [1:31]"
Beavis and Butt-head Do America , 1996 , PG-13 ,3,3,5,The boys from MTV get sucked into a government/law enforcement investigation.
Because I Said So , 2007 , PG-13 ,6,2,4,"An overprotective mother (Diane Keaton) struggles with allowing her youngest daughter (Mandy Moore) to make her own mistakes with regard to love and relationships. In an attempt to help her find Mr. Right, she places a personal ad and arranges a seemingly spontaneous meeting with a successful businessman. But when the daughter meets another man with whom she feels an immediate connection, she decides to juggle the two men, hoping to keep her mother happy and off her back. Also with Gabriel Macht, Tom Everett Scott and Lauren Graham. Directed by Michael Lehmann. [1:42]"
Because of Winn-Dixie , 2005 , PG ,1,3,2,"A young girl (AnnaSophia Robb) and her father (Jeff Daniels) move to a small Florida town, where she has trouble fitting in. A chance meeting at a grocery store begins her relationship with an orphaned dog that brings joy and friendship to her and the rest of the town. Based on Kate DiCamillo's best-selling novel. Also with Elle Fanning, Dave Matthews and Cicely Tyson. Directed by Wayne Wang. [1:46]"
Becoming Jane , 2007 , PG ,4,4,1,"Anne Hathaway stars as a young Jane Austen, an author and independent thinker in 1795, an era when women are expected to keep to their place. She also refuses an arranged marriage that could save her parents from poverty, and intends to marry for love. Also with James Cromwell, Maggie Smith, Julie Waters, Jessica Ashworth, Anna Maxwell Martin, Laurence Fox, Ian Richardson, and Joe Anderson. Directed by Julian Jarrold. [1:52]"
Be Cool , 2005 , PG-13 ,5,5,5,"John Travolta reprises his role as Chili Palmer from 1995's ""Get Shorty"": After becoming successful as a movie producer, former strong-arm debt collector Chili is bitten by the music bug when he hears a young woman (Christina Milian) sing. He decides to try becoming a music promoter for the struggling singer. Then the Russian mafia gets involved. Also with Uma Thurman, Dwayne ""The Rock"" Johnson, Vince Vaughn and Danny DeVito. Directed by F. Gary Gray. [1:54]"
Bedazzled , 2000 , PG-13 ,6,3,3,"In exchange for selling his soul to the Devil (Elizabeth Hurley), a geeky guy (Brendan Fraser) is granted seven wishes, most of which involve winning over his dream girl (Frances O'Connor). Also with Gabriel Casseus, Orlando Jones and Rudolf Martin. [1:30]"
Bed of Roses , 1996 , PG ,2,0,1,"Flower shop owner Christian Slater woos corporate workaholic Mary Stuart Masterson. Also with Pamela Segall, Josh Brolin, Brian Tarantina, Debra Monk, Mary Alice, Kenneth Cranham, Ally Walker and Anne Pitoniak. [1:27]"
Bedtime Stories , 2008 , PG ,3,3,2,"Adam Sandler stars as a maintenance man who dreams of managing a five-star resort hotel, that was built on the site of his father's far more modest hotel. When he has to take care of his young niece and nephew for a few days, he realizes that the bedtime tales they begin spinning have real-life repercussions. Also with Courtney Cox Arquette, Keri Russell, Teresa Palmer, Guy Pearce, Lucy Lawless, Russell Brand, Richard Griffiths, Aisha Tyler and Jonathan Pryce. Directed by Adam Shankman. [1:39]"
Bee Movie , 2008 , PG ,2,2,2,"Jerry Seinfeld provides the voice for Barry Benson, a New York bee, fresh out of college, who is disillusioned at his only possible career choice: making honey. After he strikes up a friendship with a human, he explores the world of humans and is shocked to discover that humans are mass consumers of honey. That's when he decides to sue the human race for stealing the bees' honey. Also with the voices of Annette Bening, Chris Rock, Renee Zellweger, Oprah Winfrey, Ray Liotta, Larry King, Mark Moseley and Rip Torn. Directed by Stephen Hickner & Simon J. Smith. [1:30]"
Beerfest , 2006 , R ,9,6,8,"Two American brothers are given the task of taking their grandfather's ashes to Germany and sprinkling them in his homeland, and they are surprised to uncover family secrets that involve a secret underground beer competition. Receiving a humiliating reception from their German cousins, they return stateside, determined to train and return to Germany in order to win "" Beerfest."" With Paul Soter, Erik Stolhanske, Steve Lemme, Kevin Heffernan and Jay Chandrasekhar. Directed by Chandrasekhar. [1:40]"
Bee Season , 2005 , PG-13 ,6,1,5,"Richard Gere stars as a popular university professor who expects perfection from his family. When his 11-year-old daughter makes it to the finals in a spelling bee contest he becomes obsessed with an idea derived from Jewish mysticism -- that her relationship with letters and words will somehow help her be able to communicate with God. Also with Juliette Binoche, Flora Cross, Max Minghella and Kate Bosworth. Directed by Scott McGehee & David Siegel. [1:44]"
Beethoven , 1992 , PG ,0,2,0,"A family takes in stray St. Bernard puppy, names him Beethoven, grows to love him and ends up pulling together to save him from becoming part of an evil vet's experiment. Charles Grodin stars."
Beethoven's 2nd , 1994 , PG ,1,1,0,"This time Beethoven meets a female St. Bernard, and they have puppies, which are then nabbed and sold for profit. That's when the mayhem begins. With Charles Grodin."
Before and After , 1996 , PG-13 ,4,4,5,Meryl Streep and Liam Neeson are parents with a family falling apart when their son is accused of murder.
Before I Fall , 2017 , PG-13 ,5,4,5,"After dying, a young woman (Zoey Deutch) relives her last day repeatedly. Not clear about what is happening, she eventually figures out what she must do to be freed from this unending loop. Also with Halston Sage, Kian Lawley, Elena Kampouris, Cynthy Wu, Medalion Rahimi, Erica Tremblay and Liv Hewson. Directed by Ry Russo-Young. [1:39]"
Before I Go to Sleep , 2014 , R ,6,6,5,"A woman (Nicole Kidman) struggles with memories that she rebuilds during the day, but are erased when she sleeps. Years earlier she survived a severe head trauma that has left her with amnesia and she can't remember her husband (Colin Firth) or anything else about the last twenty years of her life. Also with Mark Strong, Ben Crompton, Anne-Marie Duff and Adam Levy. Directed by Rowan Joffe. [1:32]"
Before Midnight , 2013 , R ,7,2,8,"Set almost two decades after the first meeting in Before Sunrise and nine years after their relationship blossomed in Before Sunset, a man (Ethan Hawke) and a woman (Julie Delpy) are seen on a vacation in Greece while working through their relationship. Also with Seamus Davey-Fitzpatrick and Ariane Labed. Directed by Richard Linklater. [1:43]"
Before Sunset , 2004 , R ,5,1,5,"Julie Delpy and Ethan Hawke reprise their roles as Celine and Jesse, the young couple that met in Paris and had a passionate one night affair in the film Before Sunrise. It is nine years later, and Jesse is in Paris for a book tour while Celine is an environmental activist. They meet, and get re-acquainted while walking the streets and flowered paths of Paris. Also with Vernon Dobtcheff, Louise Lemoine Torres and Rodolphe Pauly. Directed by Richard Linklater. [1:20]"
Before the Devil Knows You're Dead , 2007 , R ,8,7,10,"Two brothers (Philip Seymour Hoffman and Ethan Hawke) who are short on money decide that robbing their parents' jewelry store in a suburb of New York may be the perfect crime. However, when the robbery attempt is horribly bungled, their lives begin to unravel. Also with Albert Finney, Marisa Tomei, and Aleksa Palladino. Directed by Sidney Lumet. [1:57]"
Begin Again , 2014 , R ,4,3,9,"A woman (Keira Knightley) and her live-in boyfriend (Adam Levine) write songs. When they move to New York City for his album deal with a leading record label, he abandons her for another woman and corporate-guided success. Heartbroken, she considers fleeing to England, but a recording executive emerging from tough times (Mark Ruffalo) discovers her performing in a club and helps her record her own first album. Also with Catherine Keener, Hailee Steinfeld and James Corden. Directed by John Carney. [1:41]"
Beginners , 2011 , R ,7,3,6,The story of a man (Ewan McGregor) who has to come to grips with his father's (Christopher Plummer) terminal illness while still dealing with his feelings about his father's recent revelation that he is gay and has a younger lover. Also with Melanie Laurent and Goran Visnjic. Directed by Mike Mills. [1:44]
The Beguiled , 2017 ,R ,6,6,2,"It's 1864 and a preteen girl takes an injured Union soldier (Colin Farrell) to her Southern all-female boarding school. As sexual tensions rise, girls and two women offer him companionship as they belittle one another and tempers flare. Also with Nicole Kidman, Kirsten Dunst, Elle Fanning, Oona Laurence and Angourie Rice. Directed by Sofia Coppola. A few lines of dialogue are spoken in French with no subtitles or English translations. [1:34]"
Behind Enemy Lines , 2001 , PG-13 ,0,7,5,"Owen Wilson stars as a Navy pilot who's shot down over enemy territory in Southern Europe and fights to survive while waiting to be rescued. Meanwhile, his commanding officer (Gene Hackman) violates his orders and mounts a last-minute, desperate rescue mission. Also with Joaquim de Almeida, David Keith, Olek Krupa, Eyal Podell and Elizabeth P. Perry. [1:45]"
Being Elmo: A Puppeteer's Journey , 2011 , NR ,0,1,1,"The story of Kevin Clash, the puppeteer behind the beloved muppet Elmo of Sesame Street, from his childhood in Baltimore to fulfilling his dream of working with master puppeteer Jim Henson. Includes footage featuring Frank Oz, Jim Henson, Michelle Obama, Kofi Annan, Rosie O'Donnell, Carol Spinney and Whoopi Goldberg. Narrated by Whoopi Goldberg. Directed by Constance Marks. [1:16]"
Being Flynn , 2012 , R ,7,6,10,"Based on a true story: Nick Flynn (Paul Dano) is reacquainted with his father after 18 years of separation when his father Jonathan (Robert De Niro) checks into the homeless shelter where Nick works. A self-proclaimed novelist and con man, Jonathan struggles with an alcohol addiction while his son struggles to avoid following in his father's footsteps. Also with Julianne Moore, Olivia Thirlby, Eddie Rouse and Lili Taylor. Directed by Paul Weitz. [1:42]"
Being Human , 1994 , PG-13 ,4,5,5,"Robin Williams stars in five stories, each one taking place during a different historical period. He's either losing or looking for his family."
Being John Malkovich , 1999 , R ,6,3,7,"John Cusack plays an out-of-work puppeteer who opens ""a metaphysical can of worms"" when he discovers a portal that transports him into the mind of John Malkovich. Also with Cameron Diaz, Catherine Keener, Orson Bean, Mary Kay Place, John Malkovich, Charlie Sheen and W. Earl Brown. [1:52]"
Beirut , 2018 , R ,6,7,8,"A former US diplomat (Jon Hamm) is called back to 1982 Beirut, Lebanon after a CIA operative and friend is kidnapped and he must negotiate his release in an environment separated and dominated by political and religious factions -- Christians, Muslims, the PLO and the Israelis. Also with Rosamund Pike, Mark Pellegrino, Dean Norris, Shea Whigham, Douglas Hodge, Jonny Coyne, Leïla Bekhti, Kate Fleetwood and Idir Chender. Directed by Brad Anderson. Several lines of dialogue are spoken in French and Arabic with and without subtitles. [1:49]"
Bel Ami , 2012 , R ,7,4,5,"Based on the Guy de Maupassant classic, it is the story of journalist Georges Duroy (Robert Pattinson) and his ambition to succeed in Paris. In order to gain success, he manipulates a number of wealthy Parisian women (Uma Thurman, Christina Ricci, Kristin Scott-Thomas and Natalia Tena) and confronts jealousy, love and hate. Also with Colm Meany. Directed by Declan Donnellan & Nick Ormerod. [1:42]"
The Belko Experiment , 2017 , R ,2,10,10,"One day at a Bogota office, 80 employees led by three individuals (John Gallagher Jr., Tony Goldwyn and Adria Arjona) are forced into a social experiment: Trapped inside their high-rise, they are ordered by a voice over the intercom to murder two co-workers within 30 minutes or die themselves. Also with John C. McGinley, Melonie Diaz, Josh Brener and Michael Rooker. Directed by Greg McClean. A few lines of dialogue are spoken in Spanish without translation. [1:28]"
Bella , 2006 , PG-13 ,2,4,1,"A young, unmarried waitress at a Mexican restaurant finds herself pregnant and without work. The restaurant's chef is taken by Nina's plight and helps her decide on what to do with her pregnancy. But he also has secrets since he was a superstar soccer player who left the game and retreated from life and love. With Sophie Nyweide, Eduardo Verastegui, Ramon Rodriguez, Tammy Blanchard and Manny Perez. Directed by Alejandro Gomez Monteverde. [1:31]"
Belle , 2014 , PG ,3,3,2,"Inspired by a Caribbean slave (Gugu Mbatha-Raw), the film follows the life of the illegitimate daughter of a slave and a British Admiral (Mathew Goode). Raised by her great-uncle (Tom Wilkinson), she is privileged, yet still considered beneath whites in social standing. Not permitted to seek suitors, she draws them anyway and meets a vicar's son (Sam Reid) who intends to change 18th century British law and society to end slavery in England. Also with Emily Watson, Sarah Gadon, Miranda Richardson and Penelope Wilton. Directed by Amma Asante. [1:45]"
Beloved , 1998 , R ,9,7,2,"Based on the novel by Toni Morrison and directed by Jonathan Demme, this film features Oprah Winfrey as a former slave who is haunted by her dead daughter's spirit. Also with Danny Glover, Kimberly Elise, Thandie Newton, Beah Richards, Lisa Gay Hamilton, Irma P. Hall, Carol Jean Lewis, Kessia Randall, Anthony Chisholm, Dorothy Love Coates and Jane White. [2:52]"
The Benchwarmers , 2006 , PG-13 ,3,4,4,"Three men have lived their lives in the shadow of bullies, and determined not to take it any more, they train to compete with some of the most offensive and meanest Little League teams. With Rob Schneider, David Spade, Jon Heder, Jon Lovitz and Craig Kilborn. Directed by Dennis Dugan. [1:20]"
Bend it Like Beckham , 2002 , PG-13 ,3,3,4,"British film about a young Indian woman who defies her parents' admonishments to stop playing soccer. Her dream is to be able to play on a professional team, just like her idol, U.K. soccer star David Beckham. But her parents think that she is embarrassing her family and should instead learn how to prepare Indian food and look for a nice Indian boy to marry. With Keira Knightley, Parminder Nagra, Jonathan Rhys Meyers, Anupam Kher and Archie Panjabi. [1:52]"
Ben-Hur , 2016 , PG-13 ,2,6,1,"In this remake Prince Judah Ben Hur (Jack Huston) takes the blame for an assassination attempt on a Roman prefect and his whole family is taken into slavery by his adopted brother, a Roman Centurion (Toby Kebbell). After five years of tortuous punishment in a warship's slave galley, the former prince escapes and finds his way to Jerusalem's Roman circus. Also with Morgan Freeman, Nazanin Boniadi and Rodrigo Santoro. Directed by Timur Bekmambetov. [2:10]"
Benji: Off the Leash , 2004 , PG ,0,4,1,"A man who runs a puppy mill in his backyard is abusive to his wife and son, as well as his dogs. When a female dog becomes ill from over-breeding, one of her puppies does what it can to get her away and save her. With Lincoln Hoppe, Benji, Nick Whitaker, Chris Kendrick and Randall Newsome. Directed by Joe Camp [1:37]"
Benny & Joon , 1993 , PG ,1,2,5,Benny (Aidan Quinn) and his schizophrenic sister Joon (Mary Stuart Masterson) must learn to give each other space when Joon falls in love with her illiterate housekeeper (Johnny Depp).
Beowulf , 2007 , PG-13 ,6,8,4,"CGI animated feature based on the Norse epic poem about the hero who saved a Danish kingdom from a monstrous creature, which was killing and terrifying the people: After dispatching the creature, Beowulf becomes the new king, but the creature's ruthless and seductive mother will use any means to ensure revenge. With the voices of Ray Winstone, Anthony Hopkins, John Malkovich, Robin Wright Penn, Brendan Gleeson and Angelina Jolie. Directed by Robert Zemeckis. [1:53]"
Bernie , 2012 , PG-13 ,3,5,5,"Based on the true story of a beloved assistant funeral director (Jack Black) who began a relationship with a wealthy older woman (Shirley MacLaine), known for her bad attitude, only to end up shooting her and storing her body in the freezer and charitably spending her money until he was caught. Also with Matthew McConaughey. Directed by Richard Linklater. [1:44]"
Besieged , 1999 , R ,5,2,0,"An English man falls in love with an African student who cleans his home and tries to free her wrongfully imprisoned husband. With Thandie Newton, David Thewlis and Claudio Santamaria. [1:32]"
