movie_title,movie_year,movie_rating,sex_nudity,violence_gore,language,movie_description
Aliens in the Attic , 2009 , PG ,3,4,3,"A family takes a vacation to a remote lakeside house and shortly after they unpack, they discover that a group of four miniature aliens has invaded their attic and are bent on destroying all humans. With Carter Jenkins, Henri Young, Regan Young, Ashley Boettcher, Austin Butler, Ashley Tisdale, Doris Roberts, Robert Hoffman, Kevin Nealon, Gillian Vigman and Tim Meadows. Directed by John Schultz. [1:26]"
Aliens of the Deep , 2005 , G ,1,1,0,"Director James Cameron follows marine biologists and other scientists on an undersea expedition in extremely deep waters around the Mid-Ocean Ridge, a submerged mountain range that winds 46,000 miles around the globe. There, in total darkness they find vents on the ocean floor that spew clouds of super-heated water and abundant life -- huge worms, albino crustaceans, and large numbers of blind shrimp. Presented in IMAX 3D, the documentary speculates that life on other planets may resemble these strange creatures. Directed by Cameron & Steven Quale. [0:47]"
Alien: The Director's Cut , 1979/2003 , R ,3,8,5,"It's sometime in the future, and Earth is dominated by corporations. A mining ship returning to Earth responds to an SOS coming from a planet and some members of the crew go to the surface to investigate. But one of them comes back to the ship carrying an alien creature inside him, and soon the alien is loose and bent on making sure no one makes it back to Earth alive. With Sigourney Weaver, Tom Skerritt, John Hurt, Ian Holm and Harry Dean Stanton. Directed by Ridley Scott. [1:57]"
Alien 3 , 1992 , R ,2,8,7,This time out Ripley (Sigourney Weaver) has to confront the alien on a lice-infested prison-planet made up of narrow tunnels.
Alien Vs. Predator , 2004 , PG-13 ,0,8,5,"An expedition team discovers an ancient pyramid deep beneath the ice in Antarctica, where they discover that the two alien races featured previously in the ""Alien"" and ""Predator"" films are engaged in ancient, deadly combat. With Sanaa Lathan, Lance Henriksen, Raoul Bova, Ewen Bremner and Colin Salmon. Directed by Paul W.S. Anderson. [1:27]"
Alive , 1993 , R ,0,7,6,"Ethan Hawke, Vincent Spano and Josh Hamilton star in this real-life drama -- infamous for an incident of cannibalism -- based on the book by Piers Paul Read. The story follows a South American Rugby team after their plane crashes in the Andes Mountains."
All About Steve , 2009 , PG-13 ,5,4,4,"A crossword organizer and single woman (Sandra Bullock) meets a cameraman (Bradley Cooper) who is also single and becomes infatuated with him. Having little else to occupy herself with, she becomes obsessed with finding signs that she believes point to the inevitability of their being together as a couple. However, he thinks she is stalking him and concludes that she must be insane. Also with Thomas Haden Church, Ken Jeong, D.J. Qualls, Howard Hesseman, Keith David, Beth Grant and Katy Mixon. Directed by Phil Traill. [1:38]"
All About the Benjamins , 2002 , R ,4,7,10,"An overworked and underpaid bounty hunter (Ice Cube) dreams of opening his own PI firm and all he needs is money. When the con man (Mike Epps) he's chasing for the third time stumbles onto a diamond smuggling operation, they both see the pot at the end of their respective rainbows. Also with Tommy Flanagan, Anthony Michael Hall and Eva Mendes. [1:34]"
All Eyez on Me , 2017 , R ,7,7,10,"Biopic that follows the life and career of the late Tupac Shakur -- rapper, poet, actor and social activist (Demetrius Shipp Jr.) from his childhood in Harlem to fame to his murder in 1996. Also with Kat Graham, Lauren Cohan, Hill Harper, Kadida Jones and Danai Gurira. Directed by Benny Boom. [2:20]"
Allied , 2016 , R ,6,7,6,"In 1942 a Canadian intelligence officer (Brad Pitt) falls in love with and marries a French Resistance fighter (Marion Cotillard). He then learns that his wife may be a covert agent for the Axis Powers and he must execute her. Unconvinced, he begins his own high risk investigation. Also with Lizzy Caplan, Jared Harris and Matthew Goode. Directed by Robert Zemeckis. Many lines of dialogue are in French with English subtitles and a few lines of dialogue in French and German are not translated. [1:57]"
All Saints , 2017 , PG ,1,3,2,"A paper salesman (John Corbett) becomes an Episcopalian priest and accepts an assignment to close a Tennessee church. After he sees the dwindling congregation accept 15 Karen refugee families from Burma and work with them to farm the property, he helps the church to become self-supporting. Also with Nelson Lee, Cara Buono, Barry Corbin and Gregory Allan Williams. Directed by Steve Gomer. Several lines of dialogue are spoken in Karenic with English subtitles and a hymn is sung without translation. [1:48]"
All the King's Men , 2006 , PG-13 ,4,5,4,"Biopic based on Robert Penn Warren's eponymous novel, which was the fictionalized story of the rise and fall of Louisiana governor Huey Long (and which was the basis for an Oscar-winning 1949 film). Sean Penn stars as ""Boss"" Willie Stark, an ostensibly idealistic Louisiana politician who's not above dirty politics and is eventually corrupted. Also with Jude Law, Kate Winslet, Mark Ruffalo and Anthony Hopkins. Directed by Steven Zaillian. [2:00]"
All the Pretty Horses , 2000 , PG-13 ,3,6,3,"It's 1949 and two young Texans (Matt Damon and Henry Thomas) ride into Mexico looking for cow-herding jobs. Damon falls in love with the daughter (Penelope Cruz) of his wealthy boss but differences of class, status and culture become barriers to their happiness. Based on Cormac McCarthy's novel. Also with Lucas Black, Rubén Blades, Penélope Cruz, Julio Oscar Mechoso, Robert Patrick, Bruce Dern, Sam Shepard, Miriam Colon and Jesse Plemons. [2:15]"
Almost Christmas , 2016 , PG-13 ,3,3,4,"An aging widower (Danny Glover) invites his four adult children and in-laws for Christmas to celebrate the memory of his wife. He hopes that his daughters (Gabrielle Union and Kimberly Elise) and sons (Romany Malco and Jessie T. Usher) will spend five days together without drama, but arguments begin immediately. Also with Omar Epps, John Michael Higgins, Mo'Nique, Nicole Ari Parker and J. B. Smoove. Directed by David E. Talbert. [1:52]"
Almost Famous , 2000 , R ,5,3,8,"A young music journalist (Patrick Fugit) follows a fictional rock band, Stillwater, on tour. Set in the 1970s, the film is based on the exploits of a real music critic who worked for Rolling Stone magazine: Cameron Crowe, who also wrote and directed this film. Also with Kate Hudson, Fairuza Balk, Billy Crudup, Philip Seymour Hoffman, Jason Lee, Anna Paquin, Jimmy Fallon, Frances McDormand, Zooey Deschanel and Noah Taylor. [2:02]"
Aloha , 2015 , PG-13 ,3,3,5,"A USAF veteran and military contractor (Bradley Cooper) leaves government jobs behind to join a billionaire private space agency mogul (Bill Murray). During business in Hawaii, he shuffles love interests old and new, as he confronts angry US military officials. Also with Emma Stone, Rachel McAdams, John Krasinski, Alec Baldwin, Danny McBride and Dennis ""Bumpy"" Kanahele. Directed by Cameron Crowe. [1:45]"
Alone in the Dark , 2005 , R ,6,9,5,"Christian Slater stars as a paranormal investigator who's suffering from memory loss. His most recent investigation reveals that demons worshipped by an ancient people who disappeared 10,000 years ago are again working to destroy civilization. Also with Tara Reid, Stephen Dorff, Mark Acheson and William Sanderson. Directed by Uwe Boll. [1:36]"
Along Came a Spider , 2001 , R ,3,7,5,"A police detective, who is still blaming himself for the death of his partner, is called in on a kidnapping case. Adapted from James Patterson's first novel in the Alex Cross series from which ""Kiss The Girls"" was also adapted in 1997. With Morgan Freeman, Monica Potter, Michael Wincott, Penelope Ann Miller and Michael Moriarty. [1:43]"
Along Came Polly , 2003 , PG-13 ,6,4,4,"Ben Stiller stars as a man who's always playing it safe, trying to avoid any and all risk. But when his new wife dumps him on their honeymoon he's stunned and humiliated and when he meets an adventure-craving, childhood friend named Polly (Jennifer Aniston) he's swept along in a whirlwind of extreme sports, spicy foods, and other dangers. Also with Debra Messing, Philip Seymour Hoffman and Hank Azaria. Directed by John Hamburg. [1:30]"
Alpha and Omega , 2010 , PG ,2,4,1,"A female Alpha wolf and a male Alpha wolf are promised to each other by their fathers in order to unite their packs and make it easier for them to find food. The wolves in question have different ideas, and they fall in love with other wolves that are not Alphas but Omegas. Also with Justin Long, Hayden Panettiere, Christina Ricci, Danny Glover and Dennis Hopper. Directed by Anthony Bell & Ben Gluck. [1:28]"
Alpha Dog , 2007 , R ,8,7,10,"A 19-year-old Los Angeles drug dealer seems to have it all, owning a home and several cars, while spending his days partying with friends. But when one of his friends fails to pay the money he owes him, his solution is to kidnap the man's 15-year-old brother. Events threaten to get out of control, and the lives of many people are affected. With Amanda Seyfried, Justin Timberlake, Anton Yelchin, Bruce Willis, Sharon Stone and Emile Hirsch. Directed by Nick Cassavetes. [1:57]"
Alvin and the Chipmunks , 2007 , PG ,2,3,2,"Live-action/CGI production about the three famous singing chipmunks, based on the original 1961 TV cartoon: The three chipmunk brothers with the squeaky voices, Alvin, Simon, and Theodore, become international pop sensations after being adopted by struggling songwriter (Jason Lee). Also with Cameron Richardson, Jane Lynch, David Cross and Justin Long. Directed by Tim Hill. [1:31]"
Alvin and the Chipmunks: Chip-Wrecked , 2011 , G ,1,3,1,"Dave (Jason Lee) takes his six chipmunks on a cruise on the way to a music awards show. Along the way, the chipmunks end up stranded on an uninhabited island and have to fend for themselves. Also with David Cross, Jenny Slate and the voices of Jesse McCartney, Anna Faris, Justin Long, Matthew Gray Gubler, Amy Poehler, Christina Applegate and Alan Tudyk. Directed by Mike Mitchell. [1:27]"
Alvin and the Chipmunks: The Road Chip , 2015 , PG ,2,3,2,"The Chipmunks discover that their human foster father (Jason Lee) plans to propose to his new girlfriend (Kimberly Williams-Paisley) during a Miami business trip. Alarmed, they enlist the help of the woman's teen son (Josh Green) to go to Florida and stop the engagement. Also with Tony Hale, Redfoo, Bella Thorne and the voices of Justin Long, Matthew Gray Gubler, Jesse McCartney, Kaley Cuoco, Anna Faris and Christina Applegate. Directed by Walt Becker. A few lines of dialogue are in Spanish with English subtitles. [1:26]"
Alvin and the Chipmunks: The Squeakquel , 2009 , PG ,2,3,2,"Alvin and the Chipmunks find themselves without Dave when he is injured and must recuperate in the hospital, and so end up staying with Dave's slacker cousin who couldn't be less interested in them and sends them to school. There they must deal with the bullies on the football team, try to save the music department from budget cuts and do an all or nothing throw-down against the Chipettes. Also with Zachary Levi, David Cross, Jason Lee, Wendie Malick and the voices of Justin Long, Matthew Gray Gubler, Jesse McCartney, Amy Poehler, Anna Faris and Christina Applegate. Directed by Betty Thomas. [1:28]"
Amazing Grace , 2006 , PG ,2,4,2,"The story of William Wilberforce, who spearheaded the abolition of slavery and the slave trade in 18th century England. As a Member of Parliament Wilberforce (Ioan Gruffudd) successfully challenged entrenched interests by assembling a diverse coalition of slavery opponents. Also with Albert Finney, Benedict Cumberbatch, Michael Gambon and Romola Garai. Directed by Michael Apted. [1:51]"
The Amazing Panda Adventure , 1995 , PG ,2,3,1,A boy visits his father in China and helps save a panda cub from poachers.
The Amazing Spider-Man , 2012 , PG-13 ,3,6,4,"Teenager Peter Parker (Andrew Garfield) searches for his father and mother, who disappeared mysteriously when he was a child. Meanwhile, he develops a relationship with a schoolmate (Emma Stone), who is also the local police captain's daughter. His search leads him to radioactive spiders that give him superpowers and confrontations with a super-villain called the Lizard. Also with Rhys Ifans, Denis Leary, Martin Sheen, Sally Field, Irrfan Kahn and Chris Zylka. Directed by Marc Webb. [2:16]"
The Amazing Spider-Man 2 , 2014 , PG-13 ,1,6,3,"Peter Parker, aka Spider-Man (Andrew Garfield), struggles with his identity and the death of his parents and his beloved uncle, while also fighting off evil masterminds. Also with Emma Stone, Jamie Foxx, Dane DeHaan, Colm Feore, Felicity Jones, Paul Giamatti, Sally Field, Embeth Davidtz, Campbell Scott and Marton Csokas. Directed by Marc Webb. [2:22]"
Amelia , 2009 , PG ,4,3,3,"Biopic with Hilary Swank staring as the renowned mid-20th century aviator, Amelia Earhart, who made the first solo flight across the Atlantic and endeavored to circumnavigate the globe but was lost at sea. Also with Richard Gere, Ewan McGregor, Christopher Eccleston, Joe Anderson, Cherry Jones, Mia Wasikowska and Aaron Abrams. Directed by Mira Nair. [1:51]"
Amelie , 2001 , R ,8,4,3,"Highly rated French film about a young woman (Audrey Tautou) who discovers that the way to her own happiness is through helping others find theirs. Anonymously and inventively she straightens out her neighbors' lives by doing small kindnesses for them -- although in some cases, when they deserve it, she dishes out small doses of revenge. Also with Mathieu Kassovitz, Rufus, Lorella Cravotta and Claire Maurier. In French with English subtitles. [2:00]"
The American , 2010 , R ,9,7,5/span>,"A weapons designer and professional assassin (George Clooney) is targeted by a Swedish group, which manages to track him down even after he ends up hiding in a remote Italian village. He begins to wonder whom he can trust and wants to retire, when he meets a prostitute (Violante Placido) and their affection for each other grows. Also with Thekla Reuten, Paolo Bonacelli, Irina Bjorklund, Johan Leysen, Filippo Timi and Anna Foglietta. Directed by Anton Corbijn. In English and some Italian with English subtitles. [1:35]"
American Assassin , 2017 , R ,6,8,8,"A man (Dylan O'Brien) determined to avenge the murder of his fiancée joins an elite counter-terrorism group to track down those responsible and he is trained as an assassin by a former Navy SEAL (Michael Keaton). Also with David Suchet, Sanaa Lathan, Taylor Kitsch, Scott Adkins, Shiva Negar and Charlotte Vega. Directed by Michael Cuesta. Several lines of dialogue are spoken in Turkish with English subtitles and others are written in Arabic with English subtitles; a few lines are spoken in Arabic with no translation. [1:51]"
American Beauty , 1999 , R ,8,6,7,"A journey through life in suburban America starring unhappily-married Kevin Spacey and Annette Bening. Also with Thora Birch, Wes Bentley, Mena Suvari, Peter Gallagher, Allison Janney, Scott Bakula, Sam Robards and Chris Cooper."
An American Carol , 2008 , PG-13 ,4,5,4,"Kevin Farley stars as a Michael Moore-like documentary filmmaker, who is on a crusade to abolish the 4th of July. The spirits of General George S. Patton, and Presidents George Washington and John Kennedy, visit him to convince him he's unpatriotic. With Kelsey Grammer, Jon Voight, Trace Adkins, James Woods, Leslie Nielsen, Dennis Hopper, Kevin Farley and Travis Schuldt. Directed by David Zucker. [1:23]"
American Dreamz , 2006 , PG-13 ,4,4,5,"A political satire that also takes on ""American Idol"": A popular talent show is hosted by a sleazy presenter (Hugh Grant) who chooses contestants for particular oddities -- such as a southern girl (Mandy Moore) whose boyfriend (Chris Klein) is a wounded Iraq war veteran, an Iraqi terrorist (Sam Golzari) whose only wish is to sing show tunes, and a Jewish rapper (Adam Busch). Into this mix steps the U.S. President (Dennis Quaid) as a guest judge -- depicted as a totally uninformed and disinterested figurehead, he is only interested in improving his ratings. Also with Willem Dafoe, Marcia Gay Harden and Sam Golzari. Directed by Paul Weitz. [1:47]"
American Gangster , 2007 , R ,8,9,10,"In 1970s New Jersey, detective Richie Roberts (Russell Crowe) investigates the elusive Frank Lucas (Denzel Washington), a heroin kingpin whose innovative business strategies revolutionized the drug trade. Having traveled to Asia's Golden Triangle in order to make connections, Lucas used the coffins of soldiers killed in Vietnam to smuggle heroin into the U.S. Also with Chiwetel Ejiofor, Josh Brolin, Ted Levine and Lymari Nadal. Directed by Ridley Scott. [2:37]"
An American Haunting , 2006 , PG-13 ,5,6,2,"Advertised as being based on supposedly true events that took place during the 1820s, and validated by the State of Tennessee, the film depicts the strange occurrences that beset a teenage girl and her wealthy family, after a business arrangement goes sour. Convinced that they have been cursed, the family tries prayer to get rid of a supernatural entity, but to no avail. With Donald Sutherland, Sissy Spacek, Rachel Hurd Wood, James D'Arcy and Matthew Marsh. Directed by Courtney Solomon. [1:30]"
American History X , 1998 , R ,7,10,10,"Edward Norton is a former skinhead whose racist and violent acts land him in jail and also influence his brother (Edward Furlong) to adopt the same lifestyle. When the reformed Norton is released, he tries to teach Furlong the error of his ways. Elliott Gould, Stacy Keach, Avery Brooks, Beverly D'Angelo and Fairuza Balk co-star."
American Hustle , 2013 , R ,6,4,10,"A fictionalized account of the late 1970s Abscam scandal: When a small time con man (Christian Bale) is forced to work with the FBI to avoid being convicted, he and his sultry cohort (Amy Adams) are drawn into an agent's (Bradley Cooper) bizarre plan to take down federal officials. Also with Jeremy Renner, Jennifer Lawrence, Louis C.K., Jack Huston, Michael Peña and Shea Whigham. Directed by David O. Russell. [2:18]"
American Made , 2017 , R ,6,6,10,"Based on a true story: a TWA airline pilot (Tom Cruise) in the 1970s is offered a job with the CIA with increasingly risky responsibilities gathering intelligence on South American officials and delivering weapons. Also with Domhnall Gleeson, Sarah Wright, Jesse Plemons, Caleb Landry Jones, Alejandro Edda and Mauricio Mejía. Directed by Doug Liman. Several lines of dialogue are spoken in Spanish with English subtitles. [1:55]"
American Me , 1992 , R ,8,9,6,"Edward James Olmos stars in and directed this Horatio Alger story gone bad about drugs, prison life and gang wars."
American Movie , 1999 , R ,1,5,10,"Documentary of wannabe filmmaker Mark Borchardt's efforts to finance and shoot the low-budget horror flick ""Coven."" Also with Joan Petrie, Mike Schank, Bill Borchardt, Monica Borchardt and Cliff Borchardt. [1:47]"
American Outlaws , 2001 , PG-13 ,3,6,4,"This fictionalized telling of the Jesse James saga presents the Old West outlaw and his gang as men who've been wronged by the Yankee railroad barons and they now exact rightful, wrathful revenge by robbing banks. Colin Farrell stars as Jesse, Gabriel Macht is Shakespeare-quoting Frank James and Scott Caan is Cole Younger. Also with Ali Larter, Timothy Dalton, Will McCormack, Gregory Smith, Kathy Bates, Nathaniel Arcand, Craig Erickson and Ty O'Neal. [1:35]"
American Pie , 1999 , R ,9,2,8,"A coming-of-age tale about four high school seniors who make a pact that they will all lose their virginity on prom night. With Jason Biggs, Thomas Ian Nicholas, Chris Klein, Eddie Kaye Thomas, Natasha Lyonne, Tara Reid, Mena Suvari, Shannon Elizabeth, Alyson Hannigan, Sean William Scott, Eugene Levy, Chris Owen, Thomas DeLonge, Mark Hoppus, Travis Barker, Jennifer Coolidge, James DeBello, Eli Marienthal and Woody Schultz. [1:35]"
American Pie 2 , 2001 , R ,8,3,7,"The characters from the 1999 film return for more escapades. This time they reunite for summer vacation after a year in college. Several subplots involve spying on two women, having to say goodbye to girlfriends or boyfriends, and getting a beach house. With Jason Biggs, Jennifer Coolidge, Shannon Elizabeth, Chris Klein, Alyson Hannigan, Thomas Ian Nicholas, Eugene Levy, Natasha Lyonne, Chris Owen, Tara Reid, Seann William Scott, Mena Suvari and Eddie Kaye Thomas. [1:44]"
The American President , 1995 , PG-13 ,2,1,5,"Michael Douglas plays a President and a widower who falls in love with environmental lobbyist Annette Bening. Co-starring Martin Sheen, Michael J. Fox, Samantha Mathis, David Paymer and Richard Dreyfuss. Directed by Rob Reiner."
American Psycho , 2000 , R ,10,9,8,"Based on Bret Easton Ellis's novel, this black comedy/horror film takes place in the 80s and focuses on a morally and emotionally bankrupt broker turned serial killer played by Christian Bale. Also with Willem Dafoe, Jared Leto, Reese Witherspoon, Samantha Mathis, Chloe Sevigny, Justin Theroux, Josh Lucas, Guinevere Turner, Matt Ross, William Sage and Cara Seymour; directed by Mary Harron. [1:37]"
American Reunion , 2012 , R ,8,3,9,"The same group of friends from the series ""American Pie"" return for their high school reunion 13 years later. Some have intimacy issues, maturity issues and marital strains and the rekindling of old love affairs and sexual escapades ensues. With Jason Biggs, Alyson Hannigan, Chris Klein, Thomas Ian Nicholas, Tara Reid, Seann William Scott, Mena Suvari, Eddie Kaye Thomas, John Cho, Jennifer Coolidge, Eugene Levy, Natasha Lyonne and Dania Ramirez. Directed by Jon Hurwitz & Hayden Schlossberg. [1:53]"
An American Rhapsody , 2001 , PG-13 ,3,4,3,"The film is autobiographical, based on the life of writer-director Éva Gardos: During the coldest days of the Cold War, a Hungarian family sacrifices everything to escape to America. The parents (Nastassja Kinski and Tony Goldwyn) reluctantly leave their infant daughter behind, believing they'll be reunited soon. But it takes six years, and the young girl grows into a rebellious teenager (Scarlett Johansson) frustrated by the unanswered questions about her early years spent in Hungary. So back she goes, crossing the border once again, on her own terms, to resolve her past. Also with Mae Whitman, Kelly Endresz-Banlaki and Agi Banfalvy. The early scenes in Hungary are subtitled in English. [1:46]"
American Sniper , 2014 , R ,3,8,10,"Based on the true story: Chris Kyle (Bradley Cooper), a Navy SEAL and decorated sniper, returns to his family after four tours and struggles to regain his footing. Also with Sienna Miller, E.R. Ruiz, Luke Grimes, Jake McDorman, Max Charles, Brian Hallisay, Kyle Gallner and Keir O'Donnell. Directed by Clint Eastwood. [2:12]"
American Splendor , 2003 , R ,3,4,5,"Film based on the life of underground comic book writer Harvey Pekar: We see through cartoons and live action his life while he struggles professionally, he meets his wife, survives cancer treatments and becomes a cultural icon. While Paul Giamatti stars as Pekar, the real Pekar also shows up to set scenes and elucidate events. Also with Hope Davis, James Urbaniak and Judah Friedlander. Directed by Shari Springer Berman, Bob Pulcini and Robert Pulcini. [1:40]"
American Teen , 2008 , PG-13 ,3,4,5,"Documentary about the 2006 Warsaw, Indiana graduating class, concentrating on five of the students, whose dreams for a promising future play out during their senior year. Directed by Nanette Burstein. [1:35]"
American Ultra , 2015 , R ,3,8,10,"A West Virginia slacker's (Jesse Eisenberg) life consists of smoking marijuana, slouching through his convenience store job, and writing a comic book about an ape superhero. Buried in his subconscious is the fact that he is a lethal sleeper agent for the CIA and when he's scheduled to be eliminated one of its project leaders activates his fighting skills with a hypnotic phrase. He becomes a weapon, but also discovers a secret about his girlfriend (Kristen Stewart). Also with Topher Grace, Connie Britton. Walton Groggins, John Leguizamo, Bill Pullman and Tony Hale. Directed by Nima Nourizadeh. The film contains several lines of dialogue in Chinese with English subtitles. [1:35]"
American Wedding , 2003 , R ,7,3,10,"The kids from ""American Pie"" are all young adults now and perhaps ready to settle down. Indeed, one couple (Jason Biggs and Alyson Hannigan) is getting married but first they have to survive a bachelor party and all manner of other traditional and untraditional rites. Meanwhile, the groom struggles to keep his bride-to-be from getting too anxious. Also with Eugene Levy, January Jones and Seann William Scott. Directed by Jesse Dylan. [1:35]"
America's Heart and Soul , 2004 , PG ,3,3,1,"Documentary filmmaker Louis Schwartzberg travels America from shore to shore, photographing the landscape and celebrating ordinary people whose lives are devoted to their distinct passions: A black woman who sings gospel, a blind man who climbs mountains, a dairy farmer who's a part-time actor in community theater, an ex-convict who became the captain of America's Olympic boxing team, a man who loves shooting stuff with a cannon, and other busy individualists. With Roudy Roudebush, Ann Savoy, Marc Savoy, Mosie Burks and Minnie Bates Yancey. [1:24]"
