movie_title,movie_year,movie_rating,sex_nudity,violence_gore,language,movie_description
The Best Exotic Marigold Hotel , 2012 , PG-13 ,4,3,5,"Several retired English men and women, including a newly widowed woman (Judi Dench), a couple (Bill Nighy and Penelope Wilton) that has lost its savings, a woman (Maggie Smith) with no family and no job and nervously awaiting a hip replacement, a judge (Tom Wilkinson) returning to his childhood home, a man (Ronald Pickup) looking for a new life and a new woman and a multiple divorcée (Celia Imrie) looking for a new husband travel to India to try out a ritzy new retirement hotel. When they arrive, they find it's not so ritzy. Also with Dev Patel, Tena Desae and Diana Hardcastle. Directed by John Madden. [2:04]"
Best in Show , 2000 , PG-13 ,4,2,3,"A documentary-style comedy following several eccentric dog owners and their beloved pets as they compete for the coveted Mayflower Dog Show Cup. With Christopher Guest, Parker Posey, Michael Hitchcock, Eugene Levy, Catherine O'Hara, John Michael Higgins, Michael McKean, Patrick Cranshaw, Jennifer Coolidge, Jane Lynch, Bob Balaban, Don Lake, Jim Piddock, Fred Willard and Ed Begley Jr. [1:30]"
The Best Man , 1999 , R ,7,4,8,"A writer attending his friends' wedding tries to stop them from reading his first novel, which reveals a secret that could put a halt to their upcoming nuptials. With Taye Diggs, Nia Long, Morris Chestnut, Harold Perrineau Jr., Terrence Dashon Howard, Sanaa Lathan, Monica Calhoun, Melissa DeSousa and Victoria Dillard. [1:58]"
The Best Man Holiday , 2013 , R ,6,4,6,"In this sequel to ""The Best Man,"" college friends (Taye Diggs, Terrence Howard, Harold Perrineau, Morris Chestnut, Sanaa Lathan, Nia Long, and Regina Hall) decide to celebrate the Christmas holidays together after 15 years. Old rivalries and love affairs soon flicker back to life. Also with Monica Calhoun and Melissa DeSousa. Directed by Malcolm D. Lee. [1:50]"
The Best of Me , 2014 , PG-13 ,5,6,5,"A man (James Marsden) and a woman (Michelle Monaghan) meet and fall in love in high school (their younger versions are played by Luke Bracey and Liana Liberato) but separate because of her wealthy, disapproving parents and his criminal, drug-dealing family. Twenty years later they meet unexpectedly in their old hometown for the funeral of an old friend but before their love can be rekindled they have to deal with more complications. Also with Gerald McRaney, Caroline Goodall and Sean Bridgers. Directed by Michael Hoffman. [1:58]"
Best of the Best 2 , 1993 , R ,1,7,5,Martial arts movie with Eric Roberts and Phillip Rhee as the good guys who avenge a friend's death by taking on the bad guy who killed him.
The Best of Youth , 2005 , R ,6,5,5,"Italian film that follows two brothers between 1966-2003 and shows how the choices they made affected the course of their lives: The free-spirited Nicola (Luigi Lo Cascio) travels the world and becomes a successful psychiatrist, while his introverted and idealistic brother Matteo (Alessio Boni) becomes a police officer, hoping to right society's wrongs. Also with Adriana Asti, Sonia Bergamasco and Fabrizio Gifuni. Directed by Marco Tullio Giordana. In Italian with English subtitles. [6:06]"
The Better Angels , 2014 , PG ,1,4,1,"A look at the childhood years of Abraham Lincoln (Braydon Denney) and the harsh realities of survival and loss. Also with Jason Clarke, Diane Kruger, Brit Marling, Wes Bentley, Cameron Mitchell Williams, McKenzie Blankenship, Ryan McFall, Madison Stiltner, Bruce Bayard and Veanne Cox. Directed by A.J. Edwards. [1:35]"
A Better Life , 2011 , PG-13 ,3,5,5,"An illegal immigrant from Mexico (Demian Bichir) fights to raise his teenage son by himself in East LA. While trying to keep his son out of gangs and give him the life he never had, he must struggle to provide for his family without being caught by American immigration authorities. Also with Jose Julian and Eddie ""Piolin"" Sotelo. Directed by Chris Weitz. [1:38]"
Better Luck Tomorrow , 2003 , R ,7,6,10,"A small group of talented and ambitious Asian-American high school students discovers what the phrase ""power corrupts"" really means when they find ingenious ways to make money by taking advantage of their fellow students. However, this sense of power and the greed it begets are more than some of them can handle. With Parry Shen, Jason J. Tobin, Sung Kang, Roger Fan and John Cho. [1:40]"
The Beverly Hillbillies , 1993 , PG ,0,2,4,"Based on the popular 1960's television series, the story begins when Jed (Jim Varney) strikes oil behind his Ozark mountain shack and becomes an instant billionaire. Yearning for some sophistication, he hauls his family off to Beverly Hills. With Erika Eleniak and Lily Tomlin."
Beverly Hills Chihuahua , 2008 , PG ,2,4,3,"A rich Chihuahua (voiced by Drew Barrymore) becomes totally lost in the streets of Mexico City and does not know what to do without life's luxuries. Finally choosing survival over conspicuous consumption, she makes friends with poor dogs, including a former K-9 unit German shepherd (voiced by Andy Garcia). Her gardener's dog (voiced by George Lopez) and his owner come to her rescue after a long search. Also with the voices of Piper Perabo, Manolo Cardona, Cheech Marin, Paul Rodriguez, Jamie Lee Curtis, Placido Domingo and Edward James Olmos. Directed by Raja Gosnell. [1:31]"
Beverly Hills Cop III , 1994 , R ,2,6,6,"Eddie Murphy reprises his role as Axel Foley, wise cracking cop, who, this time out, does battle with the bad guys in an amusement park."
Beverly Hills Ninja , 1997 , PG-13 ,2,4,3,"Chris Farley is a klutzy, inept ninja wannabe in this action comedy."
Bewitched , 2005 , PG-13 ,4,3,3,"Nicole Kidman stars as a real-life witch who is trying to break the habit of using magic. In the process she meets a self-centered actor, played by Will Ferrell, who is cast to play Darren Stevens in a remake of the '60s ""Bewitched"" TV series. When he sees Isabelle twitch her nose, he decides that she is the only one for the part of Samantha, not realizing that she's a genuine witch. Also with Shirley MacLaine, Michael Caine and Steve Carell. Directed by Nora Ephron. [1:30]"
Beyond Borders , 2003 , R ,4,8,7,"A wealthy socialite (Angelina Jolie) is overwhelmed by the plight of the starving and abused people of Ethiopia. In an effort to make some difference in their lives, she travels to Africa with food and medicine, and is confronted by a cynical doctor (Clive Owen) who's suffering from the pain and loss he sees all around him. She must now decide whether to commit herself to trying to help or to return to her privileged life. Also with Noah Emmerich, Teri Polo and Linus Roache. Directed by Martin Campbell. [2:07]"
Beyond Rangoon , 1995 , R ,0,5,2,An American woman (Patricia Arquette) travels to Burma and finds herself in the midst of the Burmese civil war.
Beyond Silence , 1996 , R ,4,2,1,"Sylvie Testud is a talented young clarinet player yearning to break free from deaf parents who don't seem to appreciate her passion for music. Co-starring Tatjana Trieb, Howie Seago, Emmanuelle Laborit, Sybille Canonica, Matthias Habich, Alexandra Bloz and Hansa Czypionka. In German & Sign Language, with English subtitles."
Beyond the Lights , 2014 , PG-13 ,6,3,5,"A new pop star (Gugu Mbatha-Raw) wins a Billboard Music Award and seeking money and fame to please her mother she must confront the pressures of success. Her lifesaver is a police officer (Nate Parker) with political goals. Also with Minnie Driver, Danny Glover and Machine Gun Kelly. Directed by Gina Prince-Bythewood. [1:42]"
Beyond the Mat , 1999 , R ,2,7,7,"A documentary of the professional wrestling industry featuring Terry Funk, Mick Foley (""Mankind""), Jake Roberts (""Jake the Snake"") and WWF owner Vince McMahon. Also with Duane Johnson (""The Rock""), Roland Alexander, Collette Foley, Dewey Foley, Noelle Foley, Brandy Smith, Paul Heyman, Tony Jones, Mike Modest and Darren Drozdov. [1:42]"
Beyond the Reach , 2015 , R ,3,6,4,"A young man (Jeremy Irvine) is hired to be a guide to a wealthy man (Michael Douglas) bent on hunting a prized big horn in the Mojave Desert. The situation quickly spin out of control and the trip becomes a game of survival as the young man becomes the prey. Also with Ronny Cox, Patricia Bethune, Martin Palmer and David Garver. Directed by Jean-Baptiste Léonetti. [1:35]"
The BFG , 2016 , PG ,0,3,2,"Based on a Roald Dahl book, the Big Friendly Giant (Mark Rylance) helps a little orphan girl (Ruby Burnhill) navigate life and its challenges, while both learn what friendship really means. Also with Penelope Wilton, Rebecca Hall and Rafe Spall, and the voices of Bill Hader and Jermain Clement. Directed by Steven Spielberg. [1:53]"
Bicentennial Man , 1999 , PG ,3,3,4,"Robin Williams is a maid-robot that becomes more and more human over his 200-year life, based on an Isaac Asimov story. Also with Embeth Davidtz, Sam Neill, Oliver Platt, Hallie Kate Eisenberg, Wendy Crewson, Lindze Letherman, Allan Rich and Scott Waugh. [2:08]"
The Big Bounce , 2004 , PG-13 ,5,4,5,"A man (Owen Wilson) with a criminal past drifts to Hawaii, where he is enticed into a plot to steal money from an unscrupulous businessman by the man's mistress (Sara Foster). At the same time he befriends the local judge (Morgan Freeman) who also runs a small resort, and who's anxious to offer him advice on the shady people he hangs out with. Now the likable drifter must decide whether to follow through with the heist and be $200,000 richer, or walk away. Also with Gary Sinise and Bebe Neuwirth. Directed by George Armitage. [1:48]"
Big Bully , 1996 , PG ,1,2,3,"Rick Moranis gets the chance to fight back at his childhood bully, Tom Arnold. Also with Julianne Phillips, Carol Kane, Jeffrey Tambor, Curtis Armstrong, Faith Prince, Tony Pierce, Don Knotts, Justin Jon Ross and Michael Zwiener. [1:30]"
Big Daddy , 1999 , PG-13 ,3,3,5,"Adam Sandler adopts a friend's illegitimate child to prove to his girlfriend that he's a responsible adult. With Joey Lauren Adams, Steve Buscemi, Deborah S. Craig, Leslie Mann, Josh Mostel, Rob Schneider, Cole Sprouse, Dylan Sprouse, Jon Stewart and Kristy Swanson. [1:31]"
Big Eyes , 2014 , PG-13 ,2,4,5,"Based on true events: Margaret Keane (Amy Adams), an artist in the 1950s and '60s suffered as her scheming husband (Christoph Waltz) took credit for her popular paintings and built a fortune. She accepted the fact that women were not taken seriously in art, until a courtroom showdown gave her a voice. Also with Danny Huston, Jon Polito, Krysten Ritter, Jason Schwartzman, Terence Stamp and Madeleine Arthur. Directed by Tim Burton. Several lines of dialogue are spoken in Italian without translation. [1:28]"
Big Fat Liar , 2002 , PG ,2,3,3,"A 14-year-old boy (Frankie Muniz) whose pastime seems to be lying to everybody about everything, learns that lying has repercussions. When he loses a crucial school paper and an unscrupulous Hollywood producer (Paul Giamatti) turns it into a hit movie, the boy must go to extraordinary lengths to regain the trust of his parents by proving that, this one time, he was not lying. With Amanda Bynes, Amanda Detmer, Lindsay Tryctha, Donald Adeosun Faison, Josh Rusin and Lee Majors. [1:28]"
Big Fish , 2003 , PG-13 ,4,4,3,"Tim Burton directs this modern fairy tale about a man (Albert Finney) who's been telling tall tales all his life, telling everybody how as a young man (played by Ewan McGregor) he left his small Alabama town to go around the world, and back again, and how he encountered giants and witches. But now he's dying, and his estranged son (Billy Crudup) tries to make sense of his father. Also with Jessica Lange and Danny DeVito. Directed by Tim Burton [2:05]"
A Bigger Splash , 2016 , R ,9,4,9,A famous singer (Tilda Swinton) recovering from surgery convalesces on an island with her boyfriend (Matthias Schoenaerts) and everything becomes confused when her ex (Ralph Fiennes) arrives with his teenage daughter (Dakota Johnson). Also with Corrado Guzzanti. Directed by Luca Guadagnino. [2:05]
The Big Green , 1995 , PG ,1,1,1,A group of misfits find out they're something special when they discover they can win at soccer.
Big Hero 6 , 2014 , PG ,1,4,1,"A science prodigy (voiced by Ryan Potter) gives up robot fighting to join his older brother (voiced by Daniel Henney) and a team of young inventors at nerd school and invents an intricate robotics system for his entrance audition at the school tech fair. However, a fire destroys the entire building and a healthcare robot called Baymax (voiced by Scott Adsit) joins the young inventors in search of the evil Kabuki Man (voiced by James Cromwell). Also with the voices of Jamie Chung, Genesis Rodriguez, T. J. Miller, Maya Rudolph, Damon Wayans Jr. and Alan Tudyk. Directed by Don Hall and Chris Williams. Disney Studios. [1:28]"
The Big Hit , 1998 , R ,4,6,9,Mark Wahlberg plays a hit man who kidnaps his boss' godchild with explosive consequences. With Lou Diamond Phillips and Christina Applegate.
The Big Kahuna , 2000 , R ,2,1,6,"Kevin Spacey, Danny DeVito and Peter Facinelli are three lubricant salesmen who meet at their company's hospitality suite at a Wichita sales convention to await the arrival of an important potential client. [1:30]"
The Big Lebowski , 1998 , R ,5,5,10,Jeff Bridges stars in this comedy/thriller about mistaken identities. With John Goodman and Steve Buscemi.
Big Miracle , 2012 , PG ,1,3,3,"Inspired by a true story: a reporter (John Krasinski) in a small Alaska town breaks the story of three gray whales trapped beneath the ice. After his Greenpeace activist ex-girlfriend (Drew Barrymore) gets involved, the story becomes international news as the world hopes that the family of whales can escape the rapidly forming Arctic ice. Also with John Pingayak, Ted Danson, Kirsten Bell and Kathy Baker. Directed by Ken Kwapis. [2:03]"
Big Momma's House , 2000 , PG-13 ,5,4,5,"Martin Lawrence is a detective who must protect a mother and child, but the only way he can do so is to go undercover as a large, overbearing Southern grandma known as ""Big Momma."" Also with Nia Long, Paul Giamatti, Terrence Dashon Howard and Eric Arthur Linden. [1:30]"
Big Momma's House 2 , 2006 , PG-13 ,4,4,4,"Martin Lawrence reprises his role as FBI agent Malcolm Turner, who is able with the aid of a rubber suit to convincingly disguise himself as an elderly, rotund woman. This time he is working a desk job at his request, since he's married and expecting a baby. But when his former partner is killed during an investigation, Malcolm dons his Big Momma suit and goes undercover to find the killers. Also with Nia Long, Zachary Levi, Emily Procter and Mark Moses. Directed by John P. Whitesell. [1:39]"
"Big Mommas: Like Father, Like Son ", 2011 , PG-13 ,5,5,4,"An FBI Agent (Martin Lawrence) goes undercover as Big Momma, once again, but this time brings his stepson (Brandon T. Jackson) with him, enrolling him in an all girl performing arts school after he witnesses a murder. Also with Jessica Lucas, Portia Doubleday, Emily Rios, Ana Ortiz, Michelle Ang and Ken Jeong. Directed by John P. Whitesell. [1:47]"
The Big Short , 2015 , R ,5,3,10,"Based on the bestselling book by Michael Lewis that documents how the 2008 housing crisis was anticipated by a few investors who decided to bet against the big banks, reaping large profits while the world's economies were collapsing. With Steve Carell, Marisa Tomei, Brad Pitt, Christian Bale, Ryan Gosling, Adepero Oduye, Hamish Linklater, Jeremy Strong, Rafe Spall, Finn Wittrock, John Magaro, Max Greenfield and Billy Magnussen. Directed by Adam McKay. [2:10]"
The Big Sick , 2017 , R ,4,4,10,"A Pakistani-American comedian (Kumail Ninjiani) is torn between the traditions of his Muslim parents (Anupam Kher and Zenobia Shroff) and finding a marriage partner. After losing his true love (Zoe Kazan), he learns that she is in a medical coma and his odyssey begins. Also with Adeel Akhtar, Ray Romano, Holly Hunter Bo Burnham, Kurt Braunohler and Aidy Bryant. Directed by Michael Showalter. The film includes several lines of dialogue in Urdu with English subtitles. [1:55]"
Big Sur , 2013 , R ,6,5,3,"A visualization of Jack Kerouac's novel ""Big Sur,"" as the author and three companions travel to a cabin in Big Sur. With Jean-Marc Barr, Kate Bosworth, Josh Lucas, Patrick Fischler, Anthony Edwards and Radha Mitchell. Directed by Michael Polish. [1:21]"
Big Trouble , 2002 , PG-13 ,5,5,6,"Broad farce adapted from Dave Barry's best-selling novel and starring Tim Allen and Rene Russo. By way of plot, two hit men are hired to kill a man because he's been embezzling money from his employers. Through many twists and turns, a suitcase with a bomb, the hit men, a divorced dad, an unhappy housewife, the embezzler, two ex-cons out for some quick money, some Russian weapons dealers, the FBI, two lovestruck teens, and a psychedelic toad, all cross paths. Also with Omar Epps, Dennis Farina, Janeane Garofalo, Jason Lee, Tom Sizemore and Stanley Tucci. [1:33]"
The Big Uneasy , 2011 , NR ,5,4,5,Actor Harry Shearer directs an introspective look at the 2005 devastation caused by Hurricane Katrina in New Orleans. Featuring the stories of two leaders (of a scientific investigation team and a US Army Corps of Engineers whistleblower) it tries to tell the real story behind the reasons New Orleans flooded and was almost destroyed. Also with John Goodman and featuring narration by Brad Pitt. [1:38]
The Big Wedding , 2013 , R ,7,3,6,"The families of a young couple come together for their wedding and personalities and past history clash when the divorced parents of the groom are forced to pretend that they are still married. With Robert De Niro, Katherine Heigl, Diane Keaton, Amanda Seyfried, Topher Grace, Susan Sarandon, Robin Williams, Ben Barnes, Christine Ebersole, David Rasche, Patricia Rae, Ana Ayora and Kyle Bornheimer. Directed by Justin Zachman. [1:30]"
The Big Year , 2011 , PG ,3,3,4,"Three highly competitive birdwatchers (Jack Black, Steve Martin and Owen Wilson) set out to score a record number of sightings across North America during the 1998 ""The Big Year"" birder's competition. This is a year when weather forces more birds than usual into the skies and the three men see birds they've never seen before in a race to be the Number One Birder in the world. Also with Brian Dennehy, Anjelica Huston, Rashida Jones, Rosamund Pike, Dianne Wiest, JoBeth Williams and Anthony Anderson. Directed by David Frankel. [1:40]"
Biker Boyz , 2003 , PG-13 NR ,4,5,5,"A young man (Derek Luke) struggles with making his place in the underground motorcycle racing world. He begins in the shadow of his father, and after his father's accidental death tries to break out on his own and become the undisputed champion. Also with Laurence Fishburne, Tyson Beckford, Lisa Bonet and Kadeem Hardison. [1:30]"
Billy Elliot , 2000 , R ,3,3,10,"In this comedy/drama, a boy (Jamie Bell) gives up boxing and takes up ballet, much to the dismay of his coal-mining father and brother. Also with Julie Walters, Gary Lewis, Jamie Draven, Jean Heywood, Stuart Wells, Mike Elliot, Billy Fane and Nicola Blackwell. [1:50]"
Billy Madison , 1995 , PG-13 ,3,3,5,"Adam Sandler is a nearly thirtysomething ""kid"" who must go back to school to prove to his Dad that he can run his multimillion dollar business."
Bio-Dome , 1996 , PG-13 ,3,2,3,"Pauly Shore and Stephen Baldwin accidentally get trapped inside an environmentally-controlled research center and wreak havoc. Also with William Atherton, Kylie Minogue, Joey Lauren Adams, Teresa Hill, Dara Tomanovich, Patricia Hearst, Jeremy Jordan, Kevin West, Denise Dowse, Henry Gibson, Roger Clinton, Taylor Negron and Rose McGowan. [1:35]"
The Birdcage , 1996 , R ,4,0,6,Robin Williams and Nathan Lane are gay parents with a soon-to-be-married son and a dilemma: what to do when the conservative future in-laws come to dinner.
Birdman or (The Unexpected Virtue of Ignorance) , 2014 , R ,5,4,10,"A man (Michael Keaton) who earned his celebrity by playing a super hero in Hollywood movies decides to try to do something more significant by directing and acting in a play on Broadway. Obstacles abound as he struggles with the voices in his head and all of the people in his life. Also with Zach Galifianakis, Naomi Watts, Jeremy Shamos, Andrea Riseborough, Emma Stone, Edward Norton and Lindsay Duncan. Directed by Alejandro González Iñárritu. [1:59]"
Birth , 2004 , R ,7,3,4,"Nicole Kidman stars as a woman whose husband dies unexpectedly. Ten years pass and while she still cannot let go of her grief, she agrees to marry another man (Danny Huston) who loves her very much. However, one evening a boy (Cameron Bright) enters their home and insists that he is her dead husband re-incarnated. The boy shares many intimate details of their relationship and she struggles between believing him and sending him away. Also with Lauren Bacall and Alison Elliot. Directed by Jonathan Glazer. [1:40]"
Birthday Girl , 2002 , R ,6,5,5,"Nicole Kidman stars as a Russian woman whose marriage to an English banker (Ben Chaplin) has been arranged over the Internet. However, this e-mail order bride is not as innocent as she seems and there's more to the arrangement than the banker suspects. Soon he finds himself in grave danger. Also with Vincent Cassel, Mathieu Kassovitz and Valentina Cervi. [1:33]"
The Birth of a Nation , 2016 , R ,5,8,3,"Based on the story of Nat Turner (Nate Parker), a slave in the antebellum South who led a slave rebellion in 1831. Hundreds of slaves were murdered in retribution. Also with Armie Hammer, Mark Boone Junior, Colman Domingo, Aunjanue Ellis, Dwight Henry, Aja Naomi King, Esther, Roger Guenveur Smith, Gabrielle Union and Penelope Ann Miller. Directed by Nate Parker. A few lines of dialogue are spoken in an African language with English subtitles. [2:00]"
Birth of the Dragon , 2017 , PG-13 ,1,5,3,"Set in San Francisco in 1964, Bruce Lee (Philip Ng) looks for fame as a martial arts instructor and action star. He meets a famous Shaolin monk (Xia Wu) and fights him in a controversial no-rules match that is still debated today. Also with Billy Magnussen, Jin Xing, Jingjing Qu, Simon Yin and Terry Chen. Directed by George Nolfi. Several lines of dialogue are spoken in Mandarin with and without English subtitles. [1:43]"
Biutiful , 2010 , R ,7,6,8,"Javier Bardem stars as a man doing his best to care for his two young children while operating a less than savory street business. After finding out that he is dying, he struggles with finding a way to ensure that his children are protected after he is gone. Also with Maricel Alvarez, Eduardo Fernández, Diaryatou Daff, Chang Tai Shen, Luo Jin, Hanna Bouchaib and Guillermo Estrella. Directed by Alejandro Gonzalez Inarritu. In Spanish with English subtitles. [2:18]"
Black and White , 1999 , R ,8,4,10,"This comedy/drama explores the fascination white upper-class teens have with the urban hip-hop lifestyle. With Scott Caan, Robert Downey Jr., Stacy Edwards, Allan Houston, Gaby Hoffmann, Kidada Jones, Jared Leto, Marla Maples, Kim Matulova, Joe Pantoliano, Bijou Phillips, Power, Raekwon, Claudia Schiffer, William Lee Scott, Brooke Shields, Ben Stiller, Eddie Kaye Thomas, Mike Tyson, Elijah Wood, Sticky Fingaz and Method Man. [1:38]"
Black Beauty , 1994 , G ,0,3,0,"Based on the classic children's story, and taking place in 19th century England, ""Black Beauty"" tells a horse's tale of woe, from loving masters to hard times."
The Black Dahlia , 2006 , R ,8,9,6,"Josh Hartnett and Scarlett Johansson star in this speculative thriller, based on the real-life murder of a Hollywood starlet that shocked Hollywood in 1947. The brutal murder remains unsolved. Also with Hilary Swank, Aaron Eckhart and Mia Kirshner. Directed by Brian De Palma. [2:01]"
Black Dog , 1998 , PG-13 ,0,7,5,"Patrick Swayze stars as a truck driver whose family is taken hostage and thus he is forced to drive a shipment of illegal guns. Randy Travis, Meat Loaf."
Blackhat , 2015 , R ,5,6,5,"The American government releases a convicted hacker (Chris Hemsworth) from prison to collaborate with the Chinese in a manhunt for a notorious international cybercriminal. The chase takes the crime fighters through major world capitals and mayhem. Also with Tang Wei, Wang Leehom, Viola Davis, Holt McCallany, William Mapother, Ritchie Costar and Manny Montana. Directed by Michael Mann. Several scenes include Chinese dialogue with English subtitles. [2:13]"
Black Hawk Down , 2001 , R ,1,10,8,"Based on the October 1993 U.S. relief mission to Mogadishu, Somalia, that turned unexpectedly horrific and bloody, the film details the events in graphic detail: A Delta assault force was supposed to arrest top lieutenants of a warlord who was stealing relief packages meant for the starving population. But when two Black Hawk helicopters were shot down the ensuing battle with heavily armed Somalis ended with 19 dead Americans. With Josh Hartnett, Eric Bana, Ewan McGregor, Tom Sizemore, William Fichtner, Jason Isaacs, Jeremy Piven, Sam Shepard, Johnny Strong, Ron Eldard, Hugh Dancy, Ian Virgo, Ewen Bremner, Tom Hardy, Brendan Sexton III and Orlando Bloom. [2:24]"
Black Knight , 2001 , PG-13 ,4,6,4,"Martin Lawrence stars as a fast-talking 21st century con man who's transported back to the 14th century when he falls into a fake moat at a medieval theme park. Using his street smarts he helps a down-and-out knight and a distressed damsel. Also with Tom Wilkinson, Kevin Conway, Marsha Thomason and Michael Countryman. [1:35]"
Black Mask , 1996 , R ,2,9,6,"Jet Li stars as a commando who's been enhanced with super human powers and has to fight his also-enhanced brethren who've turned to crime. Also with Karen Mok, Lau Ching Wan and Francoise Yip. [1:30]"
