movie_title,movie_year,movie_rating,sex_nudity,violence_gore,language,movie_description
America's Sweethearts , 2001 , PG-13 ,4,4,5,"Julia Roberts stars as the sister and personal assistant to a beautiful and demanding super-super star, played by Catherine Zeta-Jones. When she dutifully accepts the task of helping her celebrated boss through one last public appearance accompanied by her estranged (and equally luminous) husband (John Cusack), her life takes an unscheduled romantic turn. Billy Crystal co-stars as a legendary press agent who's responsible for putting the whole shindig together. Also with Hank Azaria, Stanley Tucci, Christopher Walken, Alan Arkin, Seth Green. [1:41]"
Amistad , 1998 , R ,5,5,1,"Steven Spielberg's take on slavery is based on a true incident: An early 19th century rebellion by Africans on a slave ship leads to a court case. With Morgan Freeman, Anthony Hopkins and Matthew McConaughey."
The Amityville Horror , 2005 , R ,6,9,5,"Re-make of the 1970's horror classic involving an apparently haunted house in Amityville, Long Island. The previous owners of the house were murdered by their eldest son, who claimed to be hearing voices that told him to kill his family. Now, a new family (Ryan Reynolds, Melissa George, Jimmy Bennett, Jesse James and Rachel Nichols), unaware of the house's history, buys it, and not long after they arrive very strange and creepy things begin to go violently bump mostly in the night. Directed by Andrew Douglas. [1:40]"
Amongst Friends , 1994 , R ,3,4,7,Coming of age tale about punks in the burbs. With Joseph Lindsey and Mira Sorvino.
Amos and Andrew , 1993 , PG-13 ,1,3,4,"Samuel L. Jackson and Nicholas Cage make an unlikely pair in this mistaken-identity farce about racial stereotyping: Jackson is a famous, award-winning black author while Cage is white, undereducated and a crook."
Amour , 2012 , PG-13 ,4,5,5,"An elderly couple (Jean-Louis Trintignant and Emmanuelle Riva) have lived a life of sophistication, filled with music. After the wife has a stroke, the husband becomes her caretaker and it tests the strength of their bond. Also with Isabelle Huppert, Alexandre Tharaud and William Shimell. Directed by Michael Haneke. In French with English subtitles. [2:07]"
Amreeka , 2009 , PG-13 ,2,4,5,"A single mother (Nisreen Faour), who leaves occupied Palestine with her teenage son (Melkar Muallem), dreams of a new future in America. After settling in suburban Illinois the two struggle with looking for a job, racism, and the conflict between their desire to maintain their ethnic identity while at the same time assimilating in their new country. Also with Hiam Abbass and Alia Shawkat. Directed by Cherien Dabis. Partially in Arabic with English subtitles. [1:37]"
Amy , 2015 , R ,5,4,6,"Documentary examining the life, career and drug-related death at age 27 of singer and pop star Amy Winehouse. Also with Mitchell Winehouse, Janis Winehouse, Yasiin Bey, Mark Ronson, Tony Bennett, Blake Fielder-Civil and Raye Cosbert. Directed by Asif Kapadia. [1:30]"
Anacondas: The Hunt for the Blood Orchid , 2004 , PG-13 ,4,7,5,"A group of scientists undertakes an expedition into the thick jungles of Borneo hoping to find a rare orchid that blooms only once every seven years, and may hold the key to extending human life. They don't anticipate the dangers that await them, including the monsoon season and giant, hungry snakes that derive their size and strength from the flowers. With Johnny Messner, Morris Chestnut, Eugene Byrd, Nicholas Hope and Peter Curtis. Directed by Dwight H. Little. [1:33]"
Analyze That , 2002 , R ,5,6,10,"The empathic psychiatrist (Billy Crystal) and the lovable mob boss (Robert De Niro) pick up where they left off in ""Analyze This"": De Niro is now in prison and desperately needs his shrink's help when it turns out someone's trying to whack him. A few murder attempts later, a funeral, a robbery, a few crime family reunions, and a TV show that's loosely based on mob life, and the boss and the shrink resolve their problems together. Also with Lisa Kudrow, Joe Viterelli and Brian Rogalski. [1:35]"
Anastasia , 1997 , G ,0,4,0,A spunky teenaged girl with amnesia realizes that she is a long-lost survivor of the Russian Royal Family. Voiced by Meg Ryan and John Cusack.
Anchorman , 2004 , PG-13 ,6,5,5,"Set in 1970s San Diego: TV news anchorman Ron Burgundy (Will Ferrell) is a local celebrity, although his expertise is really nothing more complicated than reading a teleprompter efficiently. His life and career plans are disrupted when an ambitious female newscaster (Christina Applegate) who actually knows a thing or two about real journalism joins the all-boys news team, and the two develop romantic feelings for one another. Also with Steve Carell, Kevin Corrigan and Chuck D. Directed by Adam McKay. [1:31]"
Anchorman 2 , 2013 , PG-13 ,5,5,5,"Ron Burgundy (Will Ferrell) is no longer a news anchor since he lost his job to his wife (Christina Applegate) and ended up emceeing at a Sea World-type facility. He's then approached by a man (Dylan Baker) who is putting together a new kind of news station and along with his news team (Paul Rudd, Steve Carell and David Koechner) makes the trip to NYC to find out what this new news idea is all about. Also with Kristen Wiig, Harrison Ford, James Marsden, Meagan Good, Greg Kinnear, Liam Neeson, Kirsten Dunst, Jim Carrey, Vince Vaughn, Sacha Baron Cohen, Tina Fey, Amy Poehler, John C. Reilly, Luke Wilson, Kanye West and Fred Willard. Directed by Adam McKay. [1:59]"
Andre , 1994 , PG ,1,3,1,A cute seal wins the heart of a young girl.
And So It Goes , 2014 , PG-13 ,3,2,4,"An aging realtor (Michael Douglas) is obnoxious and self-centered, and his only aim is to sell one more expensive house and retire. However, his estranged son drops off a granddaughter he never knew (Sterling Jerins) and unable to relate to a nine-year-old girl, gives her to his friendly neighbor (Diane Keaton). Also with Paloma Guzmán, Frances Sternhagen and Frankie Valli. Directed by Rob Reiner. [1:34]"
Angela's Ashes , 1999 , R ,6,5,6,"Film version of Frank McCourt's critically acclaimed and best-selling memoir of growing up in poverty in 1940s Ireland. With Emily Watson, Robert Carlyle, Joe Breen, Ciaran Owens, Michael Legge and Shane Murray-Corcoran. [2:25]"
Angel Eyes , 2001 , R ,5,5,8,"Jennifer Lopez stars as a policewoman who's struggling with the stresses of her profession and her memories of an abusive childhood. She becomes romantically involved with a man (James Caviezel) who refuses to discuss his past. As she begins a relationship with him, she is compelled to dig into his secrets and in the process she finds out as much about herself and love as she does about his past. Also with Terrence Howard, Jeremy Sisto and Sonia Braga. [1:43]"
Angels & Demons , 2009 , PG-13 ,1,7,3,"Sequel to the 2006 thriller ""The Da Vinci Code,"" and also based on a Dan Brown novel: Tom Hanks reprises his role as a famous symbologist, who this is called to the Vatican to help uncover an anti-Papal conspiracy that may involve a secret, centuries-old group called the Illuminati. Also with Ewan McGregor, Ayelet Zurer, Stellan Skarsgård, Nikolaj Lie Kaas, Armin Mueller-Stahl, Pierfrancesco Favino and Victor Alfieri. Directed by Ron Howard. [2:18]"
Angels in the Outfield , 1994 , PG ,0,2,2,A young boy asks for a miracle to bring his family back together and to have his favorite baseball team win the season. Divine intervention ensues.
Anger Management , 2003 , PG-13 ,5,3,5,"Adam Sandler stars as a mild-mannered businessman who's wrongly accused of assaulting a flight attendant and is sentenced to spend time in an anger management program run by a man (Jack Nicholson) who has temper control issues of his own. During his treatment Sandler ends up losing his girlfriend, getting passed over for a promotion, and lands back in court with another assault charge. Also with Krista Allen, Marisa Tomei and Allen Covert. [1:43]"
Angie , 1994 , R ,4,0,5,Geena Davis stars as a young woman from Brooklyn who's trying to decide what to do with her life.
The Angry Birds Movie , 2016 , PG ,3,3,2,"A very angry redbird (voiced by Jason Sudeikis) becomes even angrier when strange pigs visit Bird Island and steal all the eggs. The redbird uses his fury to spur the avian population to take back their unhatched offspring. Also with the voices of Maya Rudolph, Peter Dinklage, Kate McKinnon, Kegan-Michael Key, Danny McBride, Josh Gad and Bill Hader. Directed by Clay Kaytis &, Fergal Reilly. [1:37]"
Angus , 1995 , PG-13 ,2,2,5,An overweight teen seizes his moment when the school crowns him the Winter Ball King as a joke.
The Animal , 2001 , PG-13 ,4,4,4,"Rob Schneider dreams of being a cop but his size and lack of physical prowess are in the way. His life changes though when he's injured in a traffic accident and he needs several organ transplants. A loopy scientist surreptitiously uses animal organs to fix him up and the cop wannabe is now endowed with animal instincts and strange super powers -- as well as animal manners. Also with Colleen Haskell, Michael Caton, Edward Asner and Cloris Leachman. [1:23]"
Animal Kingdom , 2010 , R ,4,7,10,"The story follows the Cody crime family, known in Australia for armed robbery and drugs: Three brothers teach their teen nephew (James Frecheville) criminal skills after his mom dies of a drug overdose, while their mom (Jacki Weaver) supervises the training and blackmails authorities. The oldest brother (Ben Mendelsohn) is a psychopath, the middle brother (Sullivan Stapleton) is a cocaine dealer and junkie, and the youngest (Luke Ford) just goes along. Also with Joel Edgerton and Guy Pearce. Directed by David Michôd. [1.52]"
Animals , 2015 , R ,5,5,9,"A man and a woman (David Dastmalchian and Kim Shaw) live on the streets and move from one con to another in an effort to keep their drug addiction in check. When their habit eventually gets the better of them, they must each decide the path they will take. Also with John Heard, John Hoogenakker, John Lister and Lawrence MacGowan. Directed by Collin Schiffli. [1:30]"
Anna and the King , 1999 , PG-13 ,2,6,0,"The story of English schoolteacher Anna Leonowen's experiences teaching the King of Siam's children in 19th-century Siam. With Jodie Foster, Yun-Fat Chow, Ling Bai, Syed Alwi, Tom Felton, Randall Duk Kim, Kay Siu Lim, Melissa Campbell, Deanna Yusoff, Mano Maniam and Keith Chin. [2:27]"
Annabelle , 2014 , PG-13 NR ,2,7,2,"A man (Ward Horton) purchases an antique Annabelle bride doll as a birthing gift for his wife (Annabelle Wallis). Soon afterward, members of a satanic cult break into the home and torture the couple. Also with Alfre Woodard, Eric Ladin, Kerry O'Malley, Brian Howe, Tony Amendola. Directed by John R. Leonetti. [1:38]"
Annabelle: Creation , 2017 , R ,1,7,2,"A retired toymaker (Anthony LaPaglia) and his ailing wife (Miranda Otto) welcome a nun (Stephanie Sigman) and six orphan girls into their home. When the girls find a doll named after the toymaker's daughter, who died years ago, a demon (Joseph Bishara) possessing the doll begins to terrify the orphans. Also with Talitha Bateman, Lulu Wilson, Alicia Vela-Bailey, Mark Bramhall and Adam Barley. Directed by David Sandberg. [1:48]"
Anna Karenina , 2012 , R ,6,6,3,"A 19th century aristocrat in tsarist Russia (Keira Knightley) is bored with her privileged life with her husband (Jude Law) and young son, so she delves into a passionate affair with an exciting but vapid cavalryman (Aaron Taylor-Johnson). But as she becomes the center of society gossip, she turns emotionally volatile and paranoid, struggling with jealousy. Also with Kelly Macdonald, Matthew Macfadyen, Domhnall Gleeson, Emily Watson and Shirley Henderson. Directed by Joe Wright. [2:10]"
Annapolis , 2006 , PG-13 ,3,5,4,"James Franco stars as a young man driven all of his life to be accepted into the Annapolis Naval Academy. After finally achieving that dream, he quickly realizes that life as a plebe can be hard and he may not be able to measure up. Also with Jordana Brewster, Vicellous Reon Shannon, Donnie Wahlberg and Tyrese Gibson. Directed by Justin Lin. [1:48]"
Annie , 2014 , PG ,2,3,3,"An updated telling of the classic tale of a foster child (Quvenzhané Wallis) taken in by a wealthy man (Jamie Foxx), initially as a publicity ploy; However, he soon learns that she means more to him than his political aspirations. Also with Rose Byrne, Bobby Cannavale, Adewale Akinnuoye-Agbaje, David Zayas and Cameron Diaz. Directed by Will Gluck. [1:58]"
Annihilation , 2018 , R ,5,7,6,"After a meteorite strikes Earth, the area around a lighthouse in Florida becomes an environmental anomaly where evolution may be accelerating and whoever goes inside disappears. A former soldier and top biologist (Natalie Portman) leads a team of experts into the anomaly in an attempt to understand what is happening. Also with Jennifer Jason Leigh, Oscar Isaac, Tuva Novotny, Gina Rodriguez and Tessa Thompson. Directed by Alex Garland. [1:55]"
The Anniversary Party , 2001 , R ,5,2,8,"Alan Cumming and Jennifer Jason Leigh, after reconciling following a year-long separation, host a sixth-year anniversary party for some close friends, only to have the happy event quickly deteriorate into an evening full of jealousy, regret and loss. Also with Gwyneth Paltrow, Kevin Kline, Phoebe Cates, Jane Adams, John C. Reilly, John Benjamin Hickey, Parker Posey, Denis O'Hare, Ryan Rose, Mina Badie, Jennifer Beals, Matt Malloy, Michael Panes and Clara Demedrano. [1:55]"
Anomalisa , 2015 , R ,8,1,8,"Stop-motion feature about a married middle-aged executive who has trouble connecting with people -- he perceives everyone as basically the same person. During a business trip he meets a younger woman who seems to be an anomaly, a person he thinks he can connect with and he's ready to leave his family for her. Voiced by David Thewlis, Jennifer Jason Leigh and Tom Noonan. Directed by Duke Johnson & Charlie Kaufman. [1:30]"
Anonymous , 2011 , PG-13 ,7,6,4,"A literary thriller making the case that Edward De Vere, Earl of Oxford (Rhys Ifans), was actually the person who wrote Shakespeare's plays. The story takes place during the tumultuous political backdrop of the Essex Rebellion against Queen Elizabeth I (Vanessa Redgrave). Also with Sebastian Armesto, Rafe Spall, David Thewlis and Joely Richardson. Directed by Roland Emmerich. [2:10]"
Another Earth , 2011 , PG-13 ,5,6,1,"The night that humans realize that there is a duplicate Earth in the solar system, an ambitious MIT student (Brit Marling) is driving while drunk, strikes a minivan and kills the pregnant wife and son of a successful composer. After going to prison for four years, she tries to visit the duplicate Earth to see if her mirror self has led a different life. Also with William Mapother and Jordan Baker. Directed by Mike Cahill. [1:32]"
Another Stakeout , 1993 , PG-13 ,2,4,3,"A reprise of the Richard Dreyfuss/Emilio Estevez vehicle of 1987. Dreyfuss, Estevez and Rosie O'Donnell pose as a family, and stake out a suspicious house."
Another Year , 2010 , PG-13 ,3,2,5,"The life of a blissfully long-married couple (Jim Broadbent and Ruth Sheen) is documented for a year, as they are surrounded by their unhappy friends. Also with Lesley Manville, Oliver Maltman and Peter Wright. Directed by Mike Leigh. [2:09]"
The Ant Bully , 2006 , PG ,2,4,1,"A 10-year-old boy who is bullied by bigger neighborhood kids, becomes a bully himself when he takes his frustrations out on the anthill in his yard. An ant wizard in the colony is determined to teach the boy a lesson and develops a potion that shrinks the boy to ant size. Now he has to live among the ants before being able to return home. With the voices of Lily Tomlin, Larry Miller, Julia Roberts, Paul Giamatti and Zach Tyler Eisen. Directed by John A. Davis. [1:28]"
Antitrust , 2001 , PG-13 ,2,5,5,"Tim Robbins stars as a Bill Gates-like software tycoon whose corporation goes about being number one in the industry by any means necessary; Ryan Phillippe co-stars as an idealistic computer genius. Also with Rachael Leigh Cook, Claire Forlani, Tygh Runyan, Ned Bellamy, Douglas McFerran, Zahf Hajee, Scott Bellis, Nate Dushku, Tyler Labine and Julie McDowell. [1:50]"
Ant-Man , 2015 , PG-13 ,1,5,4,"A professional burglar (Paul Rudd) receives a request to help a former superhero (Michael Douglas) save the world by means of high-tech body armor that will shrink him to ant-size, while increasing his strength. The thief accepts the offer and conducts a major heist while fighting international villains and crazed scientists. Also with Bobby Cannavale, Evangeline Lilly, Corey Stoll, Michael Peña, Tip Harris, Wood Harris, Judy Greer and David Dastmalchian. Directed by Peyton Reed. [1:57]"
Ant-Man and the Wasp , 2018 , PG-13 ,2,5,4,"Nearly at the end of his two year house arrest after his first foray in  Ant-Man and  Captain America: Civil War, the tiny superhero (Paul Rudd) risks life in prison in order to help The Wasp (Evangeline Lilly) and Dr. Pym (Michael Douglas) with a mission that will take them into the Quantum Realm; they also encounter a new foe and an unscrupulous tech dealer. Also with Michael Peña, Walton Goggins, Bobby Cannavale, Judy Greer, Randall Park, Hannah John-Kamen, Abby Ryder Fortson, Tip 'T.I.' Harris, Michelle Pfeiffer and Laurence Fishburne. Directed by Peyton Reed. [1:58]"
Antwone Fisher , 2002 , PG-13 ,4,5,5,"Denzel Washington's directorial debut focuses on a true story, the life of Antwone ""Fish"" Fisher, a studio security guard who became a writer and Hollywood producer. When he was a young man, Fisher (played by Derek Luke) was a sailor prone to violent outbursts and fistfights. Sent to a Navy psychiatrist (Washington) for help, he eventually breaks down and reveals a horrific childhood rife with abuse and embarks on a search to find the family that abandoned him as a baby. Also with Joy Bryant, Salli Richardson and Stephen Snedden. [1:53]"
Antz , 1998 , PG ,2,4,3,"Animated adventure with Woody Allen as the voice of Z, a neurotic worker ant who does not like conformity. With the co-starring voices of Sharon Stone (the princess Z falls for), Gene Hackman (Z's nemesis, a crazed general), Sylvester Stallone (Z's best friend), Christopher Walken, Danny Glover, Dan Aykroyd, Jane Curtin, Anne Bancroft, Jennifer Lopez, John Mahoney, Grant Shaud and Paul Mazursky."
Any Day Now , 2012 , R ,6,3,6,"Set in the late 1970s, a gay couple tries to adopt a mentally challenged boy who was abandoned by his addict mother but have to fight the discriminatory legal system in order to keep their family together. With Alan Cummings, Garret Dillahunt, Isaac Leyva, Frances Fisher, Chris Mulkey and Gregg Henry. Directed by Travis Fine. [1:37]"
Any Given Sunday , 1999 , R ,8,7,10,"Al Pacino stars as head coach of the Miami Sharks, a football franchise falling apart because of an injured and aging quarterback (Dennis Quaid), a fame-loving rookie (Jamie Foxx), and a profit-driven co-owner (Cameron Diaz). Also with James Woods, LL Cool J, Jim Brown, Lawrence Taylor, Matthew Modine, Ann-Margret, Bill Bellamy, Andrew Bryniarski, James Caviezel, Aaron Eckhart, John C. McGinley, Lauren Holly, Elizabeth Berkley, Lela Rochon and Clifton Davis. Directed by Oliver Stone. [2:45]"
Anything Else , 2003 , R ,6,3,4,"Woody Allen comedy about two neurotic New York comedy writers, an experienced one (Allen) and an aspiring one (Jason Biggs), and their relationship. The older one mentors the younger one while they walk in Central Park, explaining that to move forward one has to do some leaving (useless agents, uncommunicative analysts, grating girlfriends). Meanwhile Biggs' character falls in love with a free-spirited young woman (Christina Ricci). Also with Stockard Channing and Danny DeVito. Directed by Woody Allen. [1:48]"
Anywhere But Here , 1999 , PG-13 ,4,2,3,"In this portrait of a tumultuous mother-daughter relationship, a woman with big dreams moves herself and her daughter from a small Wisconsin town to Beverly Hills. With Susan Sarandon, Natalie Portman, Eileen Ryan, Ray Baker, John Diehl, Shawn Hatosy, Bonnie Bedelia, Caroline Aaron, Hart Bochner, Ashley Johnson, Mia Korf, Heather McComb, Faran Tahir, Alicia Leigh Willis and Rachel Wilson. [1:54]"
Apocalypse Now Redux , 2001 , R ,7,9,10,"Director Francis Ford Coppola's 1979 take on the Vietnam war was loosely based on Joseph Conrad's novel ""The Heart of Darkness,"" and is notorious for its production problems. For some critics it is the definitive film on the Vietnam experience, the only film to capture its insanity and surrealism, and perhaps the director's magnum opus. For others it is pretentious and ponderous, especially after the addition of 53 minutes of additional footage. With Marlon Brando, Robert Duvall, Martin Sheen, Laurence Fishburne and Dennis Hopper. [3:23]"
Apocalypto , 2006 , R ,5,9,5,"As the Mayan empire is facing decline, before the conquistadors arrived, a young man (Rudy Youngblood) manages to hide his wife and son from an attack on his village, but he is captured and slated to be a human sacrifice. When he manages to escape, he must survive all manner of challenges while he tries to get back to save his family. Also with Dalia Hernandez, Mayra Serbulo, Gerardo Taracena and Raoul Trujillo. Directed by Mel Gibson. In Yucatec Maya with English subtitles. [2:17]"
Apollo 13 , 1995 , PG ,2,2,5,"The nearly fatal Apollo 13 mission is detailed in this film by Ron Howard. With Tom Hanks, Bill Paxton, Kevin Bacon and Gary Sinise."
Apollo 18 , 2011 , PG-13 ,1,5,5,Horror film about a fictional final Apollo mission to the moon: old footage allegedly from NASA's abandoned Apollo 18 mission reveals that two American astronauts were sent secretly to the moon where they uncovered horrific life forms. With Warren Christie and Lloyd Owen. Directed by Gonzalo Lopez-Gallego. [1:28]
Appaloosa , 2008 , R ,5,7,5,"In the late 1800s, two longtime friends and business partners (Ed Harris and Viggo Mortensen) are called to a small New Mexico town to relieve the townspeople from the constant threat a gang of bullies poses. Also with Robert Knott, Renee Zellweger, Timothy V. Murphy, Daniel T. Parker and Lance Henriksen. Directed by Ed Harris. [1:48]"
Apparition , 2012 , PG-13 ,4,7,4,"Several students of paranormal Psychology try to recreate an experiment performed in the '70s that supposedly resulted in contacting a recently deceased person. When the experiment goes horribly wrong and one of the students disappears, the remaining students endeavor to reverse the experiment. With Ashley Greene, Sebastian Stan and Tom Felton. Directed by Todd Lincoln. [1:22]"
Apt Pupil , 1998 , R ,6,6,7,"A high school student becomes obsessed with the Holocaust and blackmails a former high-ranking Nazi soldier into telling stories about his involvement. Based on a novella by Stephen King. With Brad Renfro, Ian McKellen, David Schwimmer, Joshua Jackson, Ann Dowd, Bruce Davison and Heather McComb. [1:51]"
Aquamarine , 2006 , PG ,3,3,3,"Two girls are finishing out their last summer together, since one of them is moving to Australia. They wish for something to happen that would keep them together, when they discover a mermaid in the pool of their neighborhood beach club. The mermaid who grants them their wish -- as long as they can help her find love in three days: If she cannot prove to her father that love exists, she will have to marry someone she doesn't even like. With Emma Roberts, Joanna 'JoJo' Levesque, Sara Paxton, Jake McDorman and Arielle Kebbel. Directed by Elizabeth Allen. [1:43]"
Arbitrage , 2012 , R ,4,4,10,"A man (Richard Gere) heading a successful hedge-fund company finds himself navigating many obstacles, personal and financial, in order to keep his seemingly ordered and pleasant life from crumbling. Also with Susan Sarandon, Brit Marling, Tim Roth, Laetitia Casta and Nate Parker. Directed by Nick Jarecki. [1:40]"
Arctic Tale , 2007 , G ,1,4,0,"A National Geographic production narrated by Queen Latifah that follows a polar bear cub and a walrus pup through the first two years of their lives and documents the climate shifts that are making their lives in the Arctic nearly impossible to survive. Also with Katrina Agate, Kwesi Boakye, Michael Huang and Dante Pastula. Directed by Adam Ravetch & Sarah Robertson. [1:36]"
Are We Done Yet? , 2007 , PG ,3,3,1,"Ice Cube revisits his role as Nick Persons from ""Are We There Yet?"" He is now married, with two stepchildren, and expecting twins with his new wife. Realizing that they can no longer live in Nick's small city apartment they find a beautiful fixer-upper in the country, but the problems begin as soon as they move in and realize that their dream home is a money pit. Also with Earvin Johnson, Ice Cube, Nia Long, Aleisha Allen and Philip Bolden. Directed by Steve Carr. [1:32]"
Are We There Yet? , 2005 , PG ,3,4,4,"Ice Cube stars as a playboy bachelor who's interested in a divorcée (Nia Long) who has two children. On one hand, he hates children; on the other hand, her children do not like any of the men their mother dates. When he offers to bring her children to her from Oregon to Canada, the children are determined to turn the trip into a nightmare. Also with Aleisha Allen, Philip Bolden and Jay Mohr. Directed by Brian Levant. [1:31]"
Argo , 2012 , R ,3,6,7,"During the 1979 Iranian Hostage Crisis a CIA agent (Ben Affleck) is charged with rescuing six American hostages under the cover of a phony movie-filming scheme. Working closely with the Canadian Ambassador to Iran (Victor Garber), he keeps the hostages safe and delivers them home after several days of intrigue. Also with Alan Arkin, Bryan Cranston, John Goodman and Kyle Chandler. Directed by Ben Affleck. [2:00]"
