movie_title,movie_year,movie_rating,sex_nudity,violence_gore,language,movie_description
The Man Who Wasn't There , 2001 , R ,4,6,4,"Film noir from Joel and Ethan Coen set in California in the 1940s, about a reserved, unhappy barber (Billy Bob Thornton) who discovers that his wife (Frances McDormand) has been unfaithful. He decides to teach her a lesson by coming up with a blackmailing scheme, but his plan backfires and he becomes involved in murder and suicide instead. Also with James Gandolfini, Michael Badalucco, Scarlett Johansson, Jon Polito, Tony Shalhoub and Katherine Borowitz. [1:57]"
The Man Without a Face , 1993 , PG-13 ,3,1,5,A disfigured former teacher (Mel Gibson) and a troubled boy (Nick Stahl) discover a bond that gives them both peace.
The Man with the Iron Fists , 2012 , R ,7,8,6,"In classic kung-fu movie style, a group of warrior assassins and a British soldier (Russell Crowe) descend upon a feudal Chinese village. But a former slave-turned-freeman and blacksmith (RZA) defends himself and his new home. Also with Lucy Liu, Rick Yune, Jamie Chung and Dave Batista. Directed by RZA. [1:35]"
Map of the Human Heart , 1993 , R ,6,6,5,"Jason Scott Lee stars as an Eskimo who ends up in the British air-force, in 1944. Patrick Bergin co-stars."
Maps to the Stars , 2015 , R ,10,7,9,"A dysfunctional Hollywood family consists of a self-help guru (John Cusack), his wife (Olivia Williams) who manages their teen son's (Evan Bird) acting career after having already spent time in drug rehab, and their daughter (Mia Wasikowska), who's just been released from a psych ward. The daughter becomes the personal assistant to a dysfunctional actress (Julianne Moore) who is haunted by the ghost of her famous mother (Sarah Gadon). Also with Robert Pattinson, Carrie Fisher, Jayne Heitmeyer and Kiara Glasco. Directed by David Cronenberg. [1:51]"
March of the Penguins , 2005 , G ,3,3,0,Documentary that follows the march of Emperor penguins across the frigid Antarctica landscape as they return to their breeding grounds for the mating season. It is a trek they endure every year. Narrated by Morgan Freeman. Directed by Luc Jacquet. [1:24]
Margaret , 2011 , R ,8,6,7,"A young woman (Anna Paquin) witnesses a bus accident and the death of a woman struck by the bus. The days following the accident prove to be trying as she wrestles with lying to the authorities, her mother's new boyfriend, her father's cancellation of a vacation and befriending the dead woman's best friend. Also with J. Smith-Cameron, Mark Ruffalo, Jeannie Berlin, Jean Reno, Sarah Steele, John Gallagher Jr., Cyrus Hernstadt, Allison Janney, Kieran Culkin and Matt Damon. Directed by Kenneth Lonergan. [2:30]"
Margin Call , 2011 , R ,3,2,10,"A look inside a financial institution that has profited handsomely from buying and selling mortgage loans: Set in the first 24 hours of the 2008 financial crisis, a risk analyst (Zachary Quinto) stumbles onto what looks like impending disaster for the company, and it becomes a challenge to find a way out. Also with Kevin Spacey, Paul Bettany, Jeremy Irons, Penn Badgley, Simon Baker, Demi Moore and Stanley Tucci. Directed by J.C. Chandor. [1:49]"
Margot at the Wedding , 2007 , R ,8,5,8,"Nicole Kidman plays an acerbic writer of short stories who appears unsure of the direction of her life, and she decides to take her teenage son and show up at the wedding of her estranged sister (Jennifer Jason Leigh). Arguments ensue immediately, and dark secrets come to the surface, amidst accusations of betrayal. Also with Jack Black, John Turturro and Flora Cross. Directed by Noah Baumbach. [1:31]"
Marie Antoinette , 2006 , PG-13 ,7,3,2,"Kirsten Dunst stars in this historically controversial biopic as the young Austrian woman who was promised to the French king Louis the XVI as a way of cementing the relationship between the two countries. Beautiful but naïve, the new queen becomes the victim of court intrigue and scandal. Eventually, she is stripped of privilege and wealth and beheaded by French revolutionaries. Also with Jason Schwartzman, Asia Argento, Rip Torn and Molly Shannon. Directed by Sofia Coppola. [2:03]"
The Marine , 2006 , PG-13 ,5,7,5,"John Cena stars as a decorated Marine who's discharged for not following orders, after saving fellow Marines from their captors. However, civilian life has its own challenges when during a road trip his wife is kidnapped by criminals and he has to use his military skills to save her. Also with Kelly Carlson, Drew Powell, Robert Patrick and Jeff Chase. Directed by John Bonito [1:33]"
Mark Felt: The Man Who Brought Down the White House , 2017 , PG-13 ,1,2,5,"Based on the real-life story of FBI deputy assistant director Mark Felt (Liam Neeson), who received the moniker ""Deep Throat"" from journalists Carl Bernstein and Bob Woodward when he helped them uncover the Watergate scandal that led to President Richard Nixon's resignation in 1974. Also with Diane Lane, Marton Csokas, Tony Goldwyn, Josh Lucas, Michael C. Hall, Tom Sizemore and Julian Morris. Directed by Peter Landesman. [1:43]"
Marley & Me , 2008 , PG ,5,4,4," Owen Wilson and Jennifer Aniston star as a young married couple that moves to Florida to find the perfect jobs in the perfect climate. While pursuing their dreams, they don't feel totally ready to start a human family, and get a dog instead. The story of their lives with their rambunctious Labrador unfolds. Also with Alan Arkin, Eric Dane, Haley Bennett, Nathan Gamble, Ann Dowd, Clarke Peters and Kathleen Turner. Directed by David Frankel. [2:03]"
Marmaduke , 2010 , PG ,1,2,1,"A Great Dane named Marmaduke (Owen Wilson) struggles to fit in when his human companions relocate to California. Along the way, the whole family comes to terms with what their priorities ought to be. Also with Lee Pace, Judy Greer, David Walliams and William H. Macy and the voices of Emma Stone, George Lopez, Christopher Mintz-Plasse, Steve Coogan, Stacy 'Fergie' Ferguson, Kiefer Sutherland and Sam Elliott. Directed by Tom Dey. [1:27]"
Married Life , 2008 , PG-13 ,3,3,1,"A successful, seemingly happily married man (Chris Cooper) announces to his best friend (Pierce Brosnan) that he is leaving his wife (Patricia Clarkson) for a younger woman (Rachel McAdams). However, he can't bear to see her getting hurt in the process, and he determines that he must murder her, as painlessly as possible. Also with David Richmond-Peck, David Wenham and Annabel Kershaw. Directed by Ira Sachs. [1:30]"
Married to It , 1993 , R ,5,0,7,"Comedy about marriage, divorce and children, concentrating on the lives of three couples from different backgrounds and age groups. Cybill Shepherd, Ron Silver, Beau Bridges, Stockard Channing, Mary Stuart Masterson and Robert Sean Leonard star."
Mars Attacks! , 1996 , PG-13 ,3,7,3,A send-up of cheesy '50s sci-fi flicks.
Marshall , 2017 , PG-13 ,6,5,5,"Based on the true story of the early legal career of Thurgood Marshall (Chadwick Boseman) who became the first African-American Supreme Court Justice. Also with Josh Gad, Kate Hudson, Sterling K. Brown, Dan Stevens, James Cromwell, Keesha Sharp and Roger Guenveur Smith. Directed by Reginald Hudlin. A man says something that could have been in Hebrew with English subtitles. [1:58]"
Mars Needs Moms , 2011 , PG ,1,4,1,"After a boy's (voiced by Seth Green) mom (voiced by Joan Cusack) is kidnapped from Earth by Martians in need of mothering skills, he must work with a new friend (voiced by Dan Fogler) to free his mom, while gaining a new appreciation for all the work she does. Also with the voices of Elisabeth Harnois and Mindy Sterling. Directed by Simon Wells. [1:28]"
Martha Marcy May Marlene , 2011 , R ,8,6,6,"A woman runs away from a cult and tries to find normalcy and relearn how regular people live and behave. With Elizabeth Olsen, Christopher Abbott, Brady Corbet, Hugh Dancy, Maria Dizzia, Julia Garner, John Hawkes, Louisa Krause and Sarah Paulson. Directed by T. Sean Durkin. [1:50]"
The Martian , 2015 , PG-13 ,3,5,5,"During a storm on Mars an astronaut (Matt Damon) disappears and is presumed dead. The remaining astronauts continue their mission and return to Earth not realizing that their crew member has survived and he's trying to stay alive on the inhospitable planet. Also with Jessica Chastain, Kristen Wiig, Jeff Daniels, Michael Peña, Sean Bean, Kate Mara, Sebastian Stan, Aksel Hennie, Chiwetel Ejiofor, Mackenzie Davis and Donald Glover. Directed by Ridley Scott. [2:21]"
Martian Child , 2007 , PG ,2,2,3,"A science fiction writer (John Cusack) is trying to deal with grief after the death of his wife, and decides to pursue her dream of adopting a child. When he meets an orphan boy that nobody wants because he believes he is from Mars and is on a mission to study human behavior, he isn't so sure he is cut out to be his surrogate father, but he wants to try nevertheless. A series of strange events does make him wonder whether the boy's extraordinary claim may be true. Also with Amanda Peet, Joan Cusack, Sophie Okonedo and Oliver Platt. Directed by Menno Meyjes. [1:48]"
Mary Reilly , 1996 , R ,3,7,1,Julia Roberts and John Malkovich redo the Dr. Jekyll/Mr. Hyde story as seen through the eyes of housemaid Mary Reilly.
Mary Shelley's Frankenstein , 1994 , R ,5,7,2,"Updating of the classic horor tale with Robert De Niro as the creature, and Kenneth Branagh as the doctor."
The Mask , 1994 , PG-13 ,2,4,3,Jim Carrey plays a milquetoast who acquires superhero powers when he puts on an ancient mask.
The Mask of Zorro , 1998 , PG-13 ,3,7,2,Anthony Hopkins is the retired Zorro who trains Antonio Banderas to be the new Zorro.
The Master , 2012 , R ,8,5,9,"After a mentally disturbed WWII veteran (Joaquin Phoenix) returns from the war, he is taken under the wing of the Master (Philip Seymour Hoffman), the charismatic leader of ""The Cause,"" a faith-based movement. Also with Amy Adams, Jesse Plemons, Ambyr Childers and Patty McCormack. Directed by Paul Thomas Anderson. [2:17]"
Master and Commander: The Far Side of the World , 2003 , PG-13 ,3,6,5,"Naval adventure taking place during the Napoleonic wars, based on Patrick O'Brian's books: British captain Lucky Jack Aubrey (Russell Crowe) got his name from being lucky at outmaneuvering his opponents in any situation. His current orders are to sail his vessel, The Surprise, across the seas, to seek, intercept and capture French ships. The ship's doctor (Paul Bettany) serves as the captain's confidant and conscience. Also with Ian Mercer, James D'Arcy and John Desantis. Directed by Peter Weir. [2:20]"
Masterminds , 1997 , PG-13 ,1,6,4,A teenager tries to thwart a kidnapping/ransom attempt.
Masterminds , 2016 , PG-13 ,3,4,5,"Based on actual events: In 1997 a bored armored car driver (Zach Galifianakis) lets a crush on a colleague (Kristen Wiig) lure him into the North Carolina ""Hillbilly Heist"" along with a group of dimwits under the leadership of a trailer park playboy (Owen Wilson). The police, as well as a hit man (Jason Sudeikis), go after them. Also with Kate McKinnon, Leslie Jones and Jon Daly. Directed by Jared Hess. [1:30]"
The Master of Disguise , 2002 , PG ,3,3,3,"Pistachio Disguisey (Dana Carvey) has gone through life feeling he is different than other people, but never really knowing just by how much. When his mother and father are kidnapped by a criminal mastermind (Brent Spiner) he discovers that he has the power to disguise himself as anything -- from a turtle man to a lump of grass with a cow pie on it -- and he's off to the rescue. Also with Jennifer Esposito, Harold Gould and James Brolin. [1:20]"
Matchstick Men , 2003 , PG-13 ,5,5,5,"Nicolas Cage stars as a neurotic confidence man, who, along with his partner (Sam Rockwell), works over the telephone, swindling the naïve and gullible out of their money. He has a big hit planned when his estranged 14-year-old daughter appears on his doorstep and wants to become a part of his life. Should he turn her away knowing what kind of life he leads or should he bring her in on the high-risk scam? It's one more stressful issue he has to deal with and it intensifies his neurotic episodes. Also with Alison Lohman, Bruce McGill and Bruce Altman. Directed by Ridley Scott. [1:56]"
Matilda , 1996 , PG ,0,3,2,A young girl has her revenge on the stupid and mean adults in her life when she develops telekinetic powers.
Matinee , 1993 , PG ,1,2,1,"John Goodman stars as a producer of schlock ""B"" horror movies, who comes to Key West, Florida for a personal appearance. But, it's the time of the Cuban Missile crisis which contains the real horror of atomic warfare."
The Matrix , 1999 , R ,2,7,5,"Futuristic thriller about computer hacker Neo (Keanu Reeves), who gets appointed by rebel Morpheus (Laurence Fishburne) to help save the world from evil cyber-intelligence the Matrix. Also with Carrie-Anne Moss, Joe Pantoliano, Hugo Weaving, Belinda McClory, Julian Arahanga, Marcus Chong, Robert Taylor, Matt Doran and Paul Goddard. [2:15]"
The Matrix Reloaded , 2002 , R ,6,7,5,"Keanu Reeves, Carrie-Anne Moss and Laurence Fishburne return as Neo, Trinity and Morpheus, respectively, and continue to battle the machines within the artificial reality created in the Matrix. But as more and more people awake and escape to the real world, the battle lines move from the virtual world to the last real city, Zion. Also with Hugo Weaving, Matt McColm, Jada Pinkett Smith, Monica Bellucci, Lambert Wilson, Harold Perrineau Jr., Harry J. Lennix, Clayton Watson, Adrian Rayment and Neil Rayment. Directed by Andy Wachowski & Larry Wachowski. [2:19]"
The Matrix Revolutions , 2003 , R ,5,7,4,"The third installment of the sci-fi action adventure finds the last free humans surviving underground and preparing for an onslaught by the machines who are bent on destroying them. Meanwhile Neo continues exploring his powers and trying to understand what his destiny is, and Agent Smith keeps multiplying and getting stronger and stronger, threatening both the real world and the Matrix. Trinity (Carrie-Ann Moss) and Morpheus (Laurence Fishburne) are along to lend a hand. Also with Hugo Weaving and Jada Pinkett-Smith. Directed by Larry & Andy Wachowski. [2:09]"
Maudie , 2017 , PG-13 ,5,3,2,"In the 1930s a woman (Sally Hawkins) struck with crippling arthritis runs away from her controlling aunt (Gabrielle Rose) to keep house for a rough-mannered fishmonger (Ethan Hawke). Living in a tiny house in Nova Scotia, the couple becomes famous when the arthritic woman cultivates her primitive artistic talent and sells several paintings. Also with Kari Matchett, Zachary Bennett and Greg Malone. Directed by Aisling Walsh. [1:55]"
Maverick , 1994 , PG ,2,3,3,"Mel Gibson, Jodie Foster and James Garner star in this rough-and-tumble Western comedy based on Garner's ""Maverick"" TV series from the '60s."
Max , 2015 , PG ,1,4,2,"A Belgian Malinois military dog (Carlos) on the Afghanistan front assists his handler, a US Marine (Robbie Amell), until the soldier dies in combat. The traumatized dog is retired and sent to the Marine's family to adjust or be put down and the Marine's younger brother (Josh Wiggins) bonds with the dog. Also with Thomas Haden Church, Luke Kleintank, Lauren Graham, Mia Xitali and jay Hernandez. Directed by Boaz Yakin. Several lines of dialogue are in Spanish, without translation or subtitles. [1:51]"
Maximum Risk , 1996 , R ,5,9,5,Jean Claude Van Damme uncovers a connection between the FBI and the Russian Mafia.
Max Keeble's Big Move , 2001 , PG ,3,4,3,"A boy (Alex D. Linz) who's just starting junior high finds out his family is relocating. So he decides that this is the perfect opportunity for payback against school bullies and a dishonest school official. But then he finds out that his family is not moving after all, and now he needs to clean up all the messes he has created. Also with Zena Grey, Larry Miller, Josh Peck and Amber Valletta. [1:26]"
Max Payne , 2008 , PG-13 ,4,6,5,"Not being able to let go of the memory of his wife and child after they've been murdered, police detective Max Payne (Mark Wahlberg) follows a trail of clues that connect a current murder case to that of his wife. Also with Mila Kunis, Beau Bridges, Jamie Hector, Chris Ludacris Bridges, Chris O Donnell and Amaury Nolasco. Directed by John Moore. [1:39]"
Max Steel , 2016 , PG-13 ,1,5,4,"A teenager (Ben Winchell) discovers that he can emit waves of tachyon energy, but cannot control them until a quirky extraterrestrial (voiced by Josh Brener) asks to link their skills and channel the energy to save lives. When joined, they become an incredible superhero who must confront a mad scientist (Andy Garcia) and super-villains from a far off galaxy. Also with Maria Bello, Ana Villafane and Mike Doyle. Directed by Stewart Hendler. [1:32]"
The Maze Runner , 2014 , PG-13 ,1,6,4,"A teen boy (Dylan O'Brien) is taken by an elevator to a place called the ""Glade"" where he is told by several other teen boys and young men that there is no way out. The others have been there for as long as three years and beyond enormous stone walls lies an ever-shifting maze where horrible creatures wait for them. Also with Aml Ameen, Ki Hong Lee, Blake Cooper, Thomas Brodie-Sangster, Will Poulter, Dexter Darden, Kaya Scodelario, Chris Sheffield, Joe Adler, Alexander Flores, Jacob Latimore , Randall D. Cunningham and Patricia Clarkson. Directed by Wes Ball. [1:53]"
Maze Runner: The Death Cure , 2018 , PG-13 ,1,5,4,"In this third installment of the ""Maze Runner"" trilogy, the leaders of the surviving Gladers (Dylan O'Brien, Thomas Brodie-Sangster and Dexter Darden) fight to free teenage victims of unethical medical experiments designed to find a cure for a zombie virus. Also with Kaya Scodelario, Nathalie Emmanuel, Giancarlo Esposito, Aidan Gillen, Walton Groggins, Ki Hong Lee, Barry Pepper, Will Poulter and Patricia Clarkson. Directed by Wes Ball. [2:22]"
Maze Runner: The Scorch Trials , 2015 , PG-13 ,2,6,4,"The young people who survived the Maze from the first installment find themselves running for their lives through a city in rubble to find what they hope will be a place free from danger. With Dylan O'Brien, Ki Hong Lee, Kaya Scodelario, Thomas Brodie-Sangster, Dexter Darden, Alexander Flores, Jacob Lofland, Rosa Salazar, Giancarlo Esposito, Patricia Clarkson and Aidan Gillen. Directed by Wes Ball. [2:11]"
McFarland USA , 2015 , PG ,2,4,2,"A new coach (Kevin Costner) moves to a Hispanic high school in 1980s California and finds his track team members culturally unfamiliar, but with extraordinary skills. As he learns about their strong family ties and work ethic he also learns about himself. Also with Maria Bello, Morgan Saylor, Carlos Pratts and Valente Rodriguez. Directed by Nikki Caro. Several lines of dialogue are in Spanish with English subtitles. [2:08]"
McHale's Navy , 1997 , PG ,1,3,3,Tom Arnold is retired Navy officer McHale -- recalled to duty to stop a terrorist.
Mean Creek , 2004 , R ,4,5,8,"Rory Culkin stars as a boy who has been bullied one too many times. He and his older brother (Trevor Morgan) devise a plan of revenge against the bully (Josh Peck) during a boat trip. While they soon start having second thoughts, a friend of theirs (Scott Mechlowicz) is determined to follow through. Also with Ryan Kelley and Carly Schroeder. Directed by Jacob Aaron Estes. [1:27]"
Me and Earl and the Dying Girl , 2015 , PG-13 ,4,4,5,"Afraid of relationships, a high-school movie fan (Thomas Mann) is forced by his mom (Connie Britton) to visit a terminally ill classmate (Olivia Cooke). Slowly, the boy and girl become inseparable elements in a doomed relationship, as he continues to make parody movies with his best friend (Ronald Cycler). Also with Connie Britton, Molly Shannon, Katherine C. Hughes, Jon Bernthal and Nick Offerman. Directed by Alfonso Gomez-Rejon. [1:35]"
Me and Orson Welles , 2009 , PG-13 ,3,3,4,"When a teenager (Zac Efron) happens upon a role in Orson Welles' (Christian McKay) Mercury Theatre opening of ""Julius Caesar"" during a whirlwind week in 1937, he learns that not all is fair in love and theater. Also with Claire Danes, Zoe Kazan and Ben Chaplin. Directed by Richard Linklater. [1:54]"
Mean Girls , 2004 , PG-13 ,5,4,4,"A home-schooled teenager (Lindsay Lohan) who has spent her early life traveling with her archaeologist parents, has to attend a public high school for the first time when her mother accepts a position at a university. Befuddlement begins immediately as she tries to determine whether being popular is better than being herself, and has to confront the unwritten social rules and psychological intricacies that govern high school life. Also with Tina Fey, Lizzy Caplan, Rachel McAdams, Lacey Chabert, Daniel Franzese, Tim Meadows, Jonathan Bennett and Amanda Seyfried. Directed by Mark S. Waters. [1:30]"
Me Before You , 2016 , PG-13 ,3,2,2,"A man (Sam Claflin) is confined to a wheelchair after an accident and a spinal cord injury and appears inconsolable until a new aide (Emilia Clarke) enters his life and they fall in love. However, he's still not dissuaded from ending his life and pursuing assisted suicide. Also with Vanessa Kirby, Eileen Dunwoodie, Janet McTeer, Charles Dance and Stephen Peacocke. Directed by Thea Sharrock. [1:50]"
The Mechanic , 2011 , R ,7,8,6,"A remake of the eponymous 1972 Charles Bronson film: Jason Statham plays an elite professional assassin, who decides to take on an apprentice (Ben Foster). The younger man's father had been assassinated and he has problems with substance abuse, which threaten their relationship. Also with Tony Goldwyn, Donald Sutherland, Mini Anden and Jeff Chase. Directed by Simon West. [1:40]"
Mechanic: Resurrection , 2016 , R ,5,6,5,"After retiring to a small island a professional assassin (Jason Statham) tries to get away from his past. Unfortunately, a former acquaintance won't allow it and holds a woman (Jessica Alba) hostage until the assassin commits three murders that have to look like accidents. Also with Tommy Lee Jones, Michelle Yeoh and Sam Hazeldine. Directed by Dennis Gansel. Some dialogue is in Portuguese, Thai, Khmer and Bulgarian with and without English subtitles. [1:39]"
The Medallion , 2003 , PG-13 ,2,5,3,"Jackie Chan stars as a Hong Kong detective who, after an incident involving a mysterious medallion, is transformed into an immortal warrior with superhuman powers. Now he is on the trail of a man called Snakehead (Julian Sands), who has stolen half of the medallion and hopes to become immortal himself. Also with Claire Forlani, John Rhys-Davies, Anthony Wong Chau-Sang, Christy Chung and Johann Myers. Directed by Gordon Chan. [1:28]"
The Meddler , 2016 , PG-13 ,2,3,5,"After the death of her husband, a woman (Susan Sarandon) moves to LA to be closer to her daughter (Rose Byrne). However, the proximity makes the daughter's life more difficult and she struggles with her mother's constant interference. Also with J.K. Simmons, Jerrod Carmichael, Cecily Strong, Lucy Punch, Michael McKean, Jason Ritter, Sarah Baker, Casey Wilson, Amy Landecker, Billy Magnussen and Megalyn Echikunwoke. Directed by Lorene Scafaria. [1:40]"
Meek's Cutoff , 2011 , PG ,2,3,3,"In 1845, during the early days of the Oregon Trail, several settlers (Michelle Williams, Paul Dano, Will Patton and Zoe Kazan) are lead by a frontiersman (Bruce Greenwood), but when they find themselves stranded in the Oregon desert, they soon become desperate. Directed by Kelly Reichardt. [1:44]"
Meet Dave , 2008 , PG ,2,3,2,"Eddie Murphy stars both as the tiny alien captain of an extraterrestrial ship, and as the spaceship, which is in the shape of a regular-sized man and resembles Murphy. His mission is to return to his dying planet with all the salt from the Earth's oceans. Also with Elizabeth Banks, Ed Helms, Gabrielle Union, Judah Friedlander, Pat Kilbane, Brandon Molale, Marc Blucas, Austyn Myers and Nick Berman. Directed by Brian Robbins. [1:30]"
Meet Joe Black , 1998 , PG-13 ,4,3,6,"Brad Pitt is death warmed over in this romantic drama. Also Anthony Hopkins, Claire Forlani and Marcia Gay Harden."
Meet the Blacks , 2016 , R ,5,6,10,"When a family steals a million dollars in drug money, the dad (Mike Epps) moves them from Chicago to Beverly Hills, unwittingly just in time for the annual Purge Night. Their Chicago creditors come to hunt them down during the 12-hour crime spree in which lawbreaking of all kinds is allowed for one night. Also with Gary Owen, Zulay Henao, Mike Tyson, George Lopez, Lil Duval and Bresha Webb. Directed by Deon Taylor. A few lines of dialogue are in Spanish without subtitles or translation [1:33]"
Meet the Deedles , 1998 , PG ,2,3,2,A couple of surfers (Paul Walker and Steve Van Wormertry) try to make it on land as Park Rangers.
Meet the Fockers , 2004 , PG-13 ,6,4,4,"After giving permission to male nurse Greg Focker (Ben Stiller) to marry his daughter (Teri Polo), the uptight ex-CIA agent (Robert De Niro) and his wife (Blythe Danner) travel to Detroit to meet Focker's parents (Dustin Hoffman and Barbra Streisand]. Directed by Jay Roach. [1:54]"
Meet the Parents , 2000 , PG-13 ,2,2,6,"Ben Stiller stars as a prospective bridegroom who meets his fiancée's parents and everything that can go wrong does. Also with Robert De Niro, Nicole DeHuff, Blythe Danner, Teri Polo, Jon Abrahams, James Rebhorn, Phyllis George and Owen Wilson. [1:48]"
Meet the Robinsons , 2007 , G ,1,3,1,"A young orphan is desperate to find someone to adopt him, when he meets a mysterious boy from the future named Wilbur Robinson. Wilbur takes him to meet a family and convinces him that he must not give up on his dreams. With the voices of Angela Bassett, Jordan Fry, Tom Kenny, Harland Williams and Adam West. Directed by Stephen J. Anderson. [1:32]"
