movie_title,movie_year,movie_rating,sex_nudity,violence_gore,language,movie_description
Meet the Spartans , 2008 , PG-13 ,7,7,5,"A spoof of the hit movie ""300,"" which was about the ancient Battle of Thermopylae, where a small contingent of Greeks fought a much larger Persian army. With Sean Maguire, Diedrich Bader, Kevin Sorbo, Martin Klebba, Jim Piddock, Method Man, Tony Yalda, Carmen Electra and Kenneth Davitian. Directed by Jason Friedberg and Aaron Seltzer. [1:24]"
Meet Wally Sparks , 1997 , R ,6,3,6,Rodney Dangerfield plays an obnoxious talk show host.
Megamind , 2010 , PG ,2,4,3,"In a parody of superhero films, a hapless blue-skinned alien (with the voice of Will Ferrell) is in competition with a human-looking superhero (with the voice of Brad Pitt). Shot into space from dying worlds as infants, they land on Earth and are treated very differently: One is practically worshiped, while the other is rejected and applies his intellect to evil, but can accomplish nothing until an accident puts him in control of a city. Also with the voices of David Cross, Jonah Hill, Tina Fey and Ben Stiller. Directed by Tom McGrath. [1:36]"
Megan Leavey , 2017 , PG-13 ,3,5,5,"Based on a true story: A socially awkward USMC corporal (Kate Mara) trains a military combat dog that is too aggressive for anyone else to handle. She and the dog succeed in over 100 missions in Iraq, but when an IED explodes, their injuries and a separation put them both in jeopardy. Also with Bradley Whitford, Ramon Rodriguez, Tom Felton, Common, Edie Falco and Will Patton. Directed by Gabriela Cowperthwaite. [1:56]"
Melancholia , 2011 , R ,7,4,5,"As a recently discovered planet threatens to collide with Earth and destroy all life, two sisters (Charlotte Gainsbourg and Kirsten Dunst) find their strained relationship even more difficult to deal with than coming to terms with the impending end of the world. Also with Kiefer Sutherland, Alexander Skarsgård and Brady Corbet. Directed by Lars von Trier. [2:16]"
Memoirs of a Geisha , 2005 , PG-13 ,5,5,3,"In the years before World War II, two Japanese girls are sold by their poor father when he can no longer feed them. They are separated, and one is forced to become the slave to a Geisha as punishment for ingratitude. After a chance meeting with a wealthy businessman, the young girl vows that she will train to become a Geisha, and indeed she becomes beautiful and accomplished, captivating the powerful men of her day. With Ziyi Zhang, Ken Watanabe, Gong Li, Michelle Yeoh and Youki Kudoh. Directed by Rob Marshall. [2:17]"
"Me, Myself & Irene ", 2000 , R ,6,6,10,"Jim Carrey plays a lovable state trooper who suffers from a multiple personality disorder and falls helplessly in love with the beautiful Irene (Renee Zellweger). Also with Robert Forster, Richard Jenkins, Anthony Anderson, Michael Bowman, Ezra Buzzington, Mark Patrick Costello, Zen Gesner, Danny Green, Jessica Harper, Traylor Howard, John-Eliot Jordan, Anna Kournikova, Jerod Mixon, Rob Moran, Lin Shaye and Shannon Whirry. [1:56]"
Menace II Society , 1993 , R ,2,9,9,"Modern-day tragedy about life in the American ghetto, specifically south-central LA, it follows a young man as he becomes more and more caught up in the business of the street -- crime, murder and revenge. By the time he decides to turn away, it may be too late. Directed by 21-year-old twin brothers Allen and Albert Hughes."
Men in Black , 1997 , PG-13 ,1,5,4,Tommy Lee Jones and Will Smith battle aliens.
Men In Black II , 2002 , PG-13 ,2,5,4,"MIB agent K (Tommy Lee Jones) is pulled out of retirement by MIB agent J (Will Smith) to save the planet from an alien in the shape of Lara Flynn Boyle, who's determined to find something that was left on Earth back in the 1970s. Wormy creatures, tentacled creatures, bird and reptilian creatures abound as the supporting cast. Also Rip Torn, Rosario Dawson, Patrick Warburton, Johnny Knoxville and Michael Jackson. [1:20]"
Men In Black 3 , 2012 , PG-13 ,3,5,4,"In the third sequel Agent J (Will Smith) travels back in time to find out what happened to Agent K (Tommy Lee Jones) and why he is suddenly missing. Josh Brolin stars as the younger version of Agent K. Also with Jemaine Clement, Emma Thompson, Michael Stuhlbarg and Mike Colter. Directed by Barry Sonnenfeld. [1:43]"
Men of Honor , 2000 , R ,3,5,7,"Cuba Gooding Jr. plays Carl Brashear, the Navy's first black deep sea diver, and Robert De Niro plays his racist officer, Billy Sunday. We follow Brashear on his quest to become a master chief diver in the highly racist 1950s. Based on a true story. Also with Charlize Theron, Aunjanue Ellis, Hal Holbrook, David Keith, Michael Rapaport, Powers Boothe and Joshua Leonard. [2:08]"
Mental , 2013 , R ,5,6,6,"Australian film about a woman (Toni Collette) who comes to help a family after their mother (Rebecca Gibney) goes to a psychiatric hospital; however, when she also turns out to be mentally unstable, their family has to band together. Also with Live Schreiber, Anthony LaPaglia and Deborah Mailman. Directed by P.J. Hogan. [1:56]"
The Men Who Stare at Goats , 2009 , R ,6,5,7,"A recently jilted newspaper man (Ewan McGregor) follows a far fetched story about an elite group of U.S. service men trained by the military in psychic warfare that includes mind-over-matter techniques. Also with George Clooney, Ewan McGregor, Jeff Bridges, Kevin Spacey, Rebecca Mader, Stephen Lang, Nick Offerman, Tim Griffin and Waleed Zuaiter. Directed by Grant Heslov. [1:33]"
"Men, Women and Children ", 2014 , R ,9,5,7,"Texas high school students and their parents have technology concerns about porn sites and online video games, infidelity, eating disorders, and the lust for fame at any price: One couple (Adam Sandler and Rosemarie DeWitt) finds extramarital lovers through the Internet, another (Jason Douglas and Jennifer Garner) struggles over electronically monitoring their teen daughter, and a mom (Judy Greer) markets her daughter with raunchy online photos. Also with Travis Tope, Kaitlyn Dever, Olivia Crocicchia, Dean Norris, Ansel Elgort, Emma Thompson (narrator) and Dennis Haysbert. Directed by Jason Reitman. [2:00]"
Mercury Rising , 1998 , R ,0,7,6,Bruce Willis tries to protect an autistic boy from ruthless government agents.
The Merry Gentleman , 2009 , R ,6,5,5,"A woman (Kelly MacDonald) escapes from her abusive husband (Bobby Cannavale) by fleeing to Chicago to start over. She meets a man (Michael Keaton), but she does not know he is a hit man. She becomes entangled in his life by asking for help in a small matter, and at the same time, an alcoholic detective (Tom Bastounes), pursues her both romantically and professionally, since he is investigating her husband, as well as the mysterious man she has just met. Also with Guy Van Swearingen, Darlene Hunt and William Dick. Directed by Michael Keaton. [1:39]"
Message in a Bottle , 1999 , PG-13 ,3,2,3,"Robin Wright Penn, Kevin Costner and Paul Newman star in this drama about a woman's search for the writer of a love letter she accidentally found in a floating bottle. Also with Illeana Douglas, Robbie Coltrane, Jesse James and John Savage."
The Messenger , 2009 , R ,8,6,7,"A man (Ben Foster) returns home from combat duty after sustaining injuries and has 20 months remaining on his tour. After recovering, he is assigned to the Casualty Notification Team where he and another officer (Woody Harrelson) are tasked with informing the relatives of soldiers who have been killed in action. Also with Samantha Morton, Jena Malone, Eamonn Walker and Steve Buscemi. Directed by Oren Moverman. [1:45]"
The Messenger: The Story of Joan of Arc , 1999 , R ,3,9,6,"Milla Jovovich plays Joan of Arc, a 15th century peasant girl who hears voices from God that help her lead the French in several victorious battles against the English. Also with John Malkovich, Faye Dunaway, Dustin Hoffman, Pascal Greggory, Vincent Cassel, Tchéky Karyo, Richard Ridings, Desmond Harrington, Timothy West, Christian Erickson, Mathieu Kassovitz, John Merrick and Olivier Rabourdin. [2:28]"
The Messengers , 2007 , PG-13 ,3,7,3,"A family that has fallen on hard times decides to move to the country and try to make a go of running a sunflower farm. So they buy a rundown and long abandoned farmhouse, move in, but shortly afterward their two children begin to experience unusual encounters with supernatural entities that do not seem friendly. With Kristen Stewart, Dylan McDermott, Penelope Ann Miller and John Corbett. Directed by Oxide & Danny Pang. [1:30]"
The Meteor Man , 1993 , PG ,1,4,2,"Robert Townsend directs and stars as a meek high school teacher who's struck by a meteor and thereby endowed with the usual super powers: super strength, speed, invincibility, X-ray vision and flight."
Metro , 1997 , R ,3,8,9,Hostage negotiator Eddie Murphy wants to get a jewel thief after the thief kills his friend.
The Mexican , 2001 , R ,3,7,10,"A mob errand runner (Brad Pitt) has to go to Mexico to retrieve a priceless pistol, but he also has to keep his promise to his girlfriend (Julia Roberts) that this trip is his last as a mobster. Also with James Gandolfini, Bob Balaban and J.K. Simmons. [2:03]"
Mia and the Migoo , 2008 , PG ,1,3,3,"An animated tale about a man (voiced by Jesse Corti) that misses his young daughter (voiced by Amanda Misquez), after leaving her behind in his village in order to help build an exclusive South American resort. The developer (voiced by John DiMaggio) is a greedy bully that misuses natural resources and neglects his son (voiced by Vincent Agnello), and after a scary dream, the young girl sets out with her good luck charms to find her dad and heal the forest. Once in the woods, she meets a shape shifter (voiced by Wallace Shawn), who calls in his brothers to protect a magic tree before it is cut down. Also with the voices of Whoopi Goldberg, Matthew Modine and James Woods. Directed by Jacques-Rémy Girerd. [1:32]"
Miami Vice , 2006 , R ,7,8,6,"Colin Farrell and Jamie Foxx take over as Sonny Crockett and Ricardo Tubbs, the main characters from the hit 1980s television series. Working as undercover police officers in the world of South Florida drug trafficking, they try to balance their real lives against the illicit temptations and glamour of their mission. Also with Gong Li, Naomie Harris and Ciaràn Hinds. Directed by Michael Mann. [2:15]"
Michael , 1997 , PG ,2,2,2,John Travolta is a rather earthly angel.
Michael Clayton , 2007 , R ,4,5,6,"George Clooney stars as a man referred to as a ""janitor"" and a ""fixer"" since he works for a law firm cleaning up messy situations that involve powerful corporations. His most recent task is to find out why the lead attorney defending a large chemical company is instead preparing briefs that prove his client is indeed guilty of knowingly using poisonous chemicals that have killed several people. Also with Tom Wilkinson, Tilda Swinton, Sydney Pollack and Pamela Gray. Directed by Tony Gilroy. [2:00]"
Michael Collins , 1996 , R ,1,8,8,Biopic of Irish leader and freedom fighter Michael Collins (Liam Neeson).
Michael Jackson: This Is It , 2009 , PG ,3,3,1,"Documentary of rehearsals prior to the late Michael Jackson's long awaited return to the stage. Also with Daniel Celebre, Shannon Holtzapffel and Charles Klapow. Directed by Kenny Ortega. [1:51]"
Mickey Blue Eyes , 1999 , PG-13 ,4,5,5,"In this comedy, an English art auctioneer (Hugh Grant) determined to show the woman he loves (Jeanne Tripplehorn) that he won't get involved with her mobster family, ends up getting involved with her mobster family. Also with James Caan, New York Joe Catalfumo, Margaret Devine, John DiResta, James Fox, Mark Margolis, Scott Thompson, Joe Viterelli and Burt Young. [1:42]"
Micmacs , 2010 , R ,7,6,4,"A boy's soldier father is killed by a landmine, and as an adult (Dany Boon) he works in a video store and watches old black-and-white films. One day he is struck in the head by a stray bullet in a botched drive-by shooting and after his hospital stay, finds himself homeless, jobless and destitute. Afterward, he meets an ex-felon (Jean-Pierre Marielle) who makes a living in scrap metal and joins him and an eccentric group of genius outcasts in a wonderland of a salvage yard under the freeway, and together, they take revenge against arms manufacturers. Also with Albert Dupontel, Dominique Pinon, André Dussollier and Julie Ferrier. Directed by Jean-Pierre Jeunet. [1:46]. In French with English subtitles."
Middle of Nowhere , 2012 , R ,4,3,5,"After a woman's (Emayatzy Corinealdi) husband (Omari Hardwick) is sentenced to eight years in prison, she feels like she is serving the time with him, as she trudges through life. Also with David Oyelowo, Sharon Lawrence and Lorraine Toussaint. Directed by Ava DuVernay. [1:39]"
Middle School: The Worst Years of My Life , 2016 , PG ,2,3,3,"A middle school student (Griffin Gluck) enjoys an expansive imagination and dislikes authority figures. When he attends a school where he is expected to follow a massive list of rules, trouble begins. With a friend (Thomas Barbusca) he plots pranks against the uptight principal (Andy Daly) in order to annoy him and impress a female classmate (Isabela Moner). Also with Lauren Graham, Rob Riggle, Adam Pally and Retta. Directed by Steve Carr. A few phrases are spoken in Spanish without translation. [1:32]"
Midnight in Paris , 2011 , PG-13 ,4,2,4,"During a magical trip to Paris, a writer (Owen Wilson) and his fiancée (Rachel McAdams) are forced to confront their misgivings about each other and the illusion of a life that is different than their current reality. Also with Kathy Bates, Kurt Fuller, Michael Sheen, Carla Bruni, Corey Stoll, Alison Pill and Adrien Brody. Directed by Woody Allen. [1:40]"
Midnight in the Garden of Good and Evil , 1997 , R ,3,5,7,A reporter (John Cusack) investigates Southern culture in the midst of a murder trial.
Midnight Special , 2016 , PG-13 ,0,5,2,"A man (Michael Shannon) kidnaps his young son (Jaeden Lieberher) from a commune and makes his way across the country while being trailed by the FBI, the NSA and commune henchmen. Also with Joel Edgerton, Kirsten Dunst, Adam Driver, Sam Shepard and Paul Sparks. Directed by Jeff Nichols. A few lines of dialogue are in Spanish without translation. [1:52]"
A Midsummer Night's Dream , 1999 , PG-13 ,6,2,2,"In this adaptation of William Shakespeare's play, lovers fall for the least likely partners when a mischievous nymph casts a spell upon them. With Christian Bale, Rupert Everett, Calista Flockhart, Anna Friel, Bill Irwin, Gregory Jbara, Kevin Kline, Sophie Marceau, Michelle Pfeiffer, Roger Rees, Sam Rockwell, John Sessions, David Strathairn, Stanley Tucci, Dominic West and Max Wright. [1:55]"
The Mighty , 1998 , PG-13 ,0,5,3,"A terminally-ill boy and a social misfit with a troubled past become friends and fashion themselves as modern-day knights of King Arthur's court. With Kieran Culkin, Elden Ratliff, Sharon Stone, Gena Rowlands, Harry Dean Stanton, Gillian Anderson, James Gandolfini, Douglas Bisset, Joseph Perrino, Dov Tiefenbach, Michael Colton, Daniel Lee, Eve Crawford, John Bourgeois and Bruce Tubbe. [1:40]"
Mighty Ducks , 1992 , PG ,1,2,2,Emilio Estevez stars as a lawyer doing community service who becomes coach to a pee wee hockey team.
A Mighty Heart , 2007 , R ,4,4,6,"While working in Pakistan in 2002, journalist Daniel Pearl (Dan Futterman) disappears the night before he and his wife Mariane Pearl (Angelina Jolie) are scheduled to leave for home. When a terrorist group claims to have kidnapped him, and begins threatening his life if their demands are not complied with, the events spark an international effort to find him. Based on Mariane Pearl's memoir and based on actual events. Also with Archie Panjabi, Irrfan Khan, Adnan Siddiqui, Alyy Khan and Denis O'Hare. Directed by Michael Winterbottom. [1:43]"
Mighty Joe Young , 1998 , PG ,1,5,1,An orphaned girl and a giant gorilla go through great pains to take care of each other in a world that seems to have no safe place for either of them. Bill Paxton and Charlize Theron co-star.
The Mighty Macs , 2011 , G ,3,1,1,"Based on the true story of the 1972 Immaculata College female basketball team and their coach Cathy Rush (Carla Gugino), who took the small religious school all the way to win the National Championship. Also with David Boreanaz, Marley Shelton, Ellen Burstyn and Lauren Bittner. Directed by Tim Chambers. [1:42]"
Mighty Morphin Power Rangers: The Movie , 1995 , PG ,1,3,1,Six teenagers combat evil (in the form of Ivan Ooze) with martial arts moves and computer generated special effects.
A Mighty Wind , 2003 , PG-13 ,4,2,4,"In the tradition of the heavy metal mockumentary ""This is Spinal Tap,"" for this feature Christopher Guest, Eugene Levy, Michael McKean and Harry Shearer make folk music their fodder for satire: A legendary folk music promoter dies and his son decides to pay tribute to him by organizing a concert with the performers that his father helped to make famous. One of the performing trios calls itself the Folksmen and specializes in the rather unorthodox genre of ""eclectified folk music."" Also with Bob Balaban, Catherine O'Hara, Ed Begley, Jr. and Parker Posey. Directed by Guest. [1:27]"
Mike and Dave Need Wedding Dates , 2016 , R ,8,5,10,"Two brothers (Adam DeVine and Zac Efron) wreak havoc at family celebrations with reckless stunts. To stop them from destroying their sister's Hawaiian wedding, their parents issue an ultimatum to the brothers, instructing them to bring responsible dates with them. After a TV talk show appearance, two women (Aubrey Plaza and Anna Kendrick) answer the brothers' plea, but turn out to be unpredictable. Also with Stephen Root, Sugar Lyn Beard, Sam Richardson and Stephanie Faracy. Directed by Jake Szymanski. [1:38]"
Miles Ahead , 2016 , R ,6,6,10,"A look at the tumultuous period in the late 1970s when jazz legend and musical genius Miles Davis (Don Cheadle) all but disappeared from the music world. For 5 years he suffered from physical and emotional pain and drug abuse but then returned to accolades. Also with Ewan McGregor, Michael Stuhlbarg, Emayatzy Corinealdi, Keith Stanfield, Christina Karis, Austin Lyon, Nina Smilow, Joshua Jessen and Theron Brown. Directed by Don Cheadle. [1:40]"
Milk , 2008 , R ,8,6,6,"Sean Penn stars as Harvey Milk, the first openly gay man to be voted into public office. Before he was assassinated in 1978, he organized the gay rights movement by uniting support from many disparate camps. Also with Allison Pill, Josh Brolin, Emile Hirsch, James Franco, Victor Garber, Diego Luna and Denis O'Hare. Directed by Gus Van Sant. [2:07]"
Milk Money , 1949 , PG-13 ,4,3,3,Three pre-pubescent boys are interested in learning whatever there is to know about sex. With Ed Harris and Melanie Griffith.
Million Dollar Arm , 2014 , PG ,3,2,2,"A sports agent (John Hamm) and his partner (Aasif Mandvi) are about to lose their agency when one of them decides to recruit Indian cricket bowlers as pitchers for the MLB. Also with Suraj Sharma, Madhur Mittal, Alan Arkin, Lake Bell, Allyn Rachel and Bill Paxton. Directed by Craig Gillespie. [2:04]"
Million Dollar Baby , 2005 , PG-13 ,2,6,5,"Clint Eastwood stars in and directs this story of an aging boxing trainer who's troubled by his estrangement from his daughter and is afraid of taking on any responsibilities. However, he reluctantly agrees to train a young woman (Hilary Swank) who's determined to become a champion boxer when she impresses him with her resolve and courage. Also with Morgan Freeman, Jay Baruchel and Christina Cox. [2:17]"
Millions , 2005 , PG ,3,3,3,"After the death of their mother, two British boys try to make sense of their new and confusing world. One day they find a bag full of money, and they decide that they have to spend it within a week, or it'll become worthless -- the money is British sterling pounds and Britain is in the process of converting its currency to the Euro. With James Nesbitt, Daisy Donovan, Alex Etel, Lewis McGibbon and Kolade Agboke. Directed by Danny Boyle. [1:37]"
A Million Ways to Die in the West , 2014 , R ,7,6,10,"A timid sheep rancher (Seth MacFarlane) in 1880s Arizona loses his girl (Amanda Seyfried) when he backs out of a showdown. Meeting a lovely and mysterious woman (Charlize Theron), he develops some courage, but her estranged husband (Liam Neeson) rides into town to make trouble. Also with Sarah Silverman, Neil Patrick Harris, Giovanni Ribisi and Wes Studi. Directed by MacFarlane. A few scenes feature a Native American language or pseudo-language with English subtitles. [1:56]"
Mimic , 1997 , R ,1,7,6,Horror film about bugs taking on human form and chasing people around.
Mindhunters , 2005 , R ,6,10,7,"A group of top F.B.I. serial killer profilers called Mindhunters are taken to a deserted island during a training assignment, in order to track a supposedly fictitious murderer. But when members of their group are being killed off, they must try to now figure out which one of them is actually a serial killer. With Val Kilmer, LL Cool J, Christian Slater, Eion Bailey and Kathryn Morris. Directed by Renny Harlin. [1:46]"
Minions , 2015 , PG ,2,4,2,"In this prequel, the Minions form on prehistoric Earth as yellow single-celled organisms. They evolve into bipedal pills and seek the most sinister villains to serve. They always fail their masters and, nearly giving up, they send Minions Kevin, Stuart and Bob (all voiced by Pierre Coffin) out into the world, where they find a new despicable boss-lady (voiced by Sandra Bullock) in Florida. Also with Jon Hamm, Michael Keaton, Allison Janney, Steve Coogan, Geoffrey Rush and Jennifer Saunders. Directed by Pierre Coffin and Kyle Balda. The film includes dialogue in gibberish and Pidgin English with some French, Spanish, and Italian words with no subtitles or translation. [1:31]"
Minority Report , 2002 , PG-13 ,5,6,5,"Steven Spielberg film, based on a short story by Philip K. Dick. Set in 2054, criminals are no longer arrested and tried after they commit a murder. Instead, using ""psychic"" technology, precops working for the Precrime Unit predict murderous acts and arrest citizens before the crime is committed. Tom Cruise is one such precop, who suddenly finds himself accused of the impending murder of a man he's never met and doesn't even know. Also with Colin Farrell, Samantha Morton, Peter Stormare and Max Von Sydow. [2:23]"
Miracle , 2004 , PG ,2,4,3,"The true story of coach Herb Brooks (Kurt Russell) who, during the contentious 1980 Winter Olympics at Lake Placid -- and despite overwhelming odds -- led the U.S. hockey team to victory against the highly regarded U.S.S.R. team. The victory was seen as a triumph of democracy over communism. Also with Eddie Cahill, Patricia Clarkson, Noah Emmerich and Patrick O'Brien Demsey. Directed by Gavin O'Connor. [2:15]"
Miracle at St. Anna, 2008 , R ,7,9,7,"The film starts in 1983, with an elderly postal worker shooting a man buying stamps, seemingly for no reason, and moves to an incident during WWII when a small group of American soldiers found themselves stranded in an Italian village. The soldiers are black and they have to face not only the approaching Nazis but also racism from their white commanders. With Derek Luke, Michael Ealy, Laz Alonso, Omar Benson Miller, Pierfrancesco Favino, Matteo Sciabordi, Valentina Cervi, John Turturro, Joseph Gordon-Levitt, James Gandolfini, John Leguizamo, Kerry Washington, D.B. Sweeney, Omari Hardwick and Omero Antonutti. Directed by Spike Lee. [2:40]"
Miracle On 34th Street , 1994 , PG ,3,1,3,Yet another re-telling of the classic Santa tale.
The Miracle Season , 2018 , PG ,2,3,3,"Based on the true story of the Iowa City West High School women's volleyball team and their 2011 season that started with the death of their captain and star setter. All the members of the team and the coach and the young woman's father struggle to come to terms with their grief and find a way to best channel their emotions. With Helen Hunt, Tiera Skovbye, Erin Moriarty, Danika Yarosh, Jason Gray-Stanford, William Hurt, Burkely Duffield, Rebecca Staab, Nesta Cooper, Natalie Sharp and Lillian Doucet-Roche. Directed by Sean McNamara. [1:39]"
Miracles from Heaven , 2016 , PG ,2,3,1,"A young girl living in Texas with her family is seemingly perfectly healthy and happy until she begins to get sicker and sicker and no one can figure out what is wrong with her. Then her mother takes a bold step that she hopes will turn things around and save her daughter and her family. Also with John Carroll Lynch, Jennifer Garner, Kylie Rogers, Martin Henderson, Brighton Sharbino, Courtney Fansler, Queen Latifah and Eugenio Derbez. Directed by Patricia Riggen. [1:49]"
The Mirror Has Two Faces , 1996 , PG-13 ,4,1,5,Barbra Streisand is a professor who falls in love -- with her husband.
"Mirror, Mirror ", 2012 , PG ,3,4,2,"A new take on the classic Snow White fairytale: After an evil queen (Julia Roberts) banishes the king and takes control of his kingdom, she also restricts the young princess Snow White (Lily Collins) to her room. After the resourceful princess escapes, she enlists the help of seven dwarves and a handsome prince (Armie Hammer) to help her win back her kingdom. Also with Sean Bean, Nathan Lane and Mare Winningham. Directed by Tarsem Singh. [1:46]"
Mirrors , 2008 , R ,5,8,5,"A troubled, former NYC detective (Kiefer Sutherland) encounters an alternate reality and a special kind of evil when he takes a night watchman job in an abandoned building. Fearing for the safety of his family, he keeps his promise to his wife (Paula Patton) and does whatever it takes to keep evil at bay. Also with Cameron Boyce, Erica Gluck and Amy Smart. Directed by Alexandre Aja. [1:50]"
