movie_title,movie_year,movie_rating,sex_nudity,violence_gore,language,movie_description
Florence Foster Jenkins , 2016 , PG-13 ,4,3,3,"Based on real events: A New York City heiress (Meryl Streep) maintains a music appreciation club in 1944, and while she's practically tone deaf, she performs operatic arias and long-time patrons support her. She engages Carnegie Hall with the help of her husband (Hugh Grant) and her pianist (Simon Helberg), where she performs for thousands of soldiers and sailors (with mixed reviews). Also with Nina Arianda and Rebecca Ferguson. Directed by Stephen Frears. [1:50]"
The Florida Project , 2017 , R ,5,4,10,"A young woman (Bria Vinaite) struggles to raise her young daughter (Brooklynn Prince) while gathering money in any way she can to pay her weekly rent at a Florida motel that's just outside the Disney World complex. Also with Willem Dafoe, Valeria Cotto and Christopher River. Directed by Sean Baker. A few lines of dialogue are spoken in Spanish with English subtitles. [1:51]"
The Flowers of War , 2011 , R ,6,8,5,"When a westerner (Christian Bale) takes refuge in a Catholic church during the 1937 Nanking Massacre (also known as the Rape of Nanking), he finds himself responsible for the safety of a group of schoolgirls and several prostitutes, as he tries to lead them to safety and away from the invading Japanese army. Also with Ni Ni, Xinyi Zhang, Tong Dawel and Paul Schneider. Directed by Yimou Zhang. In Mandarin and English, with English subtitles. [2:26]"
Flubber , 1997 , PG ,2,4,1,An absent-minded professor discovers flying rubber in his lab. With Robin Williams.
Fluke , 1995 , PG ,1,3,0,A man (Matthew Modine) comes back to life as a dog and tries to protect his family.
Flushed Away , 2006 , PG ,1,3,2,"Animated feature about a British mouse that's flushed down the toilet of his posh Kensington home and discovers a whole city in the London sewer system, populated mostly by rodents. While trying to return to his pampered existence, he falls in love, discovers the joys of companionship and become a hero. With the voices of Hugh Jackman, Kate Winslet, Ian McKellen, Andy Serkis and Bill Nighy. Directed by Sam Fell & David Bowers. [1:24]"
Fly Away Home , 1996 , PG ,1,2,3,A girl (Anna Paquin) and her father (Jeff Daniels) teach her pet geese how to migrate for the winter.
Flyboys , 2006 , PG-13 ,3,7,2,"Inspired by true stories, about the beginning of aerial warfare during WWI: By 1917 France and England are losing the war against Germany and altruistic young Americans volunteer to fight for the French. Some join the nascent air force and engage in deadly dogfights. With James Franco, Jean Reno, David Ellison, Martin Henderson and Jennifer Decker. Directed by Tony Bill. [2:14]"
Fly Me to the Moon , 2008 , G ,1,2,1,"3D animated feature about a young fly, who grows up hearing about the adventures of his grandfather and decides to have an adventure of his own: After convincing his two closest friends to join him, they stow away on the Apollo 11 rocket and take a trip to the moon. With Edwin E. Aldrin Jr., and the voices of Christopher Lloyd, Robert Patrick, Nicollette Sheridan, Tim Curry, Ed Begley Jr., Adrienne Barbeau, Philip Bolden, Trevor Gagnon, David Gore and Kelly Ripa. Directed by Ben Stassen. [1:25]"
Focus , 2001 , PG-13 ,4,5,3,"A man (William H. Macy) leads an unassuming life in a Brooklyn neighborhood towards the end of WWII. But his life is turned upside down when he gets a new pair of glasses. He experiences discrimination and anti-Semitism firsthand when this subtle change in appearance makes his employer and neighbors think that he is Jewish. Also with Laura Dern, David Paymer, Meat Loaf and Kay Hewtrey. [1:44]"
Focus , 2015 , R ,6,5,10,"A professional con man (Will Smith) takes a younger woman (Margot Robbie) on as an apprentice and falls in love with her, but dismisses her after her training. Years later she shows up as his opponent in a big swindle, now a seasoned con artist herself. Also with Rodrigo Santoro, Gerald McRaney, BD Wong and Robert Taylor. Directed by John Requa and Glenn Ficarra. [1:44]"
Folks , 1992 , PG-13 ,2,2,2,"Tom Selleck, stars as a yuppie with an idyllic lifestyle, who ends up having to care for his senile father (Don Ameche) and suddenly all that was near and dear to him begins to slide down the dumper."
Fool's Gold , 2008 , PG-13 ,5,4,4,"Matthew McConaughey and Kate Hudson star as a divorced couple, who come together to search for a huge treasure with the help of a wealthy yachtsman (Donald Sutherland) and his daughter (Alexis Dziena). They are chased by other treasure hunters and a gangster rapper and his entourage. Directed by Andy Tennant. [1:48]"
Fools Rush In , 1997 , PG-13 ,2,2,5,A couple find themselves pregnant and married after a one night stand.
Footloose , 2011 , PG-13 ,5,5,4,"A remake of the eponymous 1984 film about a teenager (Kenny Wormald) that moves to a small town in Georgia, where dancing and rock-and-roll have been banned. After falling for the local preacher's daughter (Julianne Hough), he works to change the town's collective mind about his rebellious nature and their prohibitive laws about dancing. Also with Dennis Quaid, Andie MacDowell, Miles Teller and Ray McKinnon. Directed by Craig Brewer. [1:53]"
"For a Good Time, Call... ", 2012 , R ,9,4,8,"College rivals (Lauren Miller and Ari Graynor) move in together when they find a fancy Gramercy Park apartment available. One of them runs a phone sex line and when the other loses her job, the women go into the business together. But as they add a website and film a commercial, they run into humorous ramifications. Also with Seth Rogen, Justin Long, Mimi Rogers, Nia Vardalos, Mark Webber and James Wolk. Directed by Jamie Travis. [1:26]"
Forbidden Kingdom , 2008 , PG-13 ,3,7,4,"Looking for kung fu DVDs in Chinatown, a teenage boy (Michael Angarano) is attacked by gang members and falls through a time portal, landing in ancient China. There, he learns that he must free the Monkey King (Jet Li), who was captured by the Jade Warlord (Collin Chou) before he can return home. To accomplish his mission he gets trained by a kung fu master (Jackie Chan) and a curious character called Silent Monk (also Jet Li). Also with Liu Yifei and Li Bingbing. Directed by Rob Minkoff. [1:53]"
Forces of Nature , 1999 , PG-13 ,5,4,5,"Strangers Sandra Bullock and Ben Affleck encounter numerous mishaps while traveling to Georgia for her business meeting and his wedding to Maura Tierney. Also with Steve Zahn, Blythe Danner, Ronny Cox, Joe Don Baker, Jack Kehler, Meredith Scott Lynn and David Strickland."
For Colored Girls , 2010 , R ,8,7,6,"Eight African-American women (Anika Noni Rose, Kerry Washington, Janet Jackson, Kimberly Elise, Phylicia Rashad, Loretta Devine and Thandie Newton and Whoopi Goldberg) experience loss, abuse and betrayal and come together to find a way to survive the challenges of their lives. Based on the play by Ntozake Shange. Also with Omari Hardwick, Hill Harper, Michael Ealy, Jaycee Williams and Thomas Jessup. Directed by Tyler Perry. [2:14]"
The Foreigner , 2017 , R ,5,7,6,"An aging businessman (Jackie Chan) loses his teenage daughter (Charlie Murphy) in a London car bombing that's suspected of being the work of the IRA. When an Irish official refuses to help him find her murderer, the grieving father terrorizes him until he can provide the names of possible killers. Also with Pierce Brosnan, Simon Kunz and Katie Leung. Directed by Martin Campbell. Several lines of dialogue are in Chinese with English subtitles. Many characters speak with thick Irish accents. [1:54]"
The Forest , 2016 , PG-13 ,1,6,3,"Learning that her twin sister vanished in Japan, an American (Natalie Dormer) travels to Mount Fuji's infamous Aokigahara Forest, where the anguished go to commit suicide, and with a new friend (Taylor Kinney) she explores the forest, ignoring instructions to leave before sunset. Also with Eoin Macken, Stephanie Vogt, Yukiyoshi Ozawa, Rina Takasaki, Noriko Sakura, Yûho Yamashita and James Owen. Directed by Jason Zada. Several lines of dialogue are in Japanese and most are translated. [1:35]"
Forever My Girl , 2018 , PG ,3,2,2,"A man (Alex Roe) leaves his fiancée (Jessica Rothe) at the altar to find fame with a country music career. After he finds success, he returns to their hometown years later and he discovers that he's the father of a precocious seven-year-old daughter. Also with John Benjamin Hicke, Abby Ryder Fortson, Travis Tritt, Judith Hoag and Tyler Tiggs. Directed by Bethany Ashton Wolf. [1:44]"
Forever Young , 1992 , PG ,2,3,2,"Mel Gibson is an army test-pilot in 1939, and when his love is hit by a truck and is rendered comatose, he decides he can't take waiting for her to die. He convinces George Wendt, a genius who has discovered a way to suspend life, to freeze him for a year. But he awakens in 1992."
Forget Paris , 1959 , PG-13 ,3,2,3,Billy Crystal and Debra Winger star as a married couple who are trying to stay together despite problems.
Forgetting Sarah Marshall , 2008 , R ,10,4,8,"After being dumped by his TV star girlfriend (Kristen Bell), a man (Jason Segel) decides to take a trip to Hawaii to cheer himself up. But upon arrival to the island he learns that his former girlfriend is also in Hawaii and staying at the same hotel with her new rock star boyfriend (Russell Brand). Also with Mila Kunis and Bill Hader. Directed by Nicholas Stoller. [1:52]"
The Forgotten , 2004 , PG-13 ,3,4,5,"A grieving mother (Julianne Moore), whose 9-year-old son died in an airplane crash, seeks the help of a psychiatrist (Gary Sinise) to cope with the pain of her loss. People around her, including her husband, behave as if she has imagined a past with a son that never really existed. When she meets another man (Dominic West) who has memories of his own lost daughter, the two team up in a desperate attempt to uncover the truth behind what appears to be a case of mass kidnapping. Also with Alfre Woodard and Anthony Edwards. Directed by Joseph Ruben. [1:31]"
For Greater Glory , 2012 , R ,1,8,3,"A dramatic account of the Cristeros War, the 1920s conflict when Mexican Roman Catholics fought against the anticlerical Mexican government. Andy Garcia stars as a retired general recruited by the leaders of the Catholic militias to lead their fight. Also with Oscar Isaac, Catalina Sandino Moreno, Santiago Cabrera, Rubén Blades, Bruce McGill, Arián Alonso, Eva Longoria and Peter O’Toole. Directed by Dean Wright. [2:23]"
For Love of the Game , 1999 , PG-13 ,4,2,5,"Kevin Costner plays an aging Detroit Tigers pitcher standing at the crossroads of life: behind him is his glorious 19-year baseball career; ahead of him is life with the woman he loves. With Kelly Preston, John C. Reilly, Jena Malone, Brian Cox, Michael Neeley. [2:00]"
For Love or Money , 1993 , PG ,3,0,3,Michael J. Fox stars as a concierge who has to decide between true love and funding for his dream hotel.
Formula 51 , 2002 , R ,6,8,10,"Samuel L. Jackson stars as an American master chemist who goes to England, hoping to introduce a new designer drug to the European underworld. His plans hit a snag when he gets stuck in Liverpool with an unlikely escort (Robert Carlyle) and becomes entangled in a web of double-dealing and double-crosses. Also with Emily Mortimer, Rhys Ifans and Meat Loaf. [1:32]"
Forrest Gump , 1994 , PG-13 ,4,4,5,"Tom Hanks stars as Forrest Gump, a perceptive simpleton who's been involved, in one way or another, with every major event of recent American history."
For Richer or Poorer , 1997 , PG-13 ,1,2,5,A bitter couple headed for divorce must flee their ritzy New York life and hide out in Amish country.
The Forsaken , 2001 , R ,9,10,10,"A budding filmmaker (Kerr Smith) takes a cross-country trip to go to his sister's wedding, but he unfortunately encounters some pretty mean vampires who want to kill or maybe eat him just a little. Also with Brendan Fehr, Johnathon Schaech, A.J. Buckley, and Izabella Miko. [1:45]"
Fortress , 1993 , R ,7,7,6,"Christopher Lambert plays an ex-army officer who ends up in a maximum security prison because his wife is pregnant (she ends up there, too). In this reality, overpopulation has forced the U.S. to ban second births."
40 Days and 40 Nights , 2002 , R ,8,2,7,"After a devastating breakup, a young man (Josh Hartnett) has a number of meaningless sexual encounters trying to forget his ex. When he realizes these affairs are not helping him to recover he takes a vow of celibacy and by doing so he realizes that sex is not important in finding a true soul mate. But just when he decides he's in control of his emotions and impulses, the woman of his dreams (Shannyn Sossamon) comes along -- and so does temptation. Also with Vinessa Shaw, Monet Mazur, Maggie Gyllenhaal, Emmanuelle Vaugier and Keegan Connor Tracy. [1:31]"
45 Years , 2016 , R ,5,1,5,"A couple (Charlotte Rampling and Tom Courtenay) is getting ready to celebrate their 45th wedding anniversary when they are shocked by news from their past and their relationship is shaken to its core. Also with Geraldine James, Dolly Wells and David Sibley. Directed by Andrew Haigh. [1:35]"
47 Meters Down , 2017 , PG-13 ,2,6,5,"Two adventurous sisters (Mandy Moore and Clair Holt) vacation in Mexico and plan to swim with sharks. Diving underwater in a steel shark cage, they face great whites in safety but when their cage breaks away from their boat, they plunge further into the deep, their oxygen runs low, and they become desperate for help. Also with Chris J. Johnson, Yani Gellman, Santiago Segura and Matthew Modine. Directed by Johannes Roberts. Several lines of dialogue are spoken in Spanish and are not translated. [1:29]"
47 Ronin , 2013 , PG-13 ,3,6,1,"Based on an 18th century Japanese legend: a group of forty seven samurai lose their Master (Min Tanaka) as a result of the actions of an evil Lord (Tadanobu Asano). Becoming leaderless ronin, they seek the help of a half-Japanese outcast (Keanu Reeves), who leads them through a mystical world of strange creatures, shape-shifters and danger to help them restore samurai honor. Also with Hiroyuki Sanada, Kou Shibasaki, Jin Akanishi and Rinko Kikuchi. Directed by Carl Rinsch. [2:00]"
42 , 2013 , PG-13 ,3,4,4,"The story of baseball's legendary Number 42, Jackie Robinson (Chadwick Boseman), as he breaks the color barrier in Major League Baseball for the Brooklyn Dodgers in 1947. He receives support and help from friend Pee Wee Reese (Lucas Black), General Manager Branch Rickey (Harrison Ford) and manager Leo Durocher (Christopher Meloni). Also with John C. McGinley, Nicole Beharie, Andre Holland, T.R. Knight, Alan Tudyk, James Pickens Jr. and Max Gail. Directed by Brian Helgeland. [2:08]"
The 40-Year-Old Virgin , 2005 , R ,8,4,10,"A 40-year-old man (Steve Carell) has never had sex. When his colleagues find out, they make it their mission to get him some sexual experience. But the woman he's dating (Catherine Keener) has agreed on a mutual no-sex policy. Also with Paul Rudd, Romany Malco and Seth Rogen. Directed by Judd Apatow. [1:56]"
For Your Consideration , 2006 , PG-13 ,3,1,5,"In this Hollywood parody, a group of has-been actors shoots an independent movie that begins to acquire Oscar nomination buzz, which fills them with hope. However, as celebrity shows start covering the production and award fever infects the filmmakers, the screenwriters become terrified that the film story is being changed to accommodate Hollywood standards. With Catherine O'Hara, Eugene Levy, Harry Shearer, Christopher Guest and John Michael Higgins. Directed by Christopher Guest. [1:26]"
The Fountain , 2006 , R ,4,6,5,"Hugh Jackman stars as a man who's been alive for a thousand years: As a 16th-century conquistador he finds a plant that grants eternal life to those who drink of its sap, as a modern day scientist he tries to find a cure for the cancer that's killing his wife (Rachel Weisz), and as 26th century astronaut he tries to find the heavenly depository of souls. Also with Ellen Burstyn, Sean Patrick Thomas and Donna Murphy. Directed by Darren Aronofsky. [1:36]"
Four Brothers , 2005 , R ,6,7,10,"Four adopted brothers (Mark Wahlberg, Tyrese Gibson, André Benjamin and Garrett Hedlund) meet at their childhood home after their mother's funeral. She was murdered during a convenience store robbery, and when it becomes obvious that the police are not trying very hard to solve the case and bring in the killers, the brothers decide to go looking for them on their own. Also with Sofía Vergara. Directed by John Singleton. [1:49]"
Four Christmases , 2008 , PG-13 ,6,4,4,"Reese Witherspoon and Vince Vaughn star as a couple that misses their usual island Christmas vacation when their flight from San Francisco is cancelled by inclement weather. Trapped stateside, they visit all four of their divorced parents, at separate homes, on Christmas day. The four gatherings are full of dysfunction bordering on mayhem, but the celebrations inspire them to reconsider their lives together. Also with Mary Steenburgen, Jon Voight, Sissy Spacek, Robert Duvall, Jon Favreau, Tim McGraw, Dwight Yoakam and Kristin Chenoweth. Directed by Seth Gordon. [1:40]"
The Four Feathers , 2002 , PG-13 ,4,6,2,"A.E.W. Mason's adventure novel has been made into a movie several times, most notably in 1939. Set in 1898, at the height of Imperial Britain, an officer (Heath Ledger) resigns his command to avoid going with his regiment to the Sudan. Offended by his act of cowardice, his fellow officers and his fiancée send him four white feathers. To redeem his honor, he disguises himself as an Arab and secretly saves the lives of the very people who branded him a coward. Also with Wes Bentley, Kate Hudson, Djimon Hounsou and Michael Sheen. [2:07]"
The Fourth Kind , 2009 , PG-13 ,2,6,4,"Based on 40 years of alleged UFO sightings, radar anomalies and unexplained human disappearances in northern Alaska, this film follows a psychotherapist (Milla Jojovich) as she investigates sleep disturbances and UFO sightings with the help of her mentor (Elias Koteas) and a local sheriff (Will Patton). The film mixes allegedly real footage of alien abductees with re-enactments by actors. Also with Corey Johnson, Hakeem Kae-Kazim, Enzo Cilenti, Daphne Alexander, Alisha Seaton, Tyne Rafaeli and Mia McKenna Bruce. Directed by Olatunde Osunsanmi. [1:38]"
Four Weddings and a Funeral , 1994 , R ,4,1,7,Andie MacDowell and Hugh Grant star in this romantic comedy about being single and looking for your significant other.
1492: Conquest of Paradise , 1992 , PG-13 ,3,9,1,Gerard Depardieu struts his considerable physical presence as the great explorer in director Ridley Scott's version of what happened during the fall of 1492.
1408 , 2007 , PG-13 ,1,6,5,"A writer (John Cusack) of books about paranormal and supernatural occurrences, who visits sites that are deemed haunted, takes a trip to New York to stay overnight in room 1408 of the Dolphin Hotel, even though the manager (Samuel L. Jackson) has forbidden anyone from ever staying there. It seems that there has been one too many unexplained deaths in the room. Also with Mary McCormack, Jasmine Jessica Anthony and Christopher Carey. Directed by Mikael Hafstrom. [1:34]"
Foxcatcher , 2014 , R ,3,4,3,"Based on the true story of John E. du Pont (Steve Carell) and his involvement with Mark and David Schultz (Channing Tatum and Mark Ruffalo), Olympic gold medalists in wresting. Also with Sienna Miller, Vanessa Redgrave, Anthony Michael Hall, Guy Boyd and Brett Rice. Directed by Bennett Miller. [2:14]"
Fracture , 2007 , R ,4,5,5,"Ryan Gosling stars as a smug, successful assistant DA whose last assignment before he leaves for a new high-paying private sector job is to prosecute a man (Anthony Hopkins) who has readily confessed to shooting his wife. Thinking it's going to be a cinch, he takes the case but he instead becomes part of a set-up that threatens not only his current position but also his ability to continue to practice law. Also with David Strathairn, Rosamund Pike and Embeth Davidtz. Directed by Gregory Hoblit. [1:52]"
Frailty , 2002 , R ,1,7,5,"Bill Paxton stars as the widowed father of two young boys who believes that his family's mission is to destroy demons -- seemingly normal looking people, who supposedly walk the Earth as pure evil. He states that he is visited by angels who bring him lists of demons to destroy, and so, with his younger son, he's off on a killing spree. His older son, however, is not a believer and does not want to participate in the murders. Also with Matthew McConaughey, Luke Askew, Matthew O'Leary and Jeremy Sumpter. [1:40]"
Frank , 2014 , R ,6,5,8,"A struggling songwriter (Domhnall Gleeson) stumbles upon what he thinks is his big break when he is asked to play keyboards for a band, after watching the previous keyboardist try to commit suicide. He befriends the lead singer (Michael Fassbender), who is rarely seen without a large artificial head he wears to cover his own. Also with, Moira Brooker, Paul Butterworth, Phil Kingston, Billie Traynor, Shane O'Brien, Scoot McNairy, Maggie Gyllenhaal, François Civil and Carla Azar. Directed by Lenny Abrahamson. [1:35]"
Frankenweenie , 2012 , PG ,1,4,2,"A young boy scientist in a small-town (voiced by Charlie Tahan) loses his best friend when his dog Sparky (Frank Welker) dies. The boy finds an electrifying way to bring Sparky back, but when the townspeople find out, a pet cemetery releases its dead and chaos ensues. Also with the voices of Martin Landau, Martin Short, Atticus Schaffer, Robert Capron, Wynona Ryder and Catherine O'Hara. Directed by Tim Burton. [1:30]"
Frankie and Johnny , 1991 , R ,7,3,6,"In this romantic comedy/drama, Michelle Pfeiffer plays a diner waitress who's afraid to date and Al Pacino plays a cook who falls for her. Also with Nathan Lane, Hector Elizondo, Kate Nelligan, Jane Morris, Greg Lewis, Al Fann, Ele Keats, Fernando Lopez, Tim Hopper, Glenn Plummer and Goldie McLaughlin. Based on Terence McNally's stage play ""Frankie and Johnny in the Clair de Lune"" and directed by Garry Marshall. [1:58]"
Freaky Friday , 2003 , PG ,3,2,3,"A teenager, Annabel (Lindsay Lohan) and her widowed mother (Jamie Lee Curtis), who do not see eye-to-eye and are always arguing, are magically transformed and end up exchanging bodies. Now they see life from each other's perspective and have to learn to appreciate each other before the body swapping is reversed. Also with Mark Harmon, Chad Murray and Stephen Tobolowsky. Directed by Mark S. Waters. [1:37]"
Fred Claus , 2007 , PG ,2,3,2,"The Christmas season is in crisis when an efficiency expert (Kevin Spacey) is sent to the North Pole to evaluate Santa Claus's (Paul Giamatti) operation. To complicate things further, Santa's estranged brother, Fred Claus (Vince Vaughn), a fast-talking repo man who's out of luck and money, comes for a visit. Also with John Michael Higgins, Kathy Bates and Elizabeth Banks. Directed by David Dobkin. [1:44]"
Freddy Got Fingered , 2001 , R ,7,8,9,"Tom Green directs, and also stars as a financially challenged 28-year-old who moves back home against his domineering father's wishes. While he dreams of being an animator his father wants him to get a job. The two feud and feud. Also with Harland Williams, Rip Torn, Drew Barrymore, Julie Hagerty, Stephen Tobolowsky, Marisa Coughlan, Jackson Davies, Eddie Kaye Thomas, Scott Heindl, Ron Selmour, Connor Widdows, Laurie Murdoch, Anthony Michael Hall and Mike Bullard. [1:33]"
Freddy Vs. Jason , 2003 , R ,7,10,8,"Horror film that pits Freddy Kruger (Robert Englund), the slasher from the ""Nightmare on Elm Street"" series, against Jason Voorhees (Ken Kirzinger), the undead hockey goalie from the ""Friday the 13th"" series. A gaggle of teen stereotypes also shows up in the middle of the battle, and they're promptly slashed and slaughtered. Also with Monica Keena, Jason Ritter and Kelly Rowland. Directed by Ronny Yu. [1:35]"
Free Birds , 2013 , PG ,2,4,2,"A turkey (voiced by Owen Wilson) pardoned at the White House and the Turkey Liberation Front leader (voiced of Woody Harrelson) join forces to save all turkeys from the traditional Thanksgiving menu. The birds steal a top-secret time machine, go back to 1621 Plymouth and attempt to change history, but meet an interesting flock of native turkeys in the process. Also with the voices of George Takei, Amy Poehler, Colm Meaney, Dan Fogler and Keith David. Directed by Jimmy Haywood. [1:31]"
Freedomland , 2006 , R ,2,5,8,"Samuel L. Jackson stars as a police detective in a New Jersey precinct who is called to investigate a case when a white woman (Julianne Moore) accuses an African-American of carjacking her and kidnapping her young son who was still in the back seat asleep. Also with Edie Falco, Ron Eldard and William Forsythe. Directed by Joe Roth. [1:53]"
Freedom Writers , 2006 , PG-13 ,2,7,5,"An idealistic teacher (Hilary Swank) in a Los Angeles high school believes that she can make a difference in the lives of her disadvantaged, racially divided inner city students. But she has to struggle against the school administration, that refuses to support her efforts, and must overcome the violence that touches the children every day. Also with Patrick Dempsey, Imelda Staunton, Scott Glenn and April Lee Hernandez. Directed by Richard LaGravenese. [2:02]"
Free Fire , 2017 , R ,3,8,10,"In 1970s Boston, a black-market arms deal between the IRA and South Africans goes haywire and the result is an interminable shootout in an abandoned warehouse; the arms broker (Brie Larson) responsible for setting up the deal and her sidekick (Armie Hammer) attempt to survive the ordeal by using their arsenal of weapons. Also with Cillian Murphy, Sharlto Copley, Michael Smiley, Enzo Cilenti, Noah Taylor, Jack Reynor and Babou Ceesay. Directed by Ben Wheatley. [1:30]"
