movie_title,movie_year,movie_rating,sex_nudity,violence_gore,language,movie_description
Babe , 1995 , G ,0,2,1,The story of a young pig who dares to be different. He doesn't want to be a pig: he wants to be a sheepdog.
Babel , 2006 , R ,8,7,6,"An intricately woven tale of the inadvertent connections between people from around the world whose lives have been affected by one gun. It all starts with a rifle shot in the remote sands of the Moroccan desert, which starts a chain of events linking an American couple, two Moroccan boys, a nanny illegally crossing into Mexico with the two young children in her charge and a Japanese teen. With Brad Pitt, Cate Blanchett, Gael Garcia Bernal, Elle Fanning and Koji Yakusho. Directed by Alejandro Gonzalez Inarritu. [2:22]"
Babe: Pig in the City , 1998 , G ,1,5,1,"Babe is back, this time trying to save his boss's farm from foreclosure. Starring James Cromwell, Magda Szubanski, Elizabeth Daily, Glenne Headly, Mickey Rooney and Steven Wright."
The Babe , 1992 , PG ,1,1,5,"John Goodman plays the Sultan of Swat, covering his life from reform school until his retirement from baseball in 1935."
Babies , 2010 , PG ,5,2,0,"A documentary journey through the lives of four babies as they experience their first year. The children are Ponijao, who lives with her family near Opuwo, Namibia, Bayarjargal, who lives with his family in Mongolia, Mari, who lives with her family in Tokyo, Japan, and Hattie, who lives with her family stateside in San Francisco. Directed by Thomas Balmès. [1:19]"
Baby Boy , 2001 , R ,9,6,10,"Tyrese Gibson stars as a 20-year-old African-American man who's unemployed, has two children by two different women (he's married to neither) and is still living with his 36-year-old mother. Directed by John Singleton, the film follows Gibson's well-meaning but infantile character as he comes to somewhat of an awakening and tries to take responsibility for his life and actions. Also with Omar Gooding, A.J. Johnson, Snoop Dogg, Taraji P. Henson, Ving Rhames, Tamara LaSeon Bass, Kaylan Bolton, Kylan Bolton and Calvin Broadus. [2:08]"
Baby Driver , 2017 , R ,4,7,10,"A man (Ansel Egort) with tinnitus from a childhood accident has to constantly listen to music to distract himself and this peculiar routine helps him become an expert getaway driver for a sophisticated robbery ringleader (Kevin Spacey). When the driver falls in love with a waitress (Lily James), he wants to start a new life, but his boss won't let him. Also with Eiza González, Jon Hamm, Jamie Foxx and Jon Bernthal. Directed by Edgar Wright. Two men speak to each other throughout the film with American Sign Language accompanied by English subtitles. [1:53]"
Baby Geniuses , 1999 , PG ,2,3,3,"Kathleen Turner and Christopher Lloyd are greedy scientists who raise a group of children in a lab in the hope of discovering a lucrative method of creating geniuses. Also with Kim Cattrall, Peter MacNicol, Dom DeLuise, Miko Hughes, Ruby Dee, Seth Adkins, Kaye Ballard and Kyle Howard. [1:34]"
Babylon A.D. , 2008 , PG-13 ,4,7,5,"It's the near future and a mercenary (Vin Diesel) is hired to transport a young woman (Mélanie Thierry) across the U.S./Canada border. He doesn't know why his client wants her or what they'll do with her when he delivers her, and he does not care -- at least in the beginning. Also with Michelle Yeoh, Lambert Wilson, Gerard Depardieu, Charlotte Rampling, Mark Strong and Joel Kirby. Directed by Mathieu Kassovitz. [1:30]"
Baby Mama , 2008 , PG-13 ,5,3,5,"A 37-year-old, very successful businesswoman (Tina Fey) feels that the time has come for her to have a child. She has no significant other in her life and determines that she will try to do it on her own. After unsuccessful attempts at in vitro fertilization and adoption, she reluctantly hires a surrogate (Amy Poehler). Also with Sigourney Weaver, Dax Shepard, Greg Kinnear, Romany Malco, Maura Tierney and Steve Martin. Directed by Michael McCullers II. [1:36]"
Baby's Day Out , 1994 , PG ,1,3,0,"Reminiscent of ""Home Alone,"" with a baby which proves too tough for its bumbling kidnappers."
The Baby-Sitters Club , 1995 , PG ,1,1,1,"Based on the popular book series, a group of prepubescent girls find friendship as they pool babysitting gigs."
The Bachelor , 1999 , PG-13 ,3,3,6,"A content bachelor learns he has 24 hours to get married if he wants to receive a $100 million inheritance from his recently deceased grandfather. With Chris O'Donnell, Renée Zellweger, Brooke Shields, Artie Lange, Ed Asner, James Cromwell, Hal Holbrook, Marnie Alexenburg, T.L. Brooke, Mariah Carey, Stacy Edwards, Jennifer Esposito, Rebecca Gray, Brian Leonard, Marley Shelton, Sarah Silverman and Katharine Towne. [1:42]"
Bachelorette , 2012 , R ,8,4,10,"When long-time friends come together to attend the wedding of one of them (Rebel Wilson), their individual dysfunctions become evident. Also with Kirsten Dunst, Lizzy Caplan, Isla Fisher, Andrew Rannells, Horatio Sanz, Kyle Bornheimer, James Marsden and Adam Scott. Directed by Leslye Headland. [1:29]"
Backbeat , 1994 , R ,9,5,8,"Story of the early, pre-Ringo Beatles, about their years in Hamburg."
Backstage , 2000 , R ,8,2,10,"Documentary showing onstage performances and a behind-the-scenes view of the 1999 Hard Knock Life tour featuring Hip Hop artists Jay-Z, DMX, Method Man, Redman, Beanie Sigel, Memphis Bleek, Ja Rule, DJ Clue and Amil. [1:39]"
The Back-up Plan , 2010 , PG-13 ,6,4,5,"When a single woman in her late 30s (Jennifer Lopez) goes through artificial insemination to become pregnant, her husband-less world actually seems complete. That is, until she meets the man of her dreams (Alex O'Loughlin) on that very same day. Also with Michaela Watkins, Eric Christian Olsen and Anthony Anderson. Directed by Alan Poul. [1:48]"
Bad Boys , 1995 , R ,3,7,9,Will Smith and Martin Lawrence star as two wise-cracking Miami detectives investigating a drug case.
Bad Boys II , 2003 , R ,6,9,10,Will Smith and Martin Lawrence reprise their roles as Miami Narcotics detectives Mike Lowrey and Marcus Burnett. This time around they've been assigned to a high-tech task force investigating a Cuban drug lord (Jordi Molla) who's moving huge shipments of the designer drug Ecstasy by sea. Things get complicated when Marcus' sister (Gabrielle Union) is kidnapped and they must go to Cuba to rescue her. Also with Peter Stormare. Directed by Michael Bay. [2:24]
Bad Company , 1995 , R ,8,5,6,Ellen Barkin and Laurence Fishburne star as former CIA agents now in private industry.
Bad Company , 2002 , PG-13 ,3,5,5,"A down-on-his-luck man (Chris Rock) goes undercover for the CIA in order to help get a nuclear bomb off the black market and away from an ex-Russian Mafia gangster. The man is posing as his twin brother, a super-duper spy who was assassinated early in the negotiating process. Anthony Hopkins co-stars as the veteran CIA agent who has to help him become a spy within nine short days. Also with Gabriel Macht, John Slattery and Peter Stormare. [1:57]"
Bad Girls , 1994 , R ,2,5,4,"Standard western with Madeleine Stowe, Mary Stuart Masterson, Andie MacDowell and Drew Barrymore as cowgirls on the run."
Bad Grandpa , 2013 , R ,7,5,6,"A boy (Jackson Nicoll) is traveling cross-country with his widower grandfather (Johnny Knoxville) after his mother (Georgina Cates) goes to jail and he experiences a variety of crude practical jokes perpetrated by his octogenarian mentor; they involve funeral homes, biker bars, male strip clubs and children's beauty pageants. Also with Spike Jonez. Directed by Jeff Tremaine. Some English subtitles appear for unclear conversations. [1:33]"
Bad Lieutenant: Port of Call New Orleans , 2009 , R ,8,8,10,"A police detective (Nicolas Cage) serving in post-Katrina New Orleans becomes addicted to prescription pain medication after being injured in the line of duty, and quickly starts using street drugs. As he investigates the murder of a family of Senegalese immigrants, he's compromised by his addictions to drugs and gambling, and his criminal associations. Also with Eva Mendes, Val Kilmer, Brad Dourif and Xzibit. Directed by Werner Herzog. [2:01]"
Bad Moms , 2016 , R ,7,3,10,"An upper middle class wife and mom (Mila Kunis) seems to have the perfect life but she's over-committed and exhausted. Needing a change, she gathers other stressed-out moms (Kristen Bell and Kathryn Hahn) to explore unconventional lifestyles and in a shared quest for freedom the trio butts heads with an irksome PTA president (Christina Applegate) and a clique of smug moms. Also with Annie Mumolo and Jada Pinkett Smith. Directed by Jon Lucas & Scott Moore. [1:41]"
A Bad Moms Christmas , 2017 , R ,7,4,10,"Three over-worked suburban moms (Mila Kunis, Kristen Bell, Kathryn Hahn) rebel against the expected trappings of Christmas, when their mothers barge in unexpectedly and make creating a perfect holiday for their families almost impossible. Also with Christine Baranski, Cheryl Hines and Susan Sarandon. Directed by Jon Lucas & Scott Moore. [1:44]"
Bad News Bears , 2005 , PG-13 ,5,4,4,"Billy Bob Thornton stars as Morris Buttermaker a former big league pitcher who accepts a paid assignment to coach the Bears, a team that's notorious for having lost more games than any other team in Little League history. But the coach (Greg Kinnear) of the champion team will not stand for a low-life, drunkard dirtying up his pristine league, which is exactly the inspiration the Bears coach needs to make something of his clumsy players. Also with Marcia Gay Harden, Timmy Deters and Sammi Kane Kraft. Directed by Richard Linklater. [1:51]"
Bad Santa , 2003 , R ,6,5,10,"A grifter and his partner (Billy Bob Thornton and Tony Cox) meet every Christmas season to case department stores while dressed as Santa and his lead elf. Between seasons the Santa spends his time in a drunken stupor, bitter and angry and anything but the way we normally imagine Santa to be. But an introverted boy (Brett Kelly) approaches him one day and changes his life by showing him what the spirit of being Santa is all about. Also with Lauren Graham, John Ritter and Bernie Mac. Directed by Terry Zwigoff. Please note that this is a review of the R-rated theatrical cut and not of the unrated video version titled ""Badder Santa."" [1:33]"
Bad Santa 2 , 2016 , R ,8,5,10,"Sequel to the 2003 film: Still on a perpetual bender, the foul-mouthed, sex-obsessed, Santa suit-wearing delinquent (Billy Bob Thornton) is persuaded to join his sidekick (Tony Cox) who has just been released from jail. Together they plan a sure-thing job that also brings him back in contact with his estranged mother (Kathy Bates). Also with Christina Hendricks, Brett Kelly and Ryan Hansen. Directed by Mark Waters. [1:32]"
Bad Teacher , 2011 , R ,7,3,8,"A Chicago teacher (Cameron Diaz) is a gold digger who curses students, drinks, and does drugs while on the lookout for a wealthy husband. So, after her rich fiancé dumps her, she pursues a wealthy substitute teacher (Justin Timberlake). A smart-mouthed gym teacher (Jason Segel) pursues her while a coworker (Lucy Punch) is also after the wealthy sub. Also with John Michael Higgins, Molly Shannon, Phyllis Smith, Eric Stonestreet and Thomas Lennon. Directed by Jake Kasdan. [1:30]"
Bad Words , 2014 , R ,6,3,6,"Jason Bateman stars as a 40-year-old, eighth-grade dropout that works as a proofreader and exploits a loophole to enter a kids' spelling bee. He ventures into adult and crude language and actions as often as he can, while an online journalist (Kathryn Hahn) pays his entry fees and expenses all the way to the spelling bee finals in California. Also with Rohan Chand, Allison Janney, Rachel Harris and Philip Baker Hall. Directed by Bateman. [1:28]"
Baggage Claim , 2013 , PG-13 ,5,2,4,"Determined to become engaged before her youngest sister's wedding, a flight attendant (Paula Patton) has only 30 days left to find a husband. Hence, she uses 30,000 flying miles while contacting ex-boyfriends and potential mates, many of whom she never wants to meet again. Also with Adam Brody, Djimon Hounsou, Taye Diggs, Christina Milian and Derek Luke. Directed by David E. Talbert. [1:36]"
Baghead , 2008 , R ,7,6,9,"Four unsuccessful actors (Ross Partridge, Steve Zissis, Greta Gerwig and Elise Muller) spend a weekend in a remote cabin writing a movie script -- which they think will revive their careers -- about a group of friends besieged by someone with a bag over his head. But their story idea may begin to come true. Also with Jett Garner. Directed by Mark & Jay Duplass. [1:24]"
Bait , 2000 , R ,5,7,10,"Jamie Foxx plays a convicted thief who becomes bait for the FBI in their quest to track down and apprehend a computer hacker (Doug Hutchison) who stole $42 million from the New York Federal Gold Reserve. Also with David Morse, David Paymer, Robert Pastorelli, Kris Kristofferson and Kimberly Elise. [1:59]"
The Ballad of Little Jo , 1993 , R ,6,5,3,"Suzy Amis stars as a woman who disguises herself as a man in order to survive the rough, sexist world of 1866."
Ballistic: Ecks vs. Sever , 2002 , R ,2,5,4,"Reclusive former FBI manhunter Jeremiah Ecks (Antonio Banderas) is haunted by the mysterious death of his wife, but he's forced back into service in order to track down a renegade operative code-named Sever (Lucy Liu), who's kidnapped the son of the head of a secret government agency. Also with Ray Park, Terry Chen and Aidan Drummond. [1:31]"
Balls of Fury , 2007 , PG-13 ,4,5,4,"Christopher Walken stars as the mysterious leader of an organized crime family, who also happens to be a fan of extreme ping-pong. He therefore organizes a competition pitting the best ping-pong players in the world in sudden death matches, where ""death"" is meant literally. In order to catch him dealing arms, the F.B.I. recruits a former ping-pong champion who has not competed since his father was brutally murdered when he was a young boy. Also with Dan Fogler, George Lopez, Maggie Q and Thomas Lennon. Directed by Robert Ben Garant. [1:30]"
Balto , 1995 , G ,0,2,0,"An animated tale about a half-wolf/half-dog that leads a sledding team across Alaska in order to get medicine for a sick girl. With the voices of Kevin Bacon, Bob Hoskins, Bridget Fonda, Jim Cummings and Phil Collins. [1:14]"
Bandits , 2001 , PG-13 ,4,5,4,"Two escaped convicts (Bruce Willis and Billy Bob Thornton) travel from Oregon to California on a bank-robbing spree, hoping to get enough money to open a resort hotel and casino. They develop a reputation for being true gentlemen, and eventually are accompanied by a woman who wants to escape her ordinary life (Cate Blanchett). Both fall in love with her, and she falls in love with both of them, but the police think she's their hostage. Also with Troy Garity and Bobby Slayton. [2:04]"
Bandslam , 2009 , PG ,4,3,3,"A big band contest is about to happen and the tension is thick when three band members from the band favored to win are cut loose and start their own band. However, they aren't able to come up with a solid sound until a new kid (Gaelan Connell) with an ear for tunes arrives and turns things around. Also with Alyson Michalka, Vanessa Hudgens, Lisa Kudrow, Scott Porter, Ryan Donowho, Tim Jo, Charlie Saxton, Blair Bomar and Lisa Chung. Directed by Todd Graff. [1:51]"
The Band's Visit , 2007 , PG-13 ,5,2,5,"The members of an Egyptian police band arrive in Israel expecting to be met and taken to their pre-arranged performance. When no one comes for them, they make their own way but are lost in a small village, and since they must wait until morning for a bus they accept the invitation of three of the town's residents to stay with them. With Saleh Bakri, Khalifa Natour, Ronit Elkabetz, Rubi Moscovich, Imad Jabarin, Tarak Kopty, Hisham Khoury, Francois Kheel, Eyad Sheety, Shlomi Avraham, Uri Gavriel, Hila Surjon Fischer, Ahuva Keren and Sasson Gabay. Directed by Eran Kolirin. In Arabic and Hebrew with English subtitles. [1:26]"
The Banger Sisters , 2002 , R ,7,2,6,"Susan Sarandon and Goldie Hawn star as two best friends and former rock groupies who reunite after twenty years and realize that while one of them is still rocking out, the other has matured into middle age. Also with Geoffrey Rush, Erika Christensen and Robin Thomas. [1:38]"
Bangkok Dangerous , 2008 , R ,8,8,5,"A hired killer and loner (Nicolas Cage) is hired to make four kills in Bangkok, Thailand. But he forgets his vow to never get involved with any of his assignments and during the last assassination he gets confused by emotional entanglements and moral questions. Also with Charlie Yeung, Panward Hemmanee, Nirattisai Kaljaruek, Dom Hetrakul, Tuck Napaskorn, Steve Baldocchi, Chris Heebink, James With, Peter Shadrin, Arthajid Puengvicha, Duangjai Srisawang and Veerasak Boonchard. Directed by Oxide Pang and Danny Pang. [1:40]"
The Bank Job , 2008 , R ,8,8,7,"A man (Jason Statham) struggling to pay back a debt to shady characters is convinced by a longtime friend (Saffron Burrows) to rob a bank with her. The plan seems foolproof, until ulterior motives begin to surface and they have to think fast to save their lives. Also with Stephen Campbell Moore, Daniel Mays, James Faulkner, Alki David, Michael Jibson, Richard Lintern and David Suchet. Directed by Roger Donaldson. [1:50]"
B.A.P.S. , 1997 , PG-13 ,2,2,5,Halle Berry and Natalie Desselle travel from Georgia to Beverly Hills to find fame and fortune.
Barbara , 2012 , PG-13 ,5,5,4,"A doctor (Nina Hoss) in 1980s East Berlin is banished to a halfway house and a small country hospital after being arrested for applying for an official release from the German Democratic Republic. Also with Ronald Zehrfeld, Mark Waschke and Rainer Bock. Directed by Christian Petzold. In German with English subtitles. [1:45]"
Barbershop , 2002 , PG-13 ,3,3,5,"Comedy with Ice Cube as a man who inherits a struggling barber shop on the south side of Chicago from his father, sells it to a local loan shark, and begins to regret it when he misses the eccentric, colorful characters for whom the barbershop was a second home. Also with Anthony Anderson, Cedric the Entertainer, Sean Patrick Thomas and Troy Garity. [1:42]"
Barbershop: The Next Cut , 2016 , PG-13 ,4,4,5,"After more than a decade the South Side Chicago barbershop is now a unisex salon with both men (Ice Cube and Cedric the Entertainer) and women (Nikki Minaj, Regina Hall and Eve) employees. The men and women stylists argue good naturedly, but decide to work together to stop the rising violence in their neighborhood. Also with Anthony Anderson, JB Smoove and Common. Directed by Malcolm D. Lee. [1:52]"
Barbershop 2: Back In Business , 2004 , PG-13 ,4,4,5,"Calvin (Ice Cube), his friends, family and co-workers are back at his barbershop, and this time around he's married and has a young baby. He also has a business decision to make: A large hair care salon looms across the street from his more modest tonsorial establishment, and urban developers want to replace small stores with name-brand chains. Should he give into progress and sell, or should he hold onto what's left of the community his father helped build? Also with Cedric the Entertainer, Garcelle Beauvais and Queen Latifah. Directed by Kevin Rodney Sullivan. [1:56]"
Barb Wire , 1996 , R ,5,8,7,Pamela Anderson is a tough woman in a tough future world where a pair of contact lenses are of the utmost importance.
Barney's Great Adventure: The Movie , 1998 , G ,0,1,0,The big purple dinosaur takes his friends on an adventure designed to make their dreams come true.
Barnyard: The Original Party Animals , 2006 , PG ,2,5,1,"In this animated comedy, when the humans turn their backs, the barnyard animals take on human characteristics, and are able to speak, walk on two legs, drive cars, party and plan as a community. Their leader is Ben, a male cow, who has to contend with his son Otis, who would rather have a good time than be responsible. But when Ben is killed by coyotes, Otis is left in charge. With the voices of Kevin James, Courteney Cox Arquette, Danny Glover, Sam Elliott and Wanda Sykes. Directed by Steve Oedekerk. [1:30]"
BASEketball , 1998 , R ,5,5,7,"Trey Parker and Matt Stone become stars when a game they invented is turned into a professional sport. Also with Yasmine Bleeth, Jenny McCarthy, Ernest Borgnine, Robert Vaughn, Dian Bachar, Bob Costas, Al Michaels, Robert Stack, Dan Patrick, Reggie Jackson and Kenny Mayne. [1:43]"
Basic , 2003 , R ,5,8,10,"Agent Hardy (John Travolta), an ex-Ranger turned DEA agent is called to interrogate the two men who made it out alive after a Ranger training exercise went terribly wrong. The exercise was led by a hard-nosed commander (Samuel L. Jackson) who took six Rangers into the jungles of Panama during a hurricane. Also with Connie Nielsen, Harry Connick Jr. and Taye Diggs. [1:35]"
Basic Instinct 2 , 2006 , R ,9,7,6,"Sharon Stone reprises her role as a best-selling crime novelist who may also be a serial killer who uses sex as a lure. Since the first film, she has relocated from San Francisco to London and she becomes the patient of a straitlaced criminal psychiatrist, who's assigned to her by a Scotland Yard detective who thinks she has killed a sports star. Then more people turn up dead. Also with David Morrissey, Charlotte Rampling, David Thewlis and Hugh Dancy. Directed by Michael Caton-Jones. [1:54]"
Basil , 1998 , R ,4,5,0,"Jared Leto is a young man who deceives his wealthy, snobbish father so he can be with the lower-class woman he loves and still receive his large inheritance. Also with Christian Slater, Claire Forlani, Stephanie Bagshaw, Crispin Bonham Carter, Carli Harris, Derek Jacobi, Joanna John, Georgiana Johnson, Jackson Leach, Christopher Owen and David Ross. [1:53]"
The Basketball Diaries , 1995 , R ,6,7,7,Chronicles how author Jim Carroll transformed himself into a drug addict and hustler. Leonardo DiCaprio stars.
Batman and Robin , 1997 , PG-13 ,2,5,3,"The caped crusader is back battling villains Poison Ivy and Mr. Freeze. George Clooney puts on the spandex this time out. Also with Arnold Schwarzenegger, Chris O'Donnell, Uma Thurman and Alicia Silverstone."
Batman Begins , 2005 , PG-13 ,2,6,3,"Director Christopher Nolan explores the origins of the Batman legend: When his parents are murdered, heartbroken and angry, Bruce Wayne (Christian Bale) travels to the far East seeking ways to fight crime and injustice. He returns to Gotham City and becomes the infamous masked and mysterious crusader. Liam Neeson, Katie Holmes, Ken Watanabe, Cillian Murphy, Morgan Freeman and Michael Caine. [2:14]"
Batman Forever , 1995 , PG-13 ,2,5,2,"Val Kilmer is Batman and Chris O'Donnell is his sidekick Robin in the third ""Batman"" film. The enemies are Harvey Two-Face (Tommy Lee Jones) and The Riddler (Jim Carrey)."
Batman: Mask of the Phantasm , 1994 , PG ,1,4,0,"Spin-off of the Fox Network's ""Batman: The Animated Series."" The villain is The Phantasm, a vigilante who cuts a silhouette that's similar to the Dark Knight's."
Batman Returns , 1992 , PG-13 ,2,4,2,"Michael Keaton reprises his role as the caped crusader. The plot sets The Penguin (Danny DeVito) as an embittered half-human, half-penguin creature out to control Gotham and destroy Batman, with the help of Christopher Walken as a Gotham power broker and Michelle Pfeiffer as a leather-and-whips, man-hating machine dubbed the Catwoman."
Batman v Superman: Dawn of Justice , 2016 , PG-13 ,3,6,3,"Superman (Henry Cavill) considers Batman (Ben Affleck) to be nothing more than a violent vigilante and Batman considers Superman's almost unlimited powers to be a threat to humanity. Lex Luthor (Jesse Eisenberg) takes advantage of their mutual antipathy and with a little kryptonite tries to get them to destroy each other. Also with Amy Adams, Diane Lane, Gal Gadot, Laurence Fishburne, Jeremy Irons and Holly Hunter. Directed by Zack Snyder. [2:33]"
Bats , 1999 , PG-13 ,1,6,5,"Two bat experts and a local sheriff try to stop thousands of bats who've become killing machines due to a scientific experiment gone awry. With Lou Diamond Phillips, Dina Meyer, León, Carlos Jacott, Bob Gunton and James Sie. [1:30]"
Battlefield Earth , 2000 , PG-13 ,2,6,3,"In 3000 AD a small group of humans rise up against a ruthless band of aliens who rule Earth after an invasion that left the planet's inhabitants either dead or enslaved. Based on a novel by Scientology founder L. Ron Hubbard. With John Travolta, Barry Pepper, Forest Whitaker, Kim Coates, Sabine Karsenti, Richard Tyson, Marie-Josée Croze, Sean Hewitt, Michel Perron, Shaun Austin-Olsen, Michael Byrne, Christian Tessier and Kelly Preston. [1:57]"
Battle for Terra , 2009 , PG ,1,4,1,"When a space vessel carrying the few remaining humans after Earth was rendered uninhabitable arrives at Terra, they decide to transform its atmosphere and move in. They consider the native inhabitants, the Terrians, who have lived in peace for many generations and have little knowledge of warfare, as expendable (Terrians have large heads and eyes and move as if they are swimming; they do not have feet or legs and look like dolphins). With the voices of Justin Long, Evan Rachel Wood, Brian Cox, James Garner, Chris Evans, Danny Glover, Amanda Peet, David Cross, Dennis Quaid, Luke Wilson, Rosanna Arquette, Ron Perlman and Danny Trejo. Directed by Aristomenis Tsirbas. [1:25]"
Battle in Seattle , 2008 , R ,3,5,9,"Inspired by true events, the film documents the public protest at the World Trade Organization meetings held in Seattle, Washington in 1999. The protest lasted for five days, as tens of thousands of demonstrators took to the streets. With Charlize Theron, Andre 'Andre 3000' Benjamin, Martin Henderson, Woody Harrelson, Ray Liotta, Michelle Rodriguez, Channing Tatum, Ivana Milicevic and Tzi Ma. Directed by Stuart Townsend. [1:38]"
