movie_title,movie_year,movie_rating,sex_nudity,violence_gore,language,movie_description
The Aristocrats , 2005 , NR ,10,6,10,"A multitude of professional comedians discuss the success of an old vaudeville routine titled ""The Aristocrats"" -- which has been called the world's dirtiest joke -- and to analyze the reason for its long life. They also share their renditions of the joke, and try to outdo each other in creating the most outrageous version by employing extreme sexual and violent imagery. With Penn Jillette, George Carlin, Whoopi Goldberg, Drew Carey, Gilbert Gottfried, Bob Saget, Paul Reiser, Sarah Silverman, Robin Williams, Teller, Phyllis Diller, et al. Directed by Paul Provenza. [1:26]"
Arlington Road , 1999 , R ,2,7,5,"A college professor who teaches a course on domestic terrorism begins to suspect that his seemingly normal neighbors are planning a deadly attack. With Jeff Bridges, Tim Robbins, Joan Cusack, Hope Davis, Robert Gossett, Spencer Treat Clark, Mason Gamble, Stanley Anderson and Mary Ashleigh Green. [2:00]"
Armageddon , 1998 , PG-13 ,3,5,6,A group of men try to save the earth from an asteroid. With Bruce Willis and Ben Affleck.
Armored , 2009 , PG-13 ,1,6,5,"A group of armored car guards plans what they think is the perfect crime, which will involve ""no bad guys."" When the heist goes wrong and a man is killed, the group begins to turn on each other. With Matt Dillon, Jean Reno, Laurence Fishburne, Amaury Nolasco, Fred Ward, Milo Ventimiglia, Skeet Ulrich, Columbus Short and Andre Jamal Kinney. Directed by Nimrod Antal. [1:25]"
Army of Darkness , 1993 , R ,1,7,5,"Part comedy and part horror movie, about a present-day man (Bruce Campbell) who goes back in time to the middle ages, and finds himself fighting an army of monsters."
Around the Bend , 2004 , R ,4,5,6,"When a man (Michael Caine) dies he leaves his surviving family members -- his son (Christopher Walken), his grandson (Josh Lucas) and his great grandson (Jonah Bobo) -- a map and instructions for how he wants his ashes to be distributed. Thus, they embark on a journey that takes them through painful memories of their lives and brings them closer together and more in touch with themselves. Also with Glenne Headly. Directed by: Jordan Roberts. [1:25]"
Around the World in 80 Days , 2004 , PG ,3,4,3,"Very loosely based on the Jules Verne classic tale set in 1872: Verne's hero Phileas Fogg is no longer merely an English gentleman but an English gentleman inventor (Steve Coogan), his resourceful valet Passepartout is not French but a Chinese thief (Jackie Chan) who wants to restore a valuable jade Buddha to his village, and the Indian princess is discarded as a character for a French artist (Cécile De France) who wants to see the world -- and becomes Fogg's love interest. The three embark on a journey around the world in a mere 80 days in order to win a wager. Also with Jim Broadbent, Kathy Bates, Arnold Schwarzenegger, Robert Fyfe and John Cleese. Directed by Frank Coraci. [2:00]"
The Arrival , 1996 , PG-13 ,3,4,5,Charlie Sheen discovers an alien conspiracy to take over the Earth.
Arrival , 2016 , PG-13 ,1,3,5,"UFOs land in 12 nations around the world and the US Army uses a linguist to attempt to decipher the language of the seven-legged alien visitors. As governments of the remaining nations cut communications with America, the linguist and a scientist (Jeremy Renner) study the alien language to prevent global destruction, and encounter a unique perspective regarding time. Also with Forest Whitaker, Michael Stuhlbarg, Mark O'Brien and Tzi Ma. Directed by Denis Villeneuve. English subtitles accompany several lines of alien symbols, a few phrases are spoken in Russian and Chinese without translations. [1:57]"
Arthur , 2011 , PG-13 ,6,5,4,"When a perpetually inebriated millionaire playboy (Russell Brand) is forced by his mother (Geraldine James) to either marry a woman he does not love (Jennifer Garner) or lose his fortune, he finds himself in a difficult situation that is made worse when he falls in love with another woman (Greta Gerwig). A remake of the eponymous 1981 film. Also with Helen Mirren, Luis Guzman and Nick Nolte. Directed by Jason Winer. [1:50]"
Arthur Christmas , 2011 , PG ,1,3,1,"On Christmas Eve, Santa (voiced by Jim Broadbent) delivers presents to all the children of the world, while his son Arthur (James McAvoy) works at the North Pole Post Office answering letters from the kids. When Santa, his older son (Hugh Laurie) and Grandsanta (Bill Nighy) fight over the role of Santa Claus, and an elf finds an undelivered present in the workshop, it's up to Arthur to find a way to deliver the present on time. Also with the voices of Ramona Marquez, Imelda Staunton, Ashley Jensen, Will Sasso, Laura Linney, Ian McKee, Joan Cusak, Robbie Coltrane and Michael Palin. Directed by Sarah Smith. [1:37]"
Article 99 , 1992 , R ,1,6,5,"Ray Liotta leads in this ""Catch 22"" wannabe, set in a VA hospital known more for its red tape than for its health care, where doctors have to adopt an underground-style bedside manner."
The Artist , 2011 , PG-13 ,2,3,3,"A very popular silent movie star (Jean Dujardin) finds it difficult to transition to talking movies when the new craze arrives. But with the help of a few friends he manages to get through. Also with Bérénice Béjo, John Goodman, James Cromwell and Penelope Ann Miller. Directed by Michel Hazanavicius. A large majority of the film is silent with occasional subtitles and accompanied by music. [1:40]"
The Art of Getting By , 2011 , PG-13 ,4,3,5,"An artistic but fatalistic teen (Freddie Highmore) enters his senior year of high school without completing any actual work. That's when he meets a popular girl (Emma Roberts) and his life becomes even more complicated. Also with Michael Angarano, Sash Spielberg, Blair Underwood, Rita Wilson and Alicia Silverstone, Directed by Gavin Wiesen. [1:24]"
The Art of War , 2000 , R ,6,7,7,"Wesley Snipes stars as a covert United Nations operative framed for murder who has to clear his name, make sure a trade agreement with China is signed, and catch the bad guys too. With Marie Matiko, Anne Archer, Donald Sutherland, Michael Biehn, Cary-Hiroyuki Tagawa and James Hong. [2:00]"
Art School Confidential , 2006 , R ,7,6,10,"John Malkovich stars as an art professor, and Max Minghella as an aspiring art student attending a prestigious art school. When he arrives he is full of hope and anticipation and has aspirations of becoming the greatest artist in the world. His dreams are soon dashed when he sees another student with seemingly no talent attracting a great deal of attention. Also with Sophia Myles, John Malkovich, Jim Broadbent, Anjelica Huston and Matt Keeslar. Directed by Terry Zwigoff. [1:42]"
"As Above, So Below ", 2014 , R ,2,7,9,"An urban archaeologist (Perdita Weeks) seeks the key to immortality: Drawn to the Catacombs of Paris, she enlists the help of two men (Ben Feldman and Edwin Hodge) to hunt for a magic relic. Also with Francois Civil, Marion Lambert and Ali Marhyar. Directed by John Erick Dowdle. Some dialogue is in foreign languages (French and Middle Eastern tongues) without subtitles. [1:33]"
As Good As It Gets , 1997 , PG-13 ,3,6,6,"A cold-hearted cynic (Jack Nicholson) learns to warm up, with a little help from a lonely waitress (Helen Hunt) and a battered gay neighbor (Greg Kinnear)."
As I Lay Dying , 2013 , R ,6,5,3,"Based on the William Faulkner novel, the death of Addie Bundren brings together a ragged family as they try to honor her wishes to be buried in a nearby town. With James Franco, Tim Blake Nelson, Jim Parrack, Ahna O'Reilly and Danny McBride. Directed by James Franco. [1:50]"
Ask the Dust , 2006 , R ,7,4,5,"Colin Farrell stars as a man of Italian descent who travels to Los Angeles during the 1930s, hoping to make a name for himself as a writer; and Salma Heyek stars as a struggling Hispanic woman working in a local diner. The two meet and struggle with their feelings for each other, their own identities and their lack of success in a world rife with racism. Also with Donald Sutherland, Charlie Hunnam and Eileen Atkins. Directed by Robert Towne. [1:47]"
Aspen Extreme , 1993 , PG-13 ,4,3,3,"Boy meets two girls, becomes involved with the wrong one and learns life lesson and discovers it's the other girl who is really best for him."
The Assassination of Jesse James by the Coward Robert Ford , 2007 , R ,4,7,4,"Western about the last days of Jesse James (Brad Pitt). Along with his brother Frank, Jesse is the only other James who's not dead or in prison, and so has to enlist the help of outsiders in order to continue robbing. While he also has to battle all those who are trying to capture him and collect a reward, he doesn't realize that the real danger to his life may lurk closer to him. Also with Casey Affleck, Sam Shepard, Mary-Louise Parker, Jeremy Renner. Directed by Andrew Dominik. [2:40]"
Assassins , 1995 , R ,1,6,7,"Sylvester Stallone and Antonio Banderas star as two feuding hitmen, with Julianne Moore caught in the middle of the power struggle."
Assassin's Creed , 2016 , PG-13 ,1,6,5,"Based on the popular video game: A man (Michael Fassbender) is persuaded to embark in a program that will allow him to connect with his ancestors from 1492 in order to track down an item that is thought to contain the secret by which violence among humans can be eliminated. Also with Marion Cotillard, Jeremy Irons, Brendan Gleeson, Charlotte Rampling, Michael Kenneth Williams, Denis Ménochet, Ariane Labed, Khalid Abdalla and Essie Davis. Directed by Justin Kurzel. Several lines of dialogue are in Spanish with English subtitles. [2:20]"
Assault on Precinct 13 , 2005 , R ,4,8,10,"Remake of the 1976 John Carpenter film, with Ethan Hawke as the sergeant in charge of Precinct 13, a police station that's due to shut down: It is New Year's Eve, the station's last night of operation, a heavy snowstorm rages outside, and the staff plans a party. But soon officers and prisoners must band together to defend themselves from an attack by a heavily armed gang that wants to get to a mobster who's incarcerated in the station. Also with Laurence Fishburne, Maria Bello, John Leguizamo and Drea de Matteo. Directed by Jean-François Richet. [1:49]"
The Associate , 1996 , PG-13 ,4,1,3,Whoopi Goldberg finds out it's a man's world so she invents a male partner and hits it big on Wall Street.
Astro Boy , 2009 , PG ,1,4,1,"A brilliant scientist, who has developed a robot technology that he envisions being used to help humanity, is convinced to share his creation with a power-hungry politician who wants to use robots as a weapon. When the scientist's young son is killed during the testing, he is determined to build a new robotic boy in his likeness. But he realizes that seeing the boy robot only makes his grief deeper, and the boy robot ends up abandoned in a junkyard where he befriends humans left behind when almost everyone abandoned the planet surface for a spiffy new home hovering in the sky. With the voices of Freddie Highmore, Nicolas Cage, Charlize Theron, Donald Sutherland, Kristen Bell, Nathan Lane, Bill Nighy, Eugene Levy, Matt Lucas and Samuel L. Jackson. Directed by David Bowers. [1:34]"
The Astronaut Farmer , 2007 , PG ,1,3,3,"A man (Billy Bob Thornton) who was part of the NASA space program and slated to go to the moon, had to drop out when his father died, in order to save the family farm. Years later his aspiration to be an astronaut is not diminished and he continues to plan to launch himself into space. Also with Virginia Madsen, Bruce Willis, Bruce Dern and Tim Blake Nelson. Directed by Michael Polish. [1:44]"
The Astronaut's Wife , 1999 , R ,5,5,6,"The wife of a celebrated NASA astronaut (who inexplicably lost contact with his ship for two minutes during his last mission) begins to suspect something is horribly wrong with her husband and the twins she's carrying. With Johnny Depp, Charlize Theron, Nick Cassavetes, Blair Brown, Joe Morton, Donna Murphy, Tom Noonan, Clea DuVall, Dawn Landon, Cole Sprouse, Dylan Sprouse and Conrad Bachmann. [1:45]"
At Any Price , 2013 , R ,6,5,6,"The relationship of a workaholic farmer and his son (Dennis Quaid and Zac Efron) is strained as the family's farm comes under threat: The agribusiness trend of using only patented seeds may put the family out of business, as well as lead to intrigue, mayhem and death. Also with Kim Dickens, Heather Graham, Clancy Brown, Maika Monroe and Red West. Directed by Ramin Bahrani. [1.45]"
The A-Team , 2010 , PG-13 ,4,7,5,"Based on the hit 1980s television series, about a team of elite US Rangers, who are wrongly accused of treasonous crimes and become soldiers of fortune: Hannibal (Liam Neeson), Face (Bradley Cooper), Baracus (Quinton ""Rampage"" Jackson) and Murdock (Sharlto Copley) band together to clear their names and set things right again. Also with Jessica Biel and Patrick Wilson. Directed by Joe Carnahan. [1:57]"
At First Sight , 1999 , PG-13 ,5,1,3,"Val Kilmer plays a blind man who's convinced by his new girlfriend, Mira Sorvino, to undergo experimental sight-restoration surgery. Based on a true story by Oliver Sachs, M.D. Also with Kelly McGillis, Nathan Lane and Steven Weber. [2:08]"
ATL , 2006 , PG-13 ,6,4,5,"Several young men growing up in Mechanicsville, Georgia, a working class Atlanta neighborhood, struggle to make ends meet, find love, survive on the right side of the law and prepare for a roller skating competition. With Tip ""T.I."" Harris, Lauren London, Antwan ""Big Boi"" Patton, Mykelti Williamson and Keith David. Directed by Chris Robinson. [1:45]"
Atlantis: The Lost Empire , 2001 , PG ,2,4,2,"Animated Disney film about an explorer who gets a map to the lost city of Atlantis. Along with a motley submarine crew he sets out to find the mysterious, lost city. With the voices of Michael J. Fox, James Garner, Claudia Christian, Jim Varney and John Mahoney. The introductory scene and a later scene are in ""Atlantian"" with English subtitles. [1:33]"
Atlas Shrugged: Part I, 2011 , PG-13 ,7,2,4,"The first part of a planned three part treatment of the eponymous 1957 novel by Ayn Rand: A powerful railroad executive (Taylor Schilling) struggles to keep her family business afloat as the worldwide economy sinks and society is in peril. Also with Nick Cassavetes, Grant Bowler, Paul Johansson, and Matthew Marsden. Directed by Paul Johansson. [1:42]"
Atlas Shrugged: Part II , 2012 , PG-13 ,4,3,3,"Part 2 of the dramatization of the Ayn Rand novel: A railroad executive (Samantha Mathis) has what she believes could be the ultimate power source and must find a scientist to evaluate it and make it work. The only trouble is that the scientists keep disappearing. Also with Jason Beghe, Esai Morales, Patrick Fabian, Kim Rhodes, Richard T. Jones, D.B. Sweeney, Paul McCrane, John Rubinstein, Robert Picardo, Ray Wise and Diedrich Bader. Directed by John Putch. [1:52]"
ATM , 2012 , R ,1,7,5,"Three co-workers (Alice Eve, Josh Peck and Brian Geraghty) leave an office Christmas party and make a stop at an ATM booth on their way home. They soon find themselves trapped inside when a menacing man stands guard in the parking lot with apparently violent intent. Also with Aaron Hughes, Omar Khan and Will Woytowich. Directed by David Brooks. [1:30]"
Atonement , 2007 , R ,7,8,6,"Set in 1935, the disastrous effects of a lie are played out in the lives of a young man and a young woman (James McAvoy and Keira Knightley), who are in love but are kept from finding happiness together. Also with Saoirse Ronan, Brenda Blethyn and Vanessa Redgrave. Directed by Joe Wright. [2:02]"
The Attack , 2013 , R ,6,6,5,"Based on the popular novel of the same name by Yasmina Khadra, a well-respected Arab surgeon (Ali Suliman) living in Tel Aviv learns a dark secret about his wife after a suicide bombing attack. Also with Reymond Amsalem, Uri Gavriel and Evgenia Dodena. Directed by Ziah Douerir. [1:42]"
Attack the Block , 2011 , R ,3,8,10,"Several teen boys in South London team up with a bumbling drug dealer (Nick Frost) and a neighbor (Jodie Whittaker) to defend their block against an alien invasion. Also with Alex Esmail, John Boyega and Luke Treadaway. Directed by Joe Cornish. [1:28]"
August: Osage County , 2013 , R ,3,4,7,"Family members come together in their Oklahoma childhood home after the disappearance of their father. The toxic environment, now presided over by their mother (Meryl Streep), brings out their complicated secrets. Also with Julia Roberts, Chris Cooper, Ewan McGregor, Margo Martindale, Sam Shepard, Dermot Mulroney, Julianne Nicholson, Juliette Lewis, Abigail Breslin, Benedict Cumberbatch and Misty Upham. Directed by John Wells. [2:01]"
August Rush , 2007 , PG ,2,4,3,"""August Rush"" is the stage name of an 11-year-old musical prodigy (Freddie Highmore), who lives in an orphanage. His parents, an Irish rock guitarist (Jonathan Rhys Meyers) and a virtuoso cellist (Keri Russell), don't know he's alive, and are not together, but the boy feels certain that if he makes enough great music, his parents will be able to find him. Meanwhile, he runs away and ends up under the care of an aging street performer Wizard (Robin Williams) who takes advantage of his talent to make money. Directed by Kirsten Sheridan. [1:53]"
Austenland , 2013 , PG-13 ,5,4,3,"After a lifetime of idealizing Jane Austen's novels, a woman (Keri Russell) takes a dream vacation to a theme park in search of her own Mr. Darcy. Also with JJ Feild, Jennifer Coolidge, Bret McKenzie, Georgia King, James Callis, Jane Seymour and Ricky Whittle. Directed by Jerusha Hess. [1:37]"
Austin Powers in Goldmember , 2002 , PG-13 ,6,4,6,"Austin Powers (Mike Myers) battles Dr. Evil once again. This time he time-travels back to 1975 to foil Dr. Evil's plot to flood the Earth. While in 1975, Powers teams up with Foxxy Cleopatra (Beyonce Knowles) and Dr. Evil kidnaps Powers' father (played by Michael Caine). There are many cameos by Hollywood stars, including Tom Cruise, John Travolta, Gwyneth Paltrow, and others. Also with Verne Troyer, Mindy Sterling, Robert Wagner, Michael York and Seth Green. [1:34]"
Austin Powers: International Man of Mystery , 1997 , PG-13 ,4,3,5,Mike Myers is a super spy who was frozen during the '60s and has now been thawed out in order to fight crime in the '90s.
Austin Powers: The Spy Who Shagged Me , 1999 , PG-13 ,6,5,5,"In this sequel, Dr. Evil travels back to the 60s to steal Austin Powers' mojo, so of course, Austin must follow and reclaim his shagadelic strength. With Mike Myers, Heather Graham, Robert Wagner, Gia Carides, Seth Green, Kristen Johnston, Rob Lowe, Clint Howard, Mindy Sterling, Scott Cooper, Verne Troyer, Mitch Rouse, Elizabeth Hurley, Will Ferrell, Rebecca Romijn-Stamos and Jerry Springer. [1:35]"
Australia , 2008 , PG-13 ,6,7,5,"Set in northern Australia before World War II: Nicole Kidman stars as a headstrong aristocrat who travels to Australia to find out what her husband has been doing on his cattle ranch for so many months without her. She learns upon arrival that her husband has been murdered and she must now decide whether to try to save the struggling enterprise or sell to an unscrupulous competitor. At the same time, she becomes the guardian of an Aboriginal boy whom she tries to protect from the state police, which is shipping Aboriginal children to an island for ""assimilation."" Also with Hugh Jackman, David Wenham, Bryan Brown, Jack Thompson, Barry Otto, Shea Adams, Eddie Baroo and David Gulpilil. Directed by Baz Luhrmann. [2:35]"
Auto Focus , 2002 , R ,9,4,7,"Biopic about the life, death and sexual obsessions of ""Hogan's Heroes"" star Bob Crane, based on the book, ""The Murder of Bob Crane"" by Robert Graysmith: After ""Hogan's Heroes"" was cancelled, Crane (Greg Kinnear) became obsessed with videotaping sex acts, and teamed up with a video technician (Willem Dafoe). Eventually, he was murdered in 1978, his skull crushed by a camera tripod, and the prime suspect was his video taping collaborator. Also with Maria Bello, Marieh Delfino and Kurt Fuller. [1:47]"
Autumn in New York , 2000 , PG-13 ,4,1,5,"In this melodrama, Richard Gere plays an older man who falls in love with a younger woman who's dying (Winona Ryder). Also with Vera Farmiga, Jamie Harrold, Anthony LaPaglia and Sherry Stringfield. [1:45]"
Autumn Tale , 1999 , PG ,2,1,1,"Concluding work of Eric Rohmer's Season Cycle: Friends of a busy but lonely winegrower try to find the perfect man for her. With Marie Riviere, Beatrice Romand, Alain Libolt, Didier Sandre, Alexia Portal, Stephane Darmon, Aurelia Alcais, Matthieu Davette and Yves Alcais. In French with English subtitles. [1:50]"
Avatar , 2009 , PG-13 ,5,7,4,"Sci-fi epic set in the year 2154: Humanity has exhausted the Earth and are now mining planet Pandora, which has its own humanoid species, the peaceful Na'vi. A paraplegic war veteran (Sam Worthington) accepts as his mission to infiltrate the native population by assuming a genetically engineered Na'vi avatar, and soon finds his loyalty to his own species challenged. Also with Zoe Saldana, Sigourney Weaver, Stephen Lang, Michelle Rodriguez, Giovanni Ribisi and Joel David Moore. Directed by James Cameron. [2:41]"
The Avengers , 2012 , PG-13 ,2,7,3,"When a blue cube opens a door to other worlds and the evil deity Loki (Tom Hiddleston) comes through and starts turning humans into his minions, Iron Man (Robert Downey Jr.), the Incredible Hulk (Mark Ruffalo), Thor (Chris Hemsworth), Captain America (Chris Evans) and other superheroes come together to protect humanity. Also with Scarlett Johansson, Jeremy Renner, Tom Hiddleston, Clark Gregg, Cobie Smulders, Stellan Skarsgård, Samuel L. Jackson, Gwyneth Paltrow and Paul Bettany. Directed by Joss Whedon. [2:22]"
Avengers: Age of Ultron , 2015 , PG-13 ,3,6,3,"The Avengers unite to face a formidable foe and find themselves struggling with their own inner demons along the way. Also with Robert Downey Jr., Chris Hemsworth, Mark Ruffalo, Chris Evans, Scarlett Johansson, Jeremy Renner, James Spader, Samuel L. Jackson, Don Cheadle, Elizabeth Olsen, Paul Bettany, Cobie Smulders, Anthony Mackie and Hayley Atwell. Directed by Joss Whedon. [2:21]"
Avengers: Infinity War , 2018 , PG-13 ,2,7,4,"The universe is threatened by Thanos (Josh Brolin), a powerful entity that's determined to acquire omnipotence and bring balance everywhere by wiping out whole planets and civilizations. Hence, it's all-hands-on-deck for most of the Marvel superheroes determined to protect Earth and everyone else. Also with Karen Gillan, Elizabeth Olsen, Tom Holland, Chadwick Boseman, Scarlett Johansson, Chris Evans, Chris Hemsworth, Sebastian Stan, Linda Cardellini, Pom Klementieff, Zoe Saldana, Robert Downey Jr., Tom Hiddleston, Chris Pratt, Benedict Cumberbatch, Vin Diesel, Letitia Wright, Idris Elba, Danai Gurira, Paul Bettany, Jeremy Renner, Dave Bautista, Paul Rudd, Benicio Del Toro, Kerry Condon, Bradley Cooper, Jon Favreau, Gwyneth Paltrow, Peter Dinklage, Mark Ruffalo, Angela Bassett, Michael Douglas, Carrie Coon, Sean Gunn, Winston Duke, Anthony Mackie, Benedict Wong, Don Cheadle, Florence Kasumba and Jacob Batalon. Directed by Anthony & Joe Russo. [2:29]"
The Aviator , 2004 , PG-13 ,5,6,5,"Leonardo DiCaprio stars as the aviation pioneer and prominent industrialist Howard Hughes, who took Hollywood by storm with his ""Hell's Angels"" film and the world of aviation by designing innovative airplanes. The biopic, directed by Martin Scorsese, concentrates on Hughes' years from the late 1920s through the 1940s. Also with Alan Alda, Alec Baldwin, Kate Beckinsale and Cate Blanchett. [2:48]"
AVPR: Aliens vs Predator - Requiem , 2007 , R ,5,9,5,"The Alien and Predator monsters from the two film franchises meet on Earth once more and duke it out over planetary domination. This time the victims are the residents of an unsuspecting Colorado town. With Steven Pasquale, Reiko Aylesworth, John Ortiz, Johnny Lewis, Ariel Gade and Kristen Hager. Directed by Colin Strause and Greg Strause. [1:26]"
Awake , 2007 , R ,6,7,7,"A wealthy young man (Hayden Christensen) who suffers from heart disease and is waiting for a heart transplant, is in love with his mother's (Lena Olin) personal assistant (Jessica Alba) but is afraid that his mother will disown him if they get married. When the young couple elopes, a heart also becomes available and the young man is whisked off for surgery. However, the anesthesia does not put him under and he remains completely conscious while paralyzed and incapable of communicating with anyone; he also realizes that there is something sinister going on. Also with Terrence Howard and Sam Robards. Directed by Joby Harold. [1:24]"
The Awakening , 2012 , R ,6,7,2,"After the end of WWI, a woman (Rebecca Hall) is motivated by grief to try and debunk sightings of a child ghost at a boarding school. But her life starts unraveling when an apparition becomes evident. Also with Dominic West, Imelda Staunton and Cal Macaninch. Directed by Nick Murphy. [1:47]"
Away We Go , 2009 , R ,8,2,6,"An unmarried couple (Maya Rudolph and John Krasinski) becomes pregnant and they travel around the country visiting friends and family while looking for a new city where they can raise their child. Also with Catherine O'Hara, Jeff Daniels, Carmen Ejogo, Allison Janney, Jim Gaffigan, Maggie Gyllenhaal, Josh Hamilton and Chris Messina. Directed by Sam Mendes. [1:38]"
